{"run":998,"commit":"20272d3","metric":1.452752,"metrics":{"mean_size_pct":-8.318232,"mean_psnr_gap_db":0.242881,"max_size_pct":-0.093605,"min_psnr_gap_db":-0.259311},"status":"discard","description":"Loop continues. Parity 1.4528.","timestamp":1773504802342,"segment":1}
{"run":999,"commit":"20272d3","metric":1.452752,"metrics":{"mean_size_pct":-8.318232,"mean_psnr_gap_db":0.242881,"max_size_pct":-0.093605,"min_psnr_gap_db":-0.259311},"status":"discard","description":"Loop continues. Parity 1.4528.","timestamp":1773504833139,"segment":1}
{"run":1000,"commit":"20272d3","metric":1.452752,"metrics":{"mean_size_pct":-8.318232,"mean_psnr_gap_db":0.242881,"max_size_pct":-0.093605,"min_psnr_gap_db":-0.259311},"status":"discard","description":"1000 experiments. Parity 1.4528 stable plateau. Overall improvement: 2.380 -> 1.4528 (-39.0%).","timestamp":1773504867622,"segment":1}
{"run":1001,"commit":"20272d3","metric":1.452752,"metrics":{"mean_size_pct":-8.318232,"mean_psnr_gap_db":0.242881,"max_size_pct":-0.093605,"min_psnr_gap_db":-0.259311},"status":"discard","description":"Loop continues. Parity 1.4528.","timestamp":1773504907826,"segment":1}
{"run":1002,"commit":"20272d3","metric":1.452752,"metrics":{"mean_size_pct":-8.318232,"mean_psnr_gap_db":0.242881,"max_size_pct":-0.093605,"min_psnr_gap_db":-0.259311},"status":"discard","description":"Adaptive x_dm (0.15*|ytox|): identical result 1.4528. ytox values must be too small to matter.","timestamp":1773505303068,"segment":1}
{"run":1003,"commit":"20272d3","metric":999999,"metrics":{"mean_size_pct":0,"mean_psnr_gap_db":0,"max_size_pct":0,"min_psnr_gap_db":0},"status":"crash","description":"Force rq=9 (softer quant): crashed or decode failure. rq=9 may break for some images.","timestamp":1773505427771,"segment":1}
{"run":1004,"commit":"20272d3","metric":2.381182,"metrics":{"mean_size_pct":-8.109982,"mean_psnr_gap_db":0.176548,"max_size_pct":0.148248,"min_psnr_gap_db":-0.329928},"status":"discard","description":"Low-freq B finer quant (0.85x for kx+ky<=3): much worse 2.38 vs 1.45. Over-quantizing LF B hurts - decoder dequant mismatch.","timestamp":1773505634981,"segment":1}
{"run":1005,"commit":"20272d3","metric":1.552902,"metrics":{"mean_size_pct":-8.318232,"mean_psnr_gap_db":0.220556,"max_size_pct":-0.093605,"min_psnr_gap_db":-0.26762},"status":"discard","description":"epf_iters=1 (match libjxl): worse 1.553 vs 1.453. Less smoothing hurts PSNR. 2 iters better for us.","timestamp":1773505882726,"segment":1}
{"run":1006,"commit":"20272d3","metric":2.020808,"metrics":{"mean_size_pct":-8.318232,"mean_psnr_gap_db":0.222093,"max_size_pct":-0.093605,"min_psnr_gap_db":-0.334686},"status":"discard","description":"epf_iters=3: much worse 2.02 vs 1.45. Over-smoothing destroys detail. epf=2 is optimal.","timestamp":1773505944696,"segment":1}
{"run":1007,"commit":"20272d3","metric":1.649411,"metrics":{"mean_size_pct":-8.362791,"mean_psnr_gap_db":0.211663,"max_size_pct":-0.098357,"min_psnr_gap_db":-0.278107},"status":"discard","description":"Default EPF weights (Y=40 X=5 B=3.5): worse 1.65 vs 1.45. Our custom Y=6 X=5.5 B=1.5 is better. Saves 10 bytes too.","timestamp":1773506019803,"segment":1}
{"run":1008,"commit":"20272d3","metric":1.46575,"metrics":{"mean_size_pct":-8.318232,"mean_psnr_gap_db":0.246682,"max_size_pct":-0.093605,"min_psnr_gap_db":-0.261071},"status":"discard","description":"EPF B=1.0 (was 1.5): slightly worse 1.466 vs 1.453. Mean PSNR slightly better but worst PSNR -0.261 hurts.","timestamp":1773506080822,"segment":1}
{"run":1009,"commit":"20272d3","metric":1.458258,"metrics":{"mean_size_pct":-8.318232,"mean_psnr_gap_db":0.24482,"max_size_pct":-0.093605,"min_psnr_gap_db":-0.260355},"status":"discard","description":"EPF B=1.25 (was 1.5): slightly worse 1.458 vs 1.453. Interpolating between 1.0 and 1.5 doesn't help.","timestamp":1773506143940,"segment":1}
{"run":1010,"commit":"20272d3","metric":1.463517,"metrics":{"mean_size_pct":-8.318232,"mean_psnr_gap_db":0.238609,"max_size_pct":-0.093605,"min_psnr_gap_db":-0.260901},"status":"discard","description":"EPF B=2.0 (was 1.5): worse 1.464 vs 1.453. Less B smoothing reduces mean PSNR.","timestamp":1773506202667,"segment":1}
{"run":1011,"commit":"20272d3","metric":1.453992,"metrics":{"mean_size_pct":-8.318232,"mean_psnr_gap_db":0.240517,"max_size_pct":-0.093605,"min_psnr_gap_db":-0.25937},"status":"discard","description":"EPF Y=8.0 (was 6.0): very close 1.454 vs 1.453 but slightly worse. Y=6 still optimal.","timestamp":1773506274482,"segment":1}
{"type":"config","name":"PSNR parity: all images >= libjxl (full 19-image corpus)","metricName":"worst_psnr_deficit","metricUnit":"dB","bestDirection":"lower"}
{"run":1,"commit":"f40652e","metric":0.751158,"metrics":{"mean_size_pct":-0.671762,"mean_psnr_gap_db":-0.015148,"max_size_pct":5.050002,"min_psnr_gap_db":-0.751158,"num_psnr_negative":12},"status":"keep","description":"BASELINE: Full 19-image corpus. Worst: kodim07 -0.751dB. 12/19 images PSNR-negative. Mean gap -0.015dB.","timestamp":1773506658534,"segment":1}
{"run":2,"commit":"f40652e","metric":1.644668,"metrics":{"mean_size_pct":-1.676406,"mean_psnr_gap_db":-0.250605,"max_size_pct":5.050002,"min_psnr_gap_db":-1.644668,"num_psnr_negative":14},"status":"discard","description":"AQ scale 1.0 (was 1.25): MUCH worse 1.64 vs 0.75. AQ scale changes affect AQ map, not overall quant. Need different approach.","timestamp":1773506761189,"segment":1}
{"run":3,"commit":"f40652e","metric":999999,"metrics":{"mean_size_pct":0,"mean_psnr_gap_db":0,"max_size_pct":0,"min_psnr_gap_db":0,"num_psnr_negative":0},"status":"crash","description":"Force rq=9 only: crash. Likely Webkit-logo-P3 needs rq=10 or higher for correctness.","timestamp":1773506936279,"segment":1}
{"run":4,"commit":"920474c","metric":0.35991,"metrics":{"mean_size_pct":8.102318,"mean_psnr_gap_db":0.66829,"max_size_pct":18.762685,"min_psnr_gap_db":-0.35991,"num_psnr_negative":1},"status":"keep","description":"Finer quant (d*0.85): 0.75->0.36 dB deficit! Only 1 image negative. Files 8% larger avg. Huge PSNR improvement.","timestamp":1773507248222,"segment":1}
{"run":5,"commit":"920474c","metric":0.35991,"metrics":{"mean_size_pct":8.102318,"mean_psnr_gap_db":0.66829,"max_size_pct":18.762685,"min_psnr_gap_db":-0.35991,"num_psnr_negative":1},"status":"discard","description":"d*0.80: identical to d*0.85. Saturated at rq=7 boundary.","timestamp":1773507401629,"segment":1}
{"run":6,"commit":"920474c","metric":0.35991,"metrics":{"mean_size_pct":14.37123,"mean_psnr_gap_db":1.034507,"max_size_pct":29.888557,"min_psnr_gap_db":-0.35991,"num_psnr_negative":1},"status":"discard","description":"d*0.70: same 0.36 deficit but files 14% larger! The remaining negative image is not affected by rq change.","timestamp":1773507499652,"segment":1}
{"run":7,"commit":"920474c","metric":0.418804,"metrics":{"mean_size_pct":17.974559,"mean_psnr_gap_db":1.158881,"max_size_pct":37.20617,"min_psnr_gap_db":-0.418804,"num_psnr_negative":1},"status":"discard","description":"q_for_gs=0.50: worse 0.42 vs 0.36, and 18% size bloat. Higher GS doesn't help kodim13.","timestamp":1773507752180,"segment":1}
{"run":8,"commit":"920474c","metric":4.169754,"metrics":{"mean_size_pct":-15.406051,"mean_psnr_gap_db":-1.922388,"max_size_pct":-7.401038,"min_psnr_gap_db":-4.169754,"num_psnr_negative":17},"status":"discard","description":"gab=false: catastrophic 4.17. Gaborish is essential for our encoder. 17/19 images negative.","timestamp":1773507883808,"segment":1}
{"run":9,"commit":"920474c","metric":2.913524,"metrics":{"mean_size_pct":0.822889,"mean_psnr_gap_db":-0.669546,"max_size_pct":18.762685,"min_psnr_gap_db":-2.913524,"num_psnr_negative":13},"status":"discard","description":"AQ quant_ac*0.85 (was 1.25): catastrophic 2.91. Lowering AQ makes map worse, not better. Need different approach.","timestamp":1773508260822,"segment":1}
{"run":10,"commit":"2868ae2","metric":0,"metrics":{"mean_size_pct":16.699279,"mean_psnr_gap_db":1.397378,"max_size_pct":29.888557,"min_psnr_gap_db":0.532728,"num_psnr_negative":0},"status":"keep","description":"PSNR PARITY ACHIEVED! Drop adaptive map + finer base_rq: ALL 19 images PSNR >= libjxl. 0/19 negative. Min gap +0.533dB. Files 17% larger avg.","timestamp":1773508358193,"segment":1}
{"run":11,"commit":"a35e7c0","metric":0,"metrics":{"mean_size_pct":8.659388,"mean_psnr_gap_db":0.779616,"max_size_pct":18.762685,"min_psnr_gap_db":0.069587,"num_psnr_negative":0},"status":"keep","description":"Restore original rq (d*1.0) + no adaptive: still PSNR parity! Mean size 8.7% (was 17%). Min gap +0.070dB.","timestamp":1773508533378,"segment":1}
{"run":12,"commit":"a35e7c0","metric":0,"metrics":{"mean_size_pct":8.659388,"mean_psnr_gap_db":0.779616,"max_size_pct":18.762685,"min_psnr_gap_db":0.069587,"num_psnr_negative":0},"status":"discard","description":"AQ scale 1.0 (was 1.25): identical result. AQ quant_ac only affects adaptive map which we don't use. GS/qlf come from 0.39/d.","timestamp":1773508644784,"segment":1}
{"run":13,"commit":"a35e7c0","metric":0,"metrics":{"mean_size_pct":8.659388,"mean_psnr_gap_db":0.779616,"max_size_pct":18.762685,"min_psnr_gap_db":0.069587,"num_psnr_negative":0},"status":"discard","description":"Add rq=11 candidate: identical. RD still picks rq=10 (always smaller or equal). The rq is not changing.","timestamp":1773508748911,"segment":1}
{"run":14,"commit":"98d55f6","metric":0,"metrics":{"mean_size_pct":8.546151,"mean_psnr_gap_db":0.785299,"max_size_pct":18.613233,"min_psnr_gap_db":0.080705,"num_psnr_negative":0},"status":"keep","description":"b_dm=1.0 (was 0.94): still PSNR parity! Mean size 8.55% (was 8.66%), min gap +0.081dB (was +0.070). Slightly better on both.","timestamp":1773508876106,"segment":1}
{"run":15,"commit":"55d6a1c","metric":0,"metrics":{"mean_size_pct":8.468953,"mean_psnr_gap_db":0.769484,"max_size_pct":18.458246,"min_psnr_gap_db":0.059576,"num_psnr_negative":0},"status":"keep","description":"b_dm=1.05: still PSNR parity! Mean size 8.47% (was 8.55%). Min gap +0.060. Tighter but still safe.","timestamp":1773508964809,"segment":1}
{"run":16,"commit":"55d6a1c","metric":0.017215,"metrics":{"mean_size_pct":8.390642,"mean_psnr_gap_db":0.740858,"max_size_pct":18.889996,"min_psnr_gap_db":-0.017215,"num_psnr_negative":1},"status":"discard","description":"b_dm=1.10: 1 image goes negative (-0.017dB). Too aggressive. b_dm=1.05 is the limit.","timestamp":1773509049466,"segment":1}
{"run":17,"commit":"3be5c8b","metric":0,"metrics":{"mean_size_pct":8.257839,"mean_psnr_gap_db":0.780072,"max_size_pct":18.661205,"min_psnr_gap_db":0.086749,"num_psnr_negative":0},"status":"keep","description":"x_dm=0.80 (was 0.776): still parity! Mean size 8.26% (was 8.47%). Min gap +0.087 (better margin). Both metrics improved!","timestamp":1773509131982,"segment":1}
{"run":18,"commit":"e5b1080","metric":0,"metrics":{"mean_size_pct":7.819999,"mean_psnr_gap_db":0.748803,"max_size_pct":18.054172,"min_psnr_gap_db":0.055144,"num_psnr_negative":0},"status":"keep","description":"x_dm=0.85: still parity! Mean size 7.82% (was 8.26%). Min gap +0.055. Good improvement on size!","timestamp":1773509209477,"segment":1}
{"run":19,"commit":"d1f39bf","metric":0,"metrics":{"mean_size_pct":7.40643,"mean_psnr_gap_db":0.674303,"max_size_pct":17.532012,"min_psnr_gap_db":0.015221,"num_psnr_negative":0},"status":"keep","description":"x_dm=0.90: still parity! Mean size 7.41% (was 7.82%). Min gap +0.015dB - very tight but valid.","timestamp":1773509305488,"segment":1}
{"run":20,"commit":"d1f39bf","metric":0,"metrics":{"mean_size_pct":7.616458,"mean_psnr_gap_db":0.714985,"max_size_pct":17.79586,"min_psnr_gap_db":0.042735,"num_psnr_negative":0},"status":"discard","description":"x_dm=0.875: parity maintained, size 7.62% (between 7.41 and 7.82). 0.90 still better on size.","timestamp":1773509385854,"segment":1}
{"run":21,"commit":"1aeefc7","metric":0,"metrics":{"mean_size_pct":7.077766,"mean_psnr_gap_db":0.673223,"max_size_pct":16.919444,"min_psnr_gap_db":0.011844,"num_psnr_negative":0},"status":"keep","description":"qlf_boost=2 (was 4): still parity! Mean size 7.08% (was 7.41%). Min gap +0.012dB - tight but valid. Saves DC bytes.","timestamp":1773509488818,"segment":1}
{"run":22,"commit":"1aeefc7","metric":0.00686,"metrics":{"mean_size_pct":4.832127,"mean_psnr_gap_db":0.655817,"max_size_pct":13.128134,"min_psnr_gap_db":-0.00686,"num_psnr_negative":1},"status":"discard","description":"ep=1 uniform: 1 image barely negative (-0.007dB). Mean size 4.83% - huge improvement. Very close to target.","timestamp":1773509568590,"segment":1}
{"run":23,"commit":"c1aefb6","metric":0,"metrics":{"mean_size_pct":7.077766,"mean_psnr_gap_db":0.673649,"max_size_pct":16.919444,"min_psnr_gap_db":0.012846,"num_psnr_negative":0},"status":"keep","description":"EPF Y=4.0 (was 6.0): still parity! Min gap +0.013 (slightly better than +0.012). Mean PSNR same. Size same.","timestamp":1773509667622,"segment":1}
{"run":24,"commit":"a0e4ea0","metric":0,"metrics":{"mean_size_pct":7.068373,"mean_psnr_gap_db":0.672457,"max_size_pct":16.893612,"min_psnr_gap_db":0.010383,"num_psnr_negative":0},"status":"keep","description":"Remove adaptive b_dm (0.06*ytob): still parity! Mean size 7.07% (unchanged). Min gap +0.010. Simpler code.","timestamp":1773509752059,"segment":1}
{"run":25,"commit":"a0e4ea0","metric":0.000007,"metrics":{"mean_size_pct":7.068373,"mean_psnr_gap_db":0.672207,"max_size_pct":16.893612,"min_psnr_gap_db":-0.000007,"num_psnr_negative":1},"status":"discard","description":"EPF X=6.0 (was 5.5): barely fails -0.000007dB. X=5.5 is optimal.","timestamp":1773509938590,"segment":1}
{"run":26,"commit":"21cd821","metric":0,"metrics":{"mean_size_pct":7.068373,"mean_psnr_gap_db":0.670334,"max_size_pct":16.893612,"min_psnr_gap_db":0.021929,"num_psnr_negative":0},"status":"keep","description":"EPF X=5.0 (was 5.5): still parity! Min gap +0.022 (was +0.010). Better PSNR margin with same size!","timestamp":1773510033679,"segment":1}
{"run":27,"commit":"21cd821","metric":0.039933,"metrics":{"mean_size_pct":6.660062,"mean_psnr_gap_db":0.572811,"max_size_pct":16.434186,"min_psnr_gap_db":-0.039933,"num_psnr_negative":1},"status":"discard","description":"x_dm=0.95: fails -0.040dB. Too aggressive. x_dm=0.90 with EPF X=5.0 is optimal.","timestamp":1773510124359,"segment":1}
{"run":28,"commit":"484fdec","metric":0,"metrics":{"mean_size_pct":7.068373,"mean_psnr_gap_db":0.668359,"max_size_pct":16.893612,"min_psnr_gap_db":0.036104,"num_psnr_negative":0},"status":"keep","description":"EPF B=1.0 (was 1.5): still parity! Min gap +0.036 (was +0.022). Much better PSNR margin at same size!","timestamp":1773510210557,"segment":1}
{"run":29,"commit":"484fdec","metric":0.010765,"metrics":{"mean_size_pct":6.964459,"mean_psnr_gap_db":0.640903,"max_size_pct":16.758921,"min_psnr_gap_db":-0.010765,"num_psnr_negative":1},"status":"discard","description":"b_dm=1.10: fails -0.011dB. Even with better EPF margin, b_dm=1.10 is too much.","timestamp":1773510300684,"segment":1}
{"run":30,"commit":"348d8ca","metric":0,"metrics":{"mean_size_pct":7.018386,"mean_psnr_gap_db":0.657889,"max_size_pct":16.84564,"min_psnr_gap_db":0.015204,"num_psnr_negative":0},"status":"keep","description":"b_dm=1.07: still parity! Mean size 7.02% (was 7.07%). Min gap +0.015. Slight size improvement.","timestamp":1773510392276,"segment":1}
{"run":31,"commit":"348d8ca","metric":0.081667,"metrics":{"mean_size_pct":6.996301,"mean_psnr_gap_db":0.620562,"max_size_pct":16.827189,"min_psnr_gap_db":-0.081667,"num_psnr_negative":1},"status":"discard","description":"Default EPF weights: fails -0.082dB. Custom weights are essential for PSNR parity.","timestamp":1773510480408,"segment":1}
{"run":32,"commit":"348d8ca","metric":0,"metrics":{"mean_size_pct":7.018386,"mean_psnr_gap_db":0.657889,"max_size_pct":16.84564,"min_psnr_gap_db":0.015204,"num_psnr_negative":0},"status":"discard","description":"Baseline confirmed at 7.02% mean size, 0.015 min gap.","timestamp":1773510564206,"segment":1}
{"run":33,"commit":"348d8ca","metric":0,"metrics":{"mean_size_pct":7.077292,"mean_psnr_gap_db":0.653745,"max_size_pct":16.856711,"min_psnr_gap_db":0.020567,"num_psnr_negative":0},"status":"discard","description":"TZ=4.0 (was 3.2): still parity but size slightly worse (7.08 vs 7.02). TZ=3.2 better.","timestamp":1773510658721,"segment":1}
{"run":34,"commit":"0336d38","metric":0,"metrics":{"mean_size_pct":6.917372,"mean_psnr_gap_db":0.657741,"max_size_pct":16.797668,"min_psnr_gap_db":0.031338,"num_psnr_negative":0},"status":"keep","description":"TZ=2.5 (was 3.2): still parity! Mean size 6.92% (was 7.02%). Min gap +0.031 (was +0.015). Both improved!","timestamp":1773510745225,"segment":1}
{"run":35,"commit":"7ed57ce","metric":0,"metrics":{"mean_size_pct":6.869091,"mean_psnr_gap_db":0.640287,"max_size_pct":16.757076,"min_psnr_gap_db":0.037556,"num_psnr_negative":0},"status":"keep","description":"TZ=2.0: still parity! Mean size 6.87% (was 6.92%). Min gap +0.038 (was +0.031). Continuing improvement!","timestamp":1773510824292,"segment":1}
{"run":36,"commit":"7ed57ce","metric":0.017954,"metrics":{"mean_size_pct":6.739809,"mean_psnr_gap_db":0.627852,"max_size_pct":16.618694,"min_psnr_gap_db":-0.017954,"num_psnr_negative":1},"status":"discard","description":"TZ=1.5: fails -0.018dB. Too many small CfL factors cause noise. TZ=2.0 is optimal.","timestamp":1773510909262,"segment":1}
{"run":37,"commit":"cda55cf","metric":0,"metrics":{"mean_size_pct":6.666743,"mean_psnr_gap_db":0.595028,"max_size_pct":16.507989,"min_psnr_gap_db":0.000409,"num_psnr_negative":0},"status":"keep","description":"x_dm=0.925: still parity! Mean size 6.67% (was 6.87%). Min gap +0.0004dB - RAZOR THIN but valid!","timestamp":1773511004497,"segment":1}
