{"run":2,"commit":"55cbf61","metric":3.294,"metrics":{},"status":"discard","description":"Dead zone threshold 0.52/0.56: worse PSNR (-0.43 dB min), parity 3.29 vs 2.38","timestamp":1773440877989,"segment":0}
{"run":3,"commit":"55cbf61","metric":2.382,"metrics":{},"status":"discard","description":"Bias-aware AC quantization (AdjustQuantBias thresholds): no change, our scale too fine for bias to matter","timestamp":1773441041835,"segment":0}
{"run":4,"commit":"55cbf61","metric":2.382,"metrics":{},"status":"discard","description":"Added finer_rq=6 candidate: never wins size competition, no change","timestamp":1773441168393,"segment":0}
{"run":5,"commit":"55cbf61","metric":6.717,"metrics":{},"status":"discard","description":"Remove softer_rq candidate: PSNR improves but +8.9% max size kills parity (6.72 vs 2.38)","timestamp":1773441421552,"segment":0}
{"run":6,"commit":"55cbf61","metric":4.981,"metrics":{},"status":"discard","description":"quant_ac multiplier 1.15 (was 1.25): -0.83 dB PSNR worst case kills parity (4.98 vs 2.38)","timestamp":1773441530151,"segment":0}
{"run":7,"commit":"55cbf61","metric":2.382,"metrics":{},"status":"discard","description":"quant_ac multiplier 1.35 (was 1.25): no change, AQ path quantizes to same rq levels","timestamp":1773441580900,"segment":0}
{"run":8,"commit":"55cbf61","metric":2.382,"metrics":{},"status":"discard","description":"CfL dist_mul 1e-9 (was 1e-3): no significant change, regularizer negligible at both scales","timestamp":1773441713969,"segment":0}
{"run":9,"commit":"55cbf61","metric":2.382,"metrics":{},"status":"discard","description":"CfL weights include dm_multiplier: no change (x_dm=0.8 barely affects X, b_dm=1.0 no change)","timestamp":1773441865021,"segment":0}
{"run":10,"commit":"55cbf61","metric":2.393,"metrics":{},"status":"discard","description":"Disable entropy merge: -0.30 dB vs -0.31 dB PSNR, 7s vs 15s encode, parity 2.39 vs 2.38","timestamp":1773441928298,"segment":0}
{"run":11,"commit":"55cbf61","metric":22.19,"metrics":{},"status":"discard","description":"Override gs to libjxl's 8813: +21.5% size (AQ map calibrated for wrong gs), parity 22.2","timestamp":1773442000596,"segment":0}
{"run":12,"commit":"64736a9","metric":2.382,"metrics":{},"status":"keep","description":"Modular predictors 2/4/5: lossless 869->835 KB (-4%), VarDCT parity unchanged","timestamp":1773442229346,"segment":0}
{"run":13,"commit":"64736a9","metric":6.717,"metrics":{},"status":"discard","description":"Fix base_rq to match actual gs: PSNR +0.40 dB but +8.9% max size, parity 6.72 vs 2.38","timestamp":1773442445738,"segment":0}
{"run":14,"commit":"64736a9","metric":2.382,"metrics":{},"status":"discard","description":"Add matched-gs rq candidates: never win size competition, same parity, 50% slower","timestamp":1773442519143,"segment":0}
{"run":15,"commit":"64736a9","metric":18.506,"metrics":{},"status":"discard","description":"quant_ac multiplier 1.0 (was 1.25): -1.68 dB worst PSNR, massive regression","timestamp":1773442650453,"segment":0}
{"run":16,"commit":"36c9a7e","metric":2.468,"metrics":{},"status":"discard","description":"HybridUint (4,1,2) for AC: slight regression 2.47 vs 2.38, larger max_size","timestamp":1773442930191,"segment":0}
{"run":17,"commit":"36c9a7e","metric":2.468,"metrics":{},"status":"discard","description":"Competitive HybridUint config selection: heuristic picks (4,1,2) which is worse","timestamp":1773443000831,"segment":0}
{"run":18,"commit":"36c9a7e","metric":6.717,"metrics":{},"status":"discard","description":"base_rq from actual gs (rq=12/11 at gs=5111): PSNR +0.40 but +8.9% size, parity 6.72","timestamp":1773443149221,"segment":0}
{"run":19,"commit":"36c9a7e","metric":12.234,"metrics":{},"status":"discard","description":"AQ with 0.79/d instead of 0.956/d: -1.46 dB PSNR, AQ modulation miscalibrated","timestamp":1773443213910,"segment":0}
{"run":20,"commit":"36c9a7e","metric":2.393,"metrics":{},"status":"discard","description":"Disable entropy merge: parity 2.393 (+0.01), encode 6.8s (2.2x faster), -0.30 dB PSNR","timestamp":1773443296251,"segment":0}
{"run":21,"commit":"36c9a7e","metric":2.382,"metrics":{},"status":"discard","description":"CfL dist_mul 1e-9 (both paths): no change, integer discretization dominates","timestamp":1773443406899,"segment":0}
{"run":22,"commit":"36c9a7e","metric":3.095,"metrics":{},"status":"discard","description":"CfL TOWARDS_ZERO 1.0 (was 2.6): -0.40 dB PSNR, weak CfL factors add noise, parity 3.10","timestamp":1773443463749,"segment":0}
{"run":23,"commit":"36c9a7e","metric":2.576,"metrics":{},"status":"discard","description":"CfL TOWARDS_ZERO 4.0 (was 2.6): -0.32 dB worst PSNR, loses chroma info, parity 2.58","timestamp":1773443518783,"segment":0}
{"run":24,"commit":"1d969fa","metric":2.058,"metrics":{},"status":"keep","description":"Finer greedy cluster counts [1,3,6,10]: parity 2.38->2.06, max_size 0.98->0.50%","timestamp":1773443694940,"segment":0}
{"run":25,"commit":"8ad311e","metric":2.026,"metrics":{},"status":"keep","description":"14 cluster counts [1-32]: parity 2.06->2.03, max_size 0.50->0.34%","timestamp":1773443749662,"segment":0}
{"run":26,"commit":"8ad311e","metric":2.026,"metrics":{},"status":"discard","description":"All 1..32 clusters: same parity 2.026 but 20% slower, revert to 14 counts","timestamp":1773443815705,"segment":0}
{"run":27,"commit":"acdf6aa","metric":1.958,"metrics":{},"status":"keep","description":"HF metadata spatial prediction: parity 2.03->1.96, mean_size -4.3->-9.9%, always smaller than libjxl","timestamp":1773444221167,"segment":0}
{"run":28,"commit":"acdf6aa","metric":1.958,"metrics":{},"status":"discard","description":"quant_ac 1.40 (was 1.25): no change, same rq levels win size competition","timestamp":1773444283438,"segment":0}
{"run":29,"commit":"acdf6aa","metric":1.958,"metrics":{},"status":"discard","description":"finer_rq=base+1 candidate: never wins size competition, same parity, 20% slower","timestamp":1773444358283,"segment":0}
{"run":30,"commit":"acdf6aa","metric":4.388,"metrics":{},"status":"discard","description":"Remove softer_rq candidate: +4.9% max size, -0.42 dB PSNR, parity 4.39","timestamp":1773444506899,"segment":0}
{"run":31,"commit":"acdf6aa","metric":10.227,"metrics":{},"status":"discard","description":"gs from 0.6725/d: AQ/gs mismatch, -1.49 dB PSNR, parity 10.23","timestamp":1773444580878,"segment":0}
{"run":32,"commit":"acdf6aa","metric":1.958,"metrics":{},"status":"discard","description":"More HF metadata predictor candidates (0,1,2,5): no change, same winner picked","timestamp":1773444746888,"segment":0}
{"run":33,"commit":"acdf6aa","metric":1.958,"metrics":{},"status":"discard","description":"RD selection lambda=0.012: no change, lambda too small to flip rq choice","timestamp":1773445011361,"segment":0}
{"run":34,"commit":"acdf6aa","metric":1.973,"metrics":{},"status":"discard","description":"extra_dc_precision=2 (was 1): PSNR +0.70 mean but +0.45% max size, parity 1.97 vs 1.96","timestamp":1773445491892,"segment":0}
{"run":35,"commit":"acdf6aa","metric":10.227,"metrics":{},"status":"discard","description":"gs from 0.79/d + rescaled AQ map: -1.49 dB PSNR, +5.4% size, AQ rescaling broken","timestamp":1773446469963,"segment":0}
{"run":36,"commit":"acdf6aa","metric":24.555,"metrics":{},"status":"discard","description":"gs=8813 uniform only (no AQ): +27% max size, scale too fine, parity 24.6","timestamp":1773446550732,"segment":0}
{"run":37,"commit":"acdf6aa","metric":999999,"metrics":{},"status":"crash","description":"ANS shift selection: InvalidAnsHistogram, need proper re-normalization per shift","timestamp":1773446856480,"segment":0}
{"run":38,"commit":"a145a75","metric":1.973,"metrics":{},"status":"discard","description":"extra_dc_precision=2: parity 1.97 (+0.8%), PSNR +0.70 but max_size +0.45%","timestamp":1773447399147,"segment":0}
{"run":39,"commit":"a145a75","metric":1.958,"metrics":{},"status":"discard","description":"Competitive ep=1/2: ep=1 always wins size, same parity, 75% slower","timestamp":1773447503688,"segment":0}
{"run":40,"commit":"a145a75","metric":1.973,"metrics":{},"status":"discard","description":"Content-adaptive ep: ep=2 for photos, ep=1 for graphics: parity 1.97, zoltan too big","timestamp":1773447591128,"segment":0}
{"run":41,"commit":"d075962","metric":1.958,"metrics":{},"status":"keep","description":"Entropy-optimal ANS frequency normalization: 0.002% smaller, same parity","timestamp":1773447697419,"segment":0}
{"run":42,"commit":"85b91bd","metric":1.958,"metrics":{},"status":"keep","description":"ANS shift 12 (was 13): no change, both produce identical output","timestamp":1773447896277,"segment":0}
{"run":43,"commit":"2a6bfa3","metric":1.958,"metrics":{},"status":"discard","description":"Lower greedy clustering threshold 24 (was 48): no change, cluster counts already explored","timestamp":1773448076796,"segment":0}
{"run":44,"commit":"719d56c","metric":1.958,"metrics":{},"status":"keep","description":"Baseline verified: parity 1.96, 43 experiments, entropy coding gap identified as 29% at same quant level","timestamp":1773448614516,"segment":0}
{"run":45,"commit":"995f8fe","metric":1.958,"metrics":{},"status":"keep","description":"Steady state parity 1.96. Root cause: 29% entropy overhead from FP coefficient differences vs libjxl","timestamp":1773448728941,"segment":0}
{"run":46,"commit":"995f8fe","metric":3.374,"metrics":{},"status":"discard","description":"Dead zone 0.55 (was 0.50): -0.46 dB PSNR, parity 3.37","timestamp":1773448817419,"segment":0}
{"run":47,"commit":"995f8fe","metric":63.537,"metrics":{},"status":"crash","description":"Dead zone 0.45: broken rounding logic, massive PSNR loss","timestamp":1773448900952,"segment":0}
{"run":48,"commit":"2d3aadc","metric":1.958,"metrics":{},"status":"keep","description":"Parity 1.96 stable after 47 experiments. Key wins: greedy clustering (-15%), HF metadata prediction (-3%), entropy-optimal ANS normalization","timestamp":1773448984943,"segment":0}
{"run":49,"commit":"2d3aadc","metric":2.972,"metrics":{},"status":"discard","description":"Per-candidate ep (softer=ep2, others=ep1): worse parity 2.97, mixed ep hurts","timestamp":1773449066875,"segment":0}
{"run":50,"commit":"ff739b4","metric":1.958,"metrics":{},"status":"keep","description":"Final baseline: parity 1.96, 49 experiments. Optimization plateau reached.","timestamp":1773449130059,"segment":0}
{"run":51,"commit":"4f48e46","metric":1.958,"metrics":{},"status":"keep","description":"ANS shift selection (0,6,12 with roundtrip): 0.04% smaller avg but same parity since size already beats libjxl","timestamp":1773449670602,"segment":0}
{"run":52,"commit":"4f48e46","metric":4.375,"metrics":{},"status":"discard","description":"Force rq=6 only (remove softer_rq=5): 4.86% larger on some images, parity 4.37","timestamp":1773449852911,"segment":0}
{"run":53,"commit":"4f48e46","metric":1.969,"metrics":{},"status":"discard","description":"ep=2 with shift optimization: 1.969 vs 1.958, zoltan +0.43% size penalty negates PSNR gain","timestamp":1773450054079,"segment":0}
{"run":54,"commit":"4f48e46","metric":23.124,"metrics":{},"status":"discard","description":"ep=2 + softer_rq=base-2: way too coarse, -1.97 dB PSNR","timestamp":1773450134677,"segment":0}
{"run":55,"commit":"4f48e46","metric":23.124,"metrics":{},"status":"discard","description":"ep=2 + extra_softer_rq=base-2: rq=4 wins everywhere, -1.97 dB PSNR","timestamp":1773450518859,"segment":0}
{"run":56,"commit":"5b1b5f8","metric":1.958,"metrics":{},"status":"keep","description":"Baseline with ANS shift optimization: parity 1.958, size -9.99% (was -9.95%), 55 experiments","timestamp":1773450577518,"segment":0}
{"run":57,"commit":"5b1b5f8","metric":56.833,"metrics":{},"status":"discard","description":"Disable gaborish: -4.56 dB PSNR, -30% size but terrible quality","timestamp":1773450685879,"segment":0}
{"run":58,"commit":"5b1b5f8","metric":1.958,"metrics":{},"status":"discard","description":"2% quality budget selection: no change, rq=5 vs rq=6 gap is 26% (way over 2%)","timestamp":1773451127634,"segment":0}
{"run":59,"commit":"5b1b5f8","metric":1.958,"metrics":{},"status":"discard","description":"More cluster counts (48,64): no change, limited by number of contexts","timestamp":1773451262752,"segment":0}
{"run":60,"commit":"3e58cc7","metric":1.958,"metrics":{},"status":"discard","description":"Trellis DC quantization (floor/ceil vs prediction): no change, round-nearest already optimal","timestamp":1773451447431,"segment":0}
{"run":61,"commit":"e3b552f","metric":1.958,"metrics":{},"status":"keep","description":"Parity 1.958 stable after 60 experiments. ANS shift optimization committed. Remaining gap requires structural entropy coding improvements.","timestamp":1773451497595,"segment":0}
{"run":62,"commit":"b8ea75b","metric":1.958,"metrics":{},"status":"keep","description":"Baseline stable: parity 1.958, 61 experiments. Loop plateau confirmed.","timestamp":1773451563798,"segment":0}
{"run":63,"commit":"f38f147","metric":1.958,"metrics":{},"status":"keep","description":"Parity plateau confirmed at 1.958 (62 experiments). All parameter-level optimizations exhausted.","timestamp":1773451629516,"segment":0}
{"run":64,"commit":"f38f147","metric":1.958,"metrics":{},"status":"discard","description":"Fast cbrt (libjxl Newton-Raphson): identical output, LUT dominates precision","timestamp":1773451799559,"segment":0}
{"run":65,"commit":"f38f147","metric":4.375,"metrics":{},"status":"discard","description":"quant_ac 0.88/d (was 0.79): softer_rq=6 matches libjxl but +4.86% size from entropy gap","timestamp":1773451960360,"segment":0}
{"run":66,"commit":"287ebc2","metric":1.958,"metrics":{},"status":"keep","description":"Parity 1.958 stable. 65 experiments. Confirmed: 26% entropy gap from coefficient value differences, not ANS overhead.","timestamp":1773452051467,"segment":0}
{"run":67,"commit":"18ae55c","metric":1.958,"metrics":{},"status":"discard","description":"Match libjxl gaborish FP order (row-based Symmetric5): identical output, quant absorbs ULP diffs","timestamp":1773452245116,"segment":0}
{"run":68,"commit":"18ae55c","metric":9.015,"metrics":{},"status":"discard","description":"Force DCT8-only (no merges): +15% size, -1.0 dB. Merges are critical for our parity!","timestamp":1773452354587,"segment":0}
{"run":69,"commit":"8d75c7f","metric":1.958,"metrics":{},"status":"keep","description":"Baseline verified. Key insight: DCT16/32 merges save ~25%, compensating for base entropy gap.","timestamp":1773452415397,"segment":0}
{"run":70,"commit":"0be70f4","metric":1.958,"metrics":{},"status":"keep","description":"Parity 1.958, 69 experiments. Optimization plateau -- all quick-iteration paths exhausted.","timestamp":1773452468800,"segment":0}
{"run":71,"commit":"0be70f4","metric":10.215,"metrics":{},"status":"discard","description":"Fix gs/rq mismatch: use gs=8813 (uniform) instead of gs=5111 (AQ). Catastrophic: -1.49 dB, +5.4% size","timestamp":1773452870322,"segment":0}
{"run":72,"commit":"8d75c7f","metric":1.958,"metrics":{},"status":"discard","description":"Mixed rq map (softer for complex, coarser for flat): didn't win size selection, uniform rq=5 still chosen","timestamp":1773453119846,"segment":0}
{"run":73,"commit":"0be70f4","metric":3.612,"metrics":{},"status":"discard","description":"CfL: dist_mul 1e-3->1e-6, towards_zero 2.6->0.5: worse parity 3.61, overcorrects chroma (-0.44 dB)","timestamp":1773453339070,"segment":0}
{"run":74,"commit":"0be70f4","metric":2.356,"metrics":{},"status":"discard","description":"CfL towards_zero 2.6->1.5: parity 2.36, slightly worse PSNR (-0.34 dB)","timestamp":1773453400935,"segment":0}
{"run":75,"commit":"0be70f4","metric":2.024,"metrics":{},"status":"discard","description":"CfL towards_zero 2.6->3.5: parity 2.02, marginal change","timestamp":1773453462294,"segment":0}
{"run":76,"commit":"0be70f4","metric":9.977,"metrics":{},"status":"discard","description":"extra_dc_precision=0 (match libjxl): catastrophic -1.87 dB PSNR. DC precision is critical for our quality.","timestamp":1773453599552,"segment":0}
{"run":77,"commit":"0be70f4","metric":1.969,"metrics":{},"status":"discard","description":"extra_dc_precision=2: PSNR +0.70 mean but zoltan now +0.43% size. Net parity 1.97 vs 1.96.","timestamp":1773453739969,"segment":0}
{"run":78,"commit":"0be70f4","metric":1.958,"metrics":{},"status":"discard","description":"DC precision as candidate (1 vs 2): prec=2 always loses size selection, 2x encode time","timestamp":1773453951939,"segment":0}
{"run":79,"commit":"0be70f4","metric":2.924,"metrics":{},"status":"discard","description":"Quality-aware selection (prefer largest within 2%): worse parity 2.92, larger != better quality","timestamp":1773454031078,"segment":0}
{"run":80,"commit":"0be70f4","metric":4.312,"metrics":{},"status":"discard","description":"Decode-based selection with 10% budget: all PSNR positive (+0.52 min!) but +8.7% max size","timestamp":1773454653023,"segment":0}
{"run":81,"commit":"0be70f4","metric":1.958,"metrics":{},"status":"discard","description":"Decode-based selection 5% budget: no candidates within budget, identical to baseline","timestamp":1773454711801,"segment":0}
{"run":82,"commit":"0be70f4","metric":2.861,"metrics":{},"status":"discard","description":"Decode-based selection 7% budget: better avg PSNR but +4.5% on one image","timestamp":1773454771086,"segment":0}
{"run":83,"commit":"0be70f4","metric":4.312,"metrics":{},"status":"discard","description":"Decode RD with parity score: picks high-quality candidates but +8.7% size on zoltan","timestamp":1773454883280,"segment":0}
{"run":84,"commit":"0be70f4","metric":1.958,"metrics":{},"status":"discard","description":"More aggressive merge multipliers (2.5->2.0, 3.5->2.8): no change, DCT8 candidates already winning","timestamp":1773455042298,"segment":0}
{"run":85,"commit":"0be70f4","metric":23.239,"metrics":{},"status":"discard","description":"Extra softer rq=4 candidate: -1.97 dB PSNR catastrophe. Lower rq is NOT always better quality.","timestamp":1773455146076,"segment":0}
{"run":86,"commit":"0be70f4","metric":4.967,"metrics":{},"status":"discard","description":"Dead zone 0.58 (libjxl-style): -12% size but -0.60 dB worst PSNR, too aggressive","timestamp":1773455372857,"segment":0}
{"run":87,"commit":"0be70f4","metric":2.291,"metrics":{},"status":"discard","description":"Dead zone 0.52: parity 2.29, slightly worse than 1.96. PSNR -0.35 (was -0.31).","timestamp":1773455431986,"segment":0}
{"run":88,"commit":"0be70f4","metric":2.012,"metrics":{},"status":"discard","description":"Dead zone 0.505: parity 2.01, marginal change from baseline 1.96","timestamp":1773455490371,"segment":0}
{"run":89,"commit":"1395683","metric":1.958,"metrics":{},"status":"keep","description":"Add decode_codestream_to_f32_rgb and compute_psnr_from_decoded helpers for future RD selection","timestamp":1773455620986,"segment":0}
{"run":90,"commit":"1395683","metric":1.958,"metrics":{},"status":"discard","description":"Position-dependent dead zone (libjxl quadrant thresholds): no change, coefficients already beyond threshold at our quant level","timestamp":1773455768403,"segment":0}
{"run":91,"commit":"1395683","metric":1.958,"metrics":{},"status":"discard","description":"Bias-aware quantization (AdjustQuantBias): zero changes at gs=5111, scale too small for bias to matter","timestamp":1773456428819,"segment":0}
{"run":92,"commit":"1395683","metric":10.215,"metrics":{},"status":"discard","description":"Use uniform gs=8813: catastrophic as before. Need intermediate gs for better dequant/quant balance.","timestamp":1773456622715,"segment":0}
{"run":93,"commit":"1395683","metric":4.504,"metrics":{},"status":"discard","description":"gs from q=0.55/d (intermediate): better PSNR (+0.99 mean) but +4.89% max size on one image","timestamp":1773456698579,"segment":0}
{"run":94,"commit":"1395683","metric":17.372,"metrics":{},"status":"discard","description":"gs from q=0.45/d: catastrophic -3.48 dB on one image","timestamp":1773456760110,"segment":0}
{"run":95,"commit":"c97cde0","metric":1.958,"metrics":{},"status":"keep","description":"Baseline 1.958 after 94 experiments. Root cause identified: gs/dequant step mismatch.","timestamp":1773456902013,"segment":0}
{"run":96,"commit":"c97cde0","metric":10.22,"metrics":{},"status":"discard","description":"gs=8813: kodim08 PSNR fixed (+0.20 vs -0.31!) but Webkit -1.49 dB, kodim01/zoltan too large","timestamp":1773457050953,"segment":0}
{"run":97,"commit":"c97cde0","metric":4.495,"metrics":{},"status":"discard","description":"Recomputed base_rq at gs_aq: changed rq selection, worse parity","timestamp":1773457169498,"segment":0}
{"run":98,"commit":"1b5581a","metric":1.958,"metrics":{},"status":"keep","description":"Baseline stable at 1.958, 97 experiments. Dual-gs candidate system needed for further progress.","timestamp":1773457249518,"segment":0}
{"run":99,"commit":"c97cde0","metric":4.378,"metrics":{},"status":"discard","description":"gs from q=0.576/d (match libjxl quant step at rq=7): better PSNR but +5.6% max size","timestamp":1773457360088,"segment":0}
{"run":100,"commit":"1195793","metric":1.958,"metrics":{},"status":"keep","description":"100th experiment. Parity 1.958 (17.8% improvement from 2.38). Optimization plateau -- architectural changes required.","timestamp":1773457424167,"segment":0}
{"run":101,"commit":"8dc0b15","metric":1.958,"metrics":{},"status":"keep","description":"Parity 1.958 stable. Continuing loop at optimization plateau.","timestamp":1773457479025,"segment":0}
{"run":102,"commit":"8dc0b15","metric":4.494,"metrics":{},"status":"discard","description":"Content-adaptive gs (0.50 for photos, 0.39 for graphics): +0.37 dB mean but +5.2% max size","timestamp":1773457736290,"segment":0}
{"run":103,"commit":"8dc0b15","metric":2.861,"metrics":{},"status":"discard","description":"Decode-PSNR selection with 6% budget: +4.5% max size, PSNR unchanged. Wrong candidates picked.","timestamp":1773457891111,"segment":0}
