{"run":729,"commit":"51475f1","metric":1.645884,"metrics":{"mean_size_pct":-9.770361,"mean_psnr_gap_db":0.232236,"max_size_pct":-0.748843,"min_psnr_gap_db":-0.28005},"status":"keep","description":"EPF Y-channel weight=20.0. Parity 1.658->1.646. Worst PSNR gap now -0.280.","timestamp":1773482687493,"segment":1}
{"run":730,"commit":"14148e8","metric":1.635165,"metrics":{"mean_size_pct":-9.770361,"mean_psnr_gap_db":0.236147,"max_size_pct":-0.748843,"min_psnr_gap_db":-0.278146},"status":"keep","description":"EPF Y-channel weight=15.0. Parity 1.646->1.635. Worst PSNR now -0.278.","timestamp":1773482738460,"segment":1}
{"run":731,"commit":"31e447e","metric":1.629914,"metrics":{"mean_size_pct":-9.770361,"mean_psnr_gap_db":0.240393,"max_size_pct":-0.748843,"min_psnr_gap_db":-0.27759},"status":"keep","description":"EPF Y-channel weight=10.0. Parity 1.635->1.630. Approaching diminishing returns on Y weight.","timestamp":1773482791286,"segment":1}
{"run":732,"commit":"b96ac28","metric":1.629113,"metrics":{"mean_size_pct":-9.770361,"mean_psnr_gap_db":0.245204,"max_size_pct":-0.748843,"min_psnr_gap_db":-0.278027},"status":"keep","description":"EPF Y-channel weight=5.0. Parity 1.630->1.629. Nearly flat -- diminishing returns below 10.","timestamp":1773482842586,"segment":1}
{"run":733,"commit":"b96ac28","metric":1.640274,"metrics":{"mean_size_pct":-9.770361,"mean_psnr_gap_db":0.247774,"max_size_pct":-0.748843,"min_psnr_gap_db":-0.279444},"status":"discard","description":"EPF B-channel weight=1.5 with Y=5.0. Worse than B=2.0. Discard.","timestamp":1773482895265,"segment":1}
{"run":734,"commit":"b96ac28","metric":1.629113,"metrics":{"mean_size_pct":-9.770361,"mean_psnr_gap_db":0.245204,"max_size_pct":-0.748843,"min_psnr_gap_db":-0.278027},"status":"discard","description":"EPF zeroflush params (0.35/0.5 vs 0.45/0.6). No effect on PSNR. Discard.","timestamp":1773482958925,"segment":1}
{"run":735,"commit":"b96ac28","metric":0,"metrics":{"mean_size_pct":0,"mean_psnr_gap_db":0,"max_size_pct":0,"min_psnr_gap_db":0},"status":"crash","description":"Custom EPF sigma with quant_mul=0.55. Decode failure. F16 encoding or field order may be wrong.","timestamp":1773483004249,"segment":1}
{"run":736,"commit":"b96ac28","metric":1.712411,"metrics":{"mean_size_pct":-9.734714,"mean_psnr_gap_db":0.244657,"max_size_pct":-0.745042,"min_psnr_gap_db":-0.290691},"status":"discard","description":"Custom EPF sigma quant_mul=0.55 (vs 0.46 default). Over-smoothing hurts worst-case PSNR. Discard.","timestamp":1773483075374,"segment":1}
{"run":737,"commit":"b96ac28","metric":1.631861,"metrics":{"mean_size_pct":-9.770361,"mean_psnr_gap_db":0.246552,"max_size_pct":-0.748843,"min_psnr_gap_db":-0.278337},"status":"discard","description":"EPF B-channel weight=1.75. Worse than 2.0. B=2.0 confirmed optimal.","timestamp":1773483140541,"segment":1}
{"run":738,"commit":"b96ac28","metric":1.695558,"metrics":{"mean_size_pct":-9.770361,"mean_psnr_gap_db":0.243599,"max_size_pct":-0.748843,"min_psnr_gap_db":-0.287582},"status":"discard","description":"EPF X-channel weight=4.0. Worse than default 5.0. X=5.0 confirmed optimal.","timestamp":1773483194779,"segment":1}
{"run":739,"commit":"b96ac28","metric":1.633773,"metrics":{"mean_size_pct":-9.770361,"mean_psnr_gap_db":0.241049,"max_size_pct":-0.748843,"min_psnr_gap_db":-0.28013},"status":"discard","description":"EPF X-channel weight=6.0. Slightly worse than X=5.0 (1.634 vs 1.629). X=5.0 remains optimal.","timestamp":1773483252753,"segment":1}
{"run":740,"commit":"b96ac28","metric":1.630938,"metrics":{"mean_size_pct":-9.770361,"mean_psnr_gap_db":0.246928,"max_size_pct":-0.748843,"min_psnr_gap_db":-0.278569},"status":"discard","description":"EPF Y=3.0. Slightly worse than Y=5.0 (1.631 vs 1.629). Y=5.0 remains optimal.","timestamp":1773483314881,"segment":1}
{"run":741,"commit":"b96ac28","metric":1.62969,"metrics":{"mean_size_pct":-9.770361,"mean_psnr_gap_db":0.243167,"max_size_pct":-0.748843,"min_psnr_gap_db":-0.277578},"status":"discard","description":"EPF Y=7.0. Parity 1.630 vs 1.629. Effectively tied with Y=5.0. Keep Y=5.0 for simplicity.","timestamp":1773483369499,"segment":1}
{"run":742,"commit":"b96ac28","metric":1.650415,"metrics":{"mean_size_pct":-9.734714,"mean_psnr_gap_db":0.246424,"max_size_pct":-0.745042,"min_psnr_gap_db":-0.280923},"status":"discard","description":"EPF sigma quant_mul=0.50 (default 0.46). Over-smooths with reduced channel weights. Parity 1.650 vs 1.629.","timestamp":1773483439634,"segment":1}
{"run":743,"commit":"b96ac28","metric":14.360653,"metrics":{"mean_size_pct":-9.764237,"mean_psnr_gap_db":-0.476536,"max_size_pct":-0.743141,"min_psnr_gap_db":-1.410521},"status":"discard","description":"Custom Gab B-channel 1.3x stronger without matching inverse Gab. Massive PSNR regression (-1.41 dB worst). Encoder/decoder Gab mismatch.","timestamp":1773483542973,"segment":1}
{"run":744,"commit":"b96ac28","metric":1.907434,"metrics":{"mean_size_pct":-9.787226,"mean_psnr_gap_db":0.260186,"max_size_pct":-0.787806,"min_psnr_gap_db":-0.29607},"status":"discard","description":"Reduced inverse Gab B-weight=0.95 (encoder compensates less, decoder smooths more). PSNR regresses -- mismatch introduces systematic error. Discard.","timestamp":1773483610430,"segment":1}
{"run":745,"commit":"b96ac28","metric":1.697572,"metrics":{"mean_size_pct":-5.354363,"mean_psnr_gap_db":0.726655,"max_size_pct":0.718433,"min_psnr_gap_db":-0.266865},"status":"discard","description":"ep=2 with custom EPF weights. Great PSNR (+0.73 avg) but zoltan size overshoots +0.72%. Parity 1.698 vs 1.629.","timestamp":1773483679459,"segment":1}
{"run":746,"commit":"b96ac28","metric":1.697572,"metrics":{"mean_size_pct":-5.354363,"mean_psnr_gap_db":0.726655,"max_size_pct":0.718433,"min_psnr_gap_db":-0.266865},"status":"discard","description":"ep=2 + harder rq=7 candidate. Same result as ep=2 alone -- rq=7 doesn't help zoltan size overshoot. Discard.","timestamp":1773483780675,"segment":1}
{"run":747,"commit":"b96ac28","metric":1.648842,"metrics":{"mean_size_pct":-9.744252,"mean_psnr_gap_db":0.241981,"max_size_pct":-0.719383,"min_psnr_gap_db":-0.278927},"status":"discard","description":"Retune b_dm_multiplier=0.91 with new EPF weights. Worse than 0.93 (1.649 vs 1.629). Size tighter on some images.","timestamp":1773483875287,"segment":1}
{"run":748,"commit":"d2eedcd","metric":1.625262,"metrics":{"mean_size_pct":-9.778683,"mean_psnr_gap_db":0.246832,"max_size_pct":-0.764998,"min_psnr_gap_db":-0.277717},"status":"keep","description":"Retune b_dm_multiplier=0.94 with EPF weights. Better parity (1.629->1.625). EPF weights shifted optimal B quant slightly.","timestamp":1773483929465,"segment":1}
{"run":749,"commit":"d2eedcd","metric":1.630364,"metrics":{"mean_size_pct":-9.79072,"mean_psnr_gap_db":0.248195,"max_size_pct":-0.780203,"min_psnr_gap_db":-0.278714},"status":"discard","description":"b_dm_multiplier=0.95. Worse than 0.94 (1.630 vs 1.625). 0.94 confirmed optimal with EPF weights.","timestamp":1773483983840,"segment":1}
{"run":750,"commit":"d2eedcd","metric":1.637272,"metrics":{"mean_size_pct":-9.77874,"mean_psnr_gap_db":0.24599,"max_size_pct":-0.764048,"min_psnr_gap_db":-0.277717},"status":"discard","description":"CfL shrink=2.95 (was 2.965). Slightly worse (1.637 vs 1.625). Discard.","timestamp":1773484042153,"segment":1}
{"run":751,"commit":"d2eedcd","metric":1.627043,"metrics":{"mean_size_pct":-9.772776,"mean_psnr_gap_db":0.246193,"max_size_pct":-0.744091,"min_psnr_gap_db":-0.278163},"status":"discard","description":"CfL shrink=2.98. Slightly worse than 2.965 (1.627 vs 1.625). Nearly tied.","timestamp":1773484091863,"segment":1}
{"run":752,"commit":"fd2a28b","metric":1.609084,"metrics":{"mean_size_pct":-9.577205,"mean_psnr_gap_db":0.240479,"max_size_pct":-0.149198,"min_psnr_gap_db":-0.27527},"status":"keep","description":"Retune x_dm_multiplier*=0.97 (0.776) with EPF weights. New best parity 1.625->1.609. Size tighter but still negative (-0.15% worst).","timestamp":1773484151232,"segment":1}
{"run":753,"commit":"fd2a28b","metric":1.697296,"metrics":{"mean_size_pct":-9.435155,"mean_psnr_gap_db":0.231638,"max_size_pct":0.254683,"min_psnr_gap_db":-0.279288},"status":"discard","description":"x_dm*=0.95 (0.76). Size overshoots on one image (+0.25%). Discard.","timestamp":1773484203365,"segment":1}
{"run":754,"commit":"fd2a28b","metric":1.635079,"metrics":{"mean_size_pct":-9.504196,"mean_psnr_gap_db":0.237622,"max_size_pct":0.051317,"min_psnr_gap_db":-0.277641},"status":"discard","description":"x_dm*=0.96. Size overshoot (+0.05%) on one image. Parity 1.635 vs 1.609. Discard.","timestamp":1773484259029,"segment":1}
{"run":755,"commit":"fd2a28b","metric":1.612072,"metrics":{"mean_size_pct":-9.601328,"mean_psnr_gap_db":0.241867,"max_size_pct":-0.203841,"min_psnr_gap_db":-0.27483},"status":"discard","description":"x_dm*=0.975. Parity 1.612 vs 1.609 at 0.97. Discard.","timestamp":1773484312172,"segment":1}
{"run":756,"commit":"fd2a28b","metric":1.610117,"metrics":{"mean_size_pct":-9.577205,"mean_psnr_gap_db":0.241439,"max_size_pct":-0.149198,"min_psnr_gap_db":-0.275627},"status":"discard","description":"EPF Y=4.0. Tied with Y=5.0 (1.610 vs 1.609). Keep Y=5.0.","timestamp":1773484370986,"segment":1}
{"run":757,"commit":"fd2a28b","metric":1.609084,"metrics":{"mean_size_pct":-9.577205,"mean_psnr_gap_db":0.240479,"max_size_pct":-0.149198,"min_psnr_gap_db":-0.27527},"status":"discard","description":"Competitive ep=1 vs ep=2 encoding. ep=2 never selected (always larger). Same parity but 80% slower. Discard.","timestamp":1773484536775,"segment":1}
{"run":758,"commit":"fd2a28b","metric":1.629114,"metrics":{"mean_size_pct":-9.577205,"mean_psnr_gap_db":0.240959,"max_size_pct":-0.149198,"min_psnr_gap_db":-0.277704},"status":"discard","description":"EPF X=4.5 (was 5.0). Worse (1.629 vs 1.609). X=5.0 confirmed.","timestamp":1773484610524,"segment":1}
{"run":759,"commit":"fd2a28b","metric":1.609084,"metrics":{"mean_size_pct":-9.577205,"mean_psnr_gap_db":0.240479,"max_size_pct":-0.149198,"min_psnr_gap_db":-0.27527},"status":"discard","description":"CfL B-channel regularization reduced (0.3 vs 0.5). No change in output. Discard.","timestamp":1773484676279,"segment":1}
{"run":760,"commit":"fd2a28b","metric":1.609084,"metrics":{"mean_size_pct":-9.451153,"mean_psnr_gap_db":0.240479,"max_size_pct":-0.225698,"min_psnr_gap_db":-0.27527},"status":"discard","description":"Enable custom coeff orders for effort>=7. Same parity, files slightly larger (overhead > savings). Discard.","timestamp":1773484763309,"segment":1}
{"run":761,"commit":"fae9b2a","metric":1.599938,"metrics":{"mean_size_pct":-7.944867,"mean_psnr_gap_db":0.343125,"max_size_pct":-0.025658,"min_psnr_gap_db":-0.273421},"status":"keep","description":"Increase quant_lf by +1 (18 vs 17) for finer DC quantization. PSNR much better (+0.34 avg), size still below libjxl. New best parity 1.609->1.600.","timestamp":1773484867644,"segment":1}
{"run":762,"commit":"fae9b2a","metric":1.612194,"metrics":{"mean_size_pct":-7.575757,"mean_psnr_gap_db":0.592251,"max_size_pct":0.084577,"min_psnr_gap_db":-0.273117},"status":"discard","description":"quant_lf+2 (19). Size overshoots on one image (+0.08%). PSNR excellent but parity 1.612 vs 1.600.","timestamp":1773484923316,"segment":1}
{"run":763,"commit":"fae9b2a","metric":1.607563,"metrics":{"mean_size_pct":-7.95186,"mean_psnr_gap_db":0.344067,"max_size_pct":-0.038012,"min_psnr_gap_db":-0.274433},"status":"discard","description":"b_dm=0.95 with quant_lf+1. Parity 1.608 vs 1.600 at 0.94. Discard.","timestamp":1773484989134,"segment":1}
{"run":764,"commit":"fae9b2a","metric":1.60791,"metrics":{"mean_size_pct":-8.005711,"mean_psnr_gap_db":0.345623,"max_size_pct":-0.196239,"min_psnr_gap_db":-0.27431},"status":"discard","description":"x_dm*=0.98 with quant_lf+1. Worse (1.608 vs 1.600). x_dm*=0.97 confirmed.","timestamp":1773485056486,"segment":1}
{"run":765,"commit":"fae9b2a","metric":1.601989,"metrics":{"mean_size_pct":-7.944867,"mean_psnr_gap_db":0.341466,"max_size_pct":-0.025658,"min_psnr_gap_db":-0.274244},"status":"discard","description":"EPF B=2.25 with quant_lf+1. Worse (1.602 vs 1.600). B=2.0 confirmed.","timestamp":1773485116630,"segment":1}
{"run":766,"commit":"fae9b2a","metric":1.600271,"metrics":{"mean_size_pct":-7.944867,"mean_psnr_gap_db":0.339953,"max_size_pct":-0.025658,"min_psnr_gap_db":-0.273231},"status":"discard","description":"EPF Y=8.0 with quant_lf+1. Tied with Y=5.0 (1.600 vs 1.600). No improvement.","timestamp":1773485173794,"segment":1}
{"run":767,"commit":"fae9b2a","metric":1.599938,"metrics":{"mean_size_pct":-7.944867,"mean_psnr_gap_db":0.343125,"max_size_pct":-0.025658,"min_psnr_gap_db":-0.273421},"status":"discard","description":"Frequency-dependent B multiplier (LF*0.95). No effect -- quantization steps not fine enough to change integers. Discard.","timestamp":1773485397142,"segment":1}
{"run":768,"commit":"fae9b2a","metric":1.599938,"metrics":{"mean_size_pct":-7.944867,"mean_psnr_gap_db":0.343125,"max_size_pct":-0.025658,"min_psnr_gap_db":-0.273421},"status":"discard","description":"Verify baseline at parity 1.600. Confirmed stable.","timestamp":1773485480117,"segment":1}
{"run":769,"commit":"fae9b2a","metric":1.600413,"metrics":{"mean_size_pct":-7.791818,"mean_psnr_gap_db":0.343125,"max_size_pct":0.002376,"min_psnr_gap_db":-0.273421},"status":"discard","description":"HybridUintConfig(4,1,2) matching libjxl. Slightly larger files than (4,2,0), one image barely overshoots. Keep (4,2,0).","timestamp":1773485586004,"segment":1}
{"run":770,"commit":"fae9b2a","metric":1.625406,"metrics":{"mean_size_pct":-7.820928,"mean_psnr_gap_db":0.343125,"max_size_pct":0.127341,"min_psnr_gap_db":-0.273421},"status":"discard","description":"AC HybridUint(4,1,2). Larger files, one overshoots (+0.13%). (4,2,0) is better for AC. Discard.","timestamp":1773485668065,"segment":1}
{"run":771,"commit":"fae9b2a","metric":1.599938,"metrics":{"mean_size_pct":-7.945342,"mean_psnr_gap_db":0.343125,"max_size_pct":-0.028034,"min_psnr_gap_db":-0.273421},"status":"discard","description":"B DC bias +0.05. No effect -- too small to change quantized DC values. Discard.","timestamp":1773485763713,"segment":1}
{"run":772,"commit":"e2fbb36","metric":1.598757,"metrics":{"mean_size_pct":-7.945342,"mean_psnr_gap_db":0.341451,"max_size_pct":-0.028034,"min_psnr_gap_db":-0.274014},"status":"keep","description":"EPF X=5.5 (was 5.0) with quant_lf+1. Tiny parity improvement 1.600->1.599.","timestamp":1773485827093,"segment":1}
{"run":773,"commit":"e2fbb36","metric":1.602587,"metrics":{"mean_size_pct":-7.945342,"mean_psnr_gap_db":0.340167,"max_size_pct":-0.028034,"min_psnr_gap_db":-0.275059},"status":"discard","description":"EPF X=5.75. Worse than 5.5 (1.603 vs 1.599). X=5.5 confirmed optimal.","timestamp":1773485880073,"segment":1}
{"run":774,"commit":"3859940","metric":1.597419,"metrics":{"mean_size_pct":-7.945342,"mean_psnr_gap_db":0.340506,"max_size_pct":-0.028034,"min_psnr_gap_db":-0.273753},"status":"keep","description":"EPF Y=6.0 (was 5.0). Tiny parity improvement with quant_lf+1: 1.599->1.597.","timestamp":1773485941852,"segment":1}
{"run":775,"commit":"3859940","metric":1.599508,"metrics":{"mean_size_pct":-7.945342,"mean_psnr_gap_db":0.339432,"max_size_pct":-0.028034,"min_psnr_gap_db":-0.273873},"status":"discard","description":"EPF Y=7.0. Slightly worse than Y=6.0 (1.600 vs 1.597). Y=6.0 confirmed optimal with quant_lf+1.","timestamp":1773485994662,"segment":1}
{"run":776,"commit":"3859940","metric":1.606207,"metrics":{"mean_size_pct":-7.945342,"mean_psnr_gap_db":0.33855,"max_size_pct":-0.028034,"min_psnr_gap_db":-0.27537},"status":"discard","description":"EPF B=2.25. Worse (1.606 vs 1.597). B=2.0 confirmed.","timestamp":1773486054422,"segment":1}
{"run":777,"commit":"3859940","metric":1.597419,"metrics":{"mean_size_pct":-7.945342,"mean_psnr_gap_db":0.340506,"max_size_pct":-0.028034,"min_psnr_gap_db":-0.273753},"status":"discard","description":"Verify baseline at 1.597. Confirmed stable.","timestamp":1773486147610,"segment":1}
{"run":778,"commit":"3859940","metric":1.77713,"metrics":{"mean_size_pct":-7.909695,"mean_psnr_gap_db":0.337791,"max_size_pct":-0.024233,"min_psnr_gap_db":-0.292162},"status":"discard","description":"Custom EPF sigma with border_sad_mul=0.5. Header overhead hurts size, worst PSNR regresses. Discard.","timestamp":1773486349634,"segment":1}
{"run":779,"commit":"3859940","metric":1.597419,"metrics":{"mean_size_pct":-7.945342,"mean_psnr_gap_db":0.340506,"max_size_pct":-0.028034,"min_psnr_gap_db":-0.273753},"status":"discard","description":"EPF zeroflush reduced (0.3/0.45 vs 0.45/0.6). Identical output -- no PSNR effect. Discard.","timestamp":1773486561985,"segment":1}
{"run":780,"commit":"3859940","metric":3.054127,"metrics":{"mean_size_pct":-7.936382,"mean_psnr_gap_db":0.288181,"max_size_pct":-0.028034,"min_psnr_gap_db":-0.401244},"status":"discard","description":"EPF sharpness=7 (max, was 4). EPF sharpness DOES work now! But max is too sharp, PSNR -0.40. Discard.","timestamp":1773486673557,"segment":1}
{"run":781,"commit":"3859940","metric":1.672701,"metrics":{"mean_size_pct":-7.945342,"mean_psnr_gap_db":0.326226,"max_size_pct":-0.028034,"min_psnr_gap_db":-0.285471},"status":"discard","description":"EPF sharpness=3 (more smoothing than default 4). Parity 1.673 vs 1.597. Too much smoothing hurts.","timestamp":1773486743832,"segment":1}
{"run":782,"commit":"3859940","metric":1.661769,"metrics":{"mean_size_pct":-7.95271,"mean_psnr_gap_db":0.344209,"max_size_pct":-0.027084,"min_psnr_gap_db":-0.281878},"status":"discard","description":"EPF sharpness=5 (less smoothing). Parity 1.662 vs 1.597. Default sharpness=4 optimal with our EPF weights.","timestamp":1773486812657,"segment":1}
{"run":783,"commit":"3859940","metric":1.622962,"metrics":{"mean_size_pct":-7.874048,"mean_psnr_gap_db":0.334124,"max_size_pct":-0.020432,"min_psnr_gap_db":-0.278689},"status":"discard","description":"Custom sharp LUT with sharp[4]=0.50 (less smoothing than default 0.571). Worse parity (1.623 vs 1.597). 16-byte header overhead too.","timestamp":1773486893016,"segment":1}
{"run":784,"commit":"3859940","metric":1.608878,"metrics":{"mean_size_pct":-7.874048,"mean_psnr_gap_db":0.34455,"max_size_pct":-0.020432,"min_psnr_gap_db":-0.274038},"status":"discard","description":"Custom sharp LUT with sharp[4]=0.65 (more smoothing). Better PSNR but 16-byte header overhead offsets gain. Parity 1.609 vs 1.597.","timestamp":1773486949368,"segment":1}
{"run":785,"commit":"a3e4010","metric":1.59498,"metrics":{"mean_size_pct":-7.874467,"mean_psnr_gap_db":0.341164,"max_size_pct":-0.028034,"min_psnr_gap_db":-0.273545},"status":"keep","description":"Adaptive quant_lf: +2 for images <=7000 blocks, +1 for larger. Kodim images get finer DC, zoltan/Webkit keep safe margin. Parity 1.597->1.595.","timestamp":1773487146689,"segment":1}
{"run":786,"commit":"a3e4010","metric":1.59498,"metrics":{"mean_size_pct":-7.874467,"mean_psnr_gap_db":0.341164,"max_size_pct":-0.028034,"min_psnr_gap_db":-0.273545},"status":"discard","description":"Baseline verification. Parity 1.595 confirmed at commit a3e4010.","timestamp":1773487394991,"segment":1}
{"run":787,"commit":"a3e4010","metric":1.59498,"metrics":{"mean_size_pct":-7.874467,"mean_psnr_gap_db":0.341164,"max_size_pct":-0.028034,"min_psnr_gap_db":-0.273545},"status":"discard","description":"Add per-channel predictor selection for DC modular. No change - channels may prefer same predictor or tree overhead outweighs benefit.","timestamp":1773487628726,"segment":1}
{"run":788,"commit":"a3e4010","metric":1.614699,"metrics":{"mean_size_pct":-7.566472,"mean_psnr_gap_db":0.865372,"max_size_pct":0.252782,"min_psnr_gap_db":-0.269266},"status":"discard","description":"Custom LfQuantFactors: B inv_lf_quant 256->384 (50% finer B DC). Mean PSNR +0.87 but overshoots max_size +0.25%. Parity 1.615 vs 1.595.","timestamp":1773487948054,"segment":1}
{"run":789,"commit":"a3e4010","metric":7.427398,"metrics":{"mean_size_pct":-9.155768,"mean_psnr_gap_db":-0.291992,"max_size_pct":0.055118,"min_psnr_gap_db":-1.458222},"status":"discard","description":"Custom B inv_lf_quant=288: Webkit logo catastrophic -1.46 dB (small image, DC-dominated). zoltan +0.06% size overshoot. Custom LfQuantFactors not viable.","timestamp":1773488406814,"segment":1}
{"run":790,"commit":"a3e4010","metric":2.801403,"metrics":{"mean_size_pct":-7.581361,"mean_psnr_gap_db":0.233885,"max_size_pct":0.379648,"min_psnr_gap_db":-0.361676},"status":"discard","description":"B-channel AC bias=0.1 (round away from zero). Way worse: size +0.38% overshoot, PSNR worse too. Bias keeps too many small coefficients, kills entropy.","timestamp":1773488585883,"segment":1}
{"run":791,"commit":"a3e4010","metric":1.88354,"metrics":{"mean_size_pct":-7.874467,"mean_psnr_gap_db":0.331331,"max_size_pct":-0.028034,"min_psnr_gap_db":-0.322652},"status":"discard","description":"EPF iters=3 (was 2). Over-smooths: worst PSNR drops -0.27->-0.32 dB. Parity 1.595->1.884.","timestamp":1773488698084,"segment":1}
{"run":792,"commit":"a3e4010","metric":1.59498,"metrics":{"mean_size_pct":-7.874467,"mean_psnr_gap_db":0.341164,"max_size_pct":-0.028034,"min_psnr_gap_db":-0.273545},"status":"discard","description":"B CfL regularization halved (0.25 vs 0.5). No change - CfL factors round to same integers.","timestamp":1773488761430,"segment":1}
{"run":793,"commit":"a3e4010","metric":1.59498,"metrics":{"mean_size_pct":-7.874467,"mean_psnr_gap_db":0.341164,"max_size_pct":-0.028034,"min_psnr_gap_db":-0.273545},"status":"discard","description":"B CfL regularization=0 (pure least-squares). No change - regularization has zero impact on final integer factors.","timestamp":1773488817177,"segment":1}
