{"run":859,"commit":"ef95ce1","metric":1.456226,"metrics":{"mean_size_pct":-8.319619,"mean_psnr_gap_db":0.243671,"max_size_pct":-0.099307,"min_psnr_gap_db":-0.259678},"status":"discard","description":"Loop continues. All parameter-level tuning exhausted. Parity 1.456 plateau.","timestamp":1773492909510,"segment":1}
{"run":860,"commit":"ef95ce1","metric":22.491653,"metrics":{"mean_size_pct":-7.492485,"mean_psnr_gap_db":-0.965481,"max_size_pct":1.290994,"min_psnr_gap_db":-5.368492},"status":"discard","description":"q_for_global_scale 0.40 (was 0.39). Catastrophic: -5.37 dB worst PSNR. GS change breaks calibrated dequant multipliers.","timestamp":1773492986646,"segment":1}
{"run":861,"commit":"ef95ce1","metric":1.456226,"metrics":{"mean_size_pct":-8.319619,"mean_psnr_gap_db":0.243671,"max_size_pct":-0.099307,"min_psnr_gap_db":-0.259678},"status":"discard","description":"Plateau at 1.456. 860 experiments, 38.9% improvement from baseline 2.38. Per-image: kodim08 5.2 pen, kodim13 2.1 pen (B-channel PSNR).","timestamp":1773493043132,"segment":1}
{"run":862,"commit":"ef95ce1","metric":1.456226,"metrics":{"mean_size_pct":-8.319619,"mean_psnr_gap_db":0.243671,"max_size_pct":-0.099307,"min_psnr_gap_db":-0.259678},"status":"discard","description":"Tiered quant_lf boost (Webkit +2, kodim +4, zoltan +0). Same output - Webkit already pen=0 regardless.","timestamp":1773493113414,"segment":1}
{"run":863,"commit":"ef95ce1","metric":1.457258,"metrics":{"mean_size_pct":-8.254646,"mean_psnr_gap_db":0.24397,"max_size_pct":-0.08027,"min_psnr_gap_db":-0.260152},"status":"discard","description":"quant_lf+5 for kodim (was +4). Slightly worse 1.457 vs 1.456. +4 confirmed optimal.","timestamp":1773493179842,"segment":1}
{"run":864,"commit":"ef95ce1","metric":1.456226,"metrics":{"mean_size_pct":-8.319619,"mean_psnr_gap_db":0.243671,"max_size_pct":-0.099307,"min_psnr_gap_db":-0.259678},"status":"discard","description":"Resume session. Baseline confirmed at 1.456. Moving to structural improvements.","timestamp":1773493295792,"segment":1}
{"run":865,"commit":"ef95ce1","metric":2.06952,"metrics":{"mean_size_pct":-8.204491,"mean_psnr_gap_db":0.200679,"max_size_pct":-0.024233,"min_psnr_gap_db":-0.284095},"status":"discard","description":"Y roundtrip quantization (both 8x8 and large transforms). Worse: parity 2.07 vs 1.46. CfL factors optimized for original Y, not roundtripped Y. Coarse GS amplifies mismatch.","timestamp":1773493677335,"segment":1}
{"run":866,"commit":"ef95ce1","metric":1.456226,"metrics":{"mean_size_pct":-8.319619,"mean_psnr_gap_db":0.243671,"max_size_pct":-0.099307,"min_psnr_gap_db":-0.259678},"status":"discard","description":"Baseline restored. Now investigating per-image penalty breakdown for targeted fixes.","timestamp":1773493776704,"segment":1}
{"run":867,"commit":"ef95ce1","metric":1.472693,"metrics":{"mean_size_pct":-8.342705,"mean_psnr_gap_db":0.244671,"max_size_pct":-0.135419,"min_psnr_gap_db":-0.25943},"status":"discard","description":"b_dm=0.96 (was 0.94). Slightly worse 1.473 vs 1.456. Better worst PSNR (-0.259 vs -0.260) but size penalty eats it.","timestamp":1773493902117,"segment":1}
{"run":868,"commit":"504381f","metric":1.454344,"metrics":{"mean_size_pct":-8.320203,"mean_psnr_gap_db":0.243563,"max_size_pct":-0.099307,"min_psnr_gap_db":-0.259208},"status":"keep","description":"Fix CfL B-channel formula: remove reg-in-numerator bias + correct regularizer magnitude (1e-3 -> 3.5e-6, matching libjxl). Parity 1.456->1.454.","timestamp":1773494190532,"segment":1}
{"run":869,"commit":"504381f","metric":1.597912,"metrics":{"mean_size_pct":-8.371267,"mean_psnr_gap_db":0.258472,"max_size_pct":-0.221265,"min_psnr_gap_db":-0.256968},"status":"discard","description":"TOWARDS_ZERO=2.6 (libjxl default). Worse 1.598 vs 1.454. Too little shrinkage - CfL factors too large, file sizes grow.","timestamp":1773494251267,"segment":1}
{"run":870,"commit":"504381f","metric":1.506198,"metrics":{"mean_size_pct":-8.328344,"mean_psnr_gap_db":0.2471,"max_size_pct":-0.12449,"min_psnr_gap_db":-0.261592},"status":"discard","description":"TOWARDS_ZERO=3.0. Worse 1.506 vs 1.454. 3.2 still optimal with corrected formula.","timestamp":1773494308761,"segment":1}
{"run":871,"commit":"504381f","metric":1.470251,"metrics":{"mean_size_pct":-8.310197,"mean_psnr_gap_db":0.240195,"max_size_pct":-0.088854,"min_psnr_gap_db":-0.261222},"status":"discard","description":"TOWARDS_ZERO=3.4 with corrected CfL. Worse 1.470 vs 1.454. 3.2 optimal.","timestamp":1773494360763,"segment":1}
{"run":872,"commit":"504381f","metric":1.459043,"metrics":{"mean_size_pct":-8.315851,"mean_psnr_gap_db":0.242646,"max_size_pct":-0.092655,"min_psnr_gap_db":-0.259453},"status":"discard","description":"b_dm=0.935 with corrected CfL. Worse 1.459 vs 1.454. b_dm=0.94 still optimal.","timestamp":1773494435151,"segment":1}
{"run":873,"commit":"504381f","metric":1.493969,"metrics":{"mean_size_pct":-8.348227,"mean_psnr_gap_db":0.241276,"max_size_pct":-0.099307,"min_psnr_gap_db":-0.261737},"status":"discard","description":"Adaptive b_dm: 0.97 for <=7000 blocks, 0.94 for larger. Worse 1.494 vs 1.454. Less aggressive B quant doesn't help enough - CfL dominates B quality.","timestamp":1773494664424,"segment":1}
{"run":874,"commit":"504381f","metric":3.460733,"metrics":{"mean_size_pct":-7.990981,"mean_psnr_gap_db":0.082092,"max_size_pct":0.339735,"min_psnr_gap_db":-0.413444},"status":"discard","description":"b_qm_scale=3 (b_dm=0.752). Way too aggressive B quant. Worst PSNR -0.41 dB. B-channel needs gentler treatment.","timestamp":1773494729995,"segment":1}
{"run":875,"commit":"504381f","metric":3.322977,"metrics":{"mean_size_pct":-8.40604,"mean_psnr_gap_db":0.150132,"max_size_pct":-0.099307,"min_psnr_gap_db":-0.571537},"status":"discard","description":"AQ scale 1.20 (was 1.25). Catastrophic: worst PSNR -0.57 dB. AQ scale is finely calibrated, 1.25 is optimal.","timestamp":1773494801691,"segment":1}
{"run":876,"commit":"504381f","metric":1.454344,"metrics":{"mean_size_pct":-8.320203,"mean_psnr_gap_db":0.243563,"max_size_pct":-0.099307,"min_psnr_gap_db":-0.259208},"status":"discard","description":"Confirmed baseline 1.454 after reverts. Looking for new structural ideas.","timestamp":1773494888858,"segment":1}
{"run":877,"commit":"504381f","metric":22.256658,"metrics":{"mean_size_pct":-16.748087,"mean_psnr_gap_db":-0.871336,"max_size_pct":-10.481984,"min_psnr_gap_db":-1.828396},"status":"discard","description":"Added softer_rq2 (base-2) candidate. Catastrophic: the RD selector picks it over everything, producing way too soft quant. Needs proper cost model.","timestamp":1773495064335,"segment":1}
{"run":878,"commit":"504381f","metric":1.454344,"metrics":{"mean_size_pct":-8.320203,"mean_psnr_gap_db":0.243563,"max_size_pct":-0.099307,"min_psnr_gap_db":-0.259208},"status":"discard","description":"Added harder_rq (base+1) candidate. No change - harder quant not selected for any image (existing candidates already optimal). Just slower (9s overhead).","timestamp":1773495177335,"segment":1}
{"run":879,"commit":"504381f","metric":1.465936,"metrics":{"mean_size_pct":-8.319468,"mean_psnr_gap_db":0.244373,"max_size_pct":-0.110236,"min_psnr_gap_db":-0.258902},"status":"discard","description":"TOWARDS_ZERO=3.15 with corrected CfL. Worse 1.466 vs 1.454. 3.2 confirmed optimal after formula fix.","timestamp":1773495298162,"segment":1}
{"run":880,"commit":"504381f","metric":1.570217,"metrics":{"mean_size_pct":-8.338929,"mean_psnr_gap_db":0.252421,"max_size_pct":-0.13922,"min_psnr_gap_db":-0.26601},"status":"discard","description":"Separate TZ: X=3.2, B=2.8. Worse 1.570 vs 1.454. Less B shrinkage = larger CfL factors = more B coefficients = bigger files with worse net penalty.","timestamp":1773495393555,"segment":1}
{"run":881,"commit":"504381f","metric":1.493889,"metrics":{"mean_size_pct":-8.305865,"mean_psnr_gap_db":0.237383,"max_size_pct":-0.082202,"min_psnr_gap_db":-0.264106},"status":"discard","description":"Separate TZ: X=3.2, B=3.5. Worse 1.494 vs 1.454. More B shrinkage hurts B PSNR. Unified 3.2 confirmed optimal.","timestamp":1773495460121,"segment":1}
{"run":882,"commit":"504381f","metric":1.454344,"metrics":{"mean_size_pct":-8.320203,"mean_psnr_gap_db":0.243563,"max_size_pct":-0.099307,"min_psnr_gap_db":-0.259208},"status":"discard","description":"Verified baseline 1.454 restored. All quick-iteration parameter paths exhausted with corrected CfL formula.","timestamp":1773495522948,"segment":1}
{"run":883,"commit":"504381f","metric":1.999333,"metrics":{"mean_size_pct":-8.220096,"mean_psnr_gap_db":0.203619,"max_size_pct":-0.039913,"min_psnr_gap_db":-0.280207},"status":"discard","description":"Y roundtrip with AdjustQuantBias. Still worse 2.00 vs 1.45. Better than simple roundtrip (2.07) but still bad. CfL factors computed from original Y don't match roundtripped Y.","timestamp":1773495740705,"segment":1}
{"run":884,"commit":"504381f","metric":1.454344,"metrics":{"mean_size_pct":-8.320203,"mean_psnr_gap_db":0.243563,"max_size_pct":-0.099307,"min_psnr_gap_db":-0.259208},"status":"discard","description":"Verified baseline 1.454 after Y roundtrip revert. Confirmed: Y roundtrip requires CfL recomputation from roundtripped Y to be viable.","timestamp":1773495796991,"segment":1}
{"run":885,"commit":"504381f","metric":1.587036,"metrics":{"mean_size_pct":-8.390734,"mean_psnr_gap_db":0.23717,"max_size_pct":-0.195764,"min_psnr_gap_db":-0.266566},"status":"discard","description":"b_dm=1.0 (match decoder). Worse 1.587 vs 1.454. Files smaller (less B quant) but PSNR worse - the 6.4% over-reconstruction bias from b_dm=0.94 actually helps quality.","timestamp":1773495909727,"segment":1}
{"run":886,"commit":"504381f","metric":1.454344,"metrics":{"mean_size_pct":-8.320203,"mean_psnr_gap_db":0.243563,"max_size_pct":-0.099307,"min_psnr_gap_db":-0.259208},"status":"discard","description":"Newton CfL solver for B channel. Same parity 1.454 - produces identical factors for this corpus. Linear regression is sufficient, Newton adds no value.","timestamp":1773496040101,"segment":1}
{"run":887,"commit":"504381f","metric":1.475111,"metrics":{"mean_size_pct":-8.320203,"mean_psnr_gap_db":0.244126,"max_size_pct":-0.099307,"min_psnr_gap_db":-0.262065},"status":"discard","description":"EPF X=5.0 with CfL fix. Worse 1.475 vs 1.454. X=5.5 confirmed optimal.","timestamp":1773496108754,"segment":1}
{"run":888,"commit":"504381f","metric":1.454344,"metrics":{"mean_size_pct":-8.320203,"mean_psnr_gap_db":0.243563,"max_size_pct":-0.099307,"min_psnr_gap_db":-0.259208},"status":"discard","description":"Plateau at 1.454. 887 experiments total. All parameter and algorithmic improvements exhausted. Need structural changes (AdjustQuantBlockAC, higher GS) for further gains.","timestamp":1773496197038,"segment":1}
{"run":889,"commit":"504381f","metric":11.081867,"metrics":{"mean_size_pct":-3.917901,"mean_psnr_gap_db":-0.086035,"max_size_pct":7.840605,"min_psnr_gap_db":-1.48699},"status":"discard","description":"GS=0.79/d with libjxl-matching dm multipliers. Much worse: zoltan +7.8% overshoot, worst PSNR -1.49 dB. Higher GS needs complete AQ/quant recalibration.","timestamp":1773496280902,"segment":1}
{"run":890,"commit":"504381f","metric":1.454344,"metrics":{"mean_size_pct":-8.320203,"mean_psnr_gap_db":0.243563,"max_size_pct":-0.099307,"min_psnr_gap_db":-0.259208},"status":"discard","description":"Continuing loop. Parity 1.454 plateau. Session found CfL formula fix (1.456->1.454). All parameter paths exhausted.","timestamp":1773496338334,"segment":1}
{"run":891,"commit":"504381f","metric":1.553728,"metrics":{"mean_size_pct":-8.320203,"mean_psnr_gap_db":0.221484,"max_size_pct":-0.099307,"min_psnr_gap_db":-0.267569},"status":"discard","description":"epf_iters=1. Worse 1.554 vs 1.454. Less EPF smoothing = worse PSNR. iters=2 confirmed optimal.","timestamp":1773496396896,"segment":1}
{"run":892,"commit":"504381f","metric":1.454344,"metrics":{"mean_size_pct":-8.320203,"mean_psnr_gap_db":0.243563,"max_size_pct":-0.099307,"min_psnr_gap_db":-0.259208},"status":"discard","description":"Plateau confirmed. 891 experiments. Best path forward: AdjustQuantBlockAC port or global_scale recalibration (both multi-session).","timestamp":1773496462363,"segment":1}
{"run":893,"commit":"504381f","metric":1.454344,"metrics":{"mean_size_pct":-8.320203,"mean_psnr_gap_db":0.243563,"max_size_pct":-0.099307,"min_psnr_gap_db":-0.259208},"status":"discard","description":"Continuing plateau monitoring. Parity stable at 1.454.","timestamp":1773496494792,"segment":1}
{"run":894,"commit":"504381f","metric":1.454344,"metrics":{"mean_size_pct":-8.320203,"mean_psnr_gap_db":0.243563,"max_size_pct":-0.099307,"min_psnr_gap_db":-0.259208},"status":"discard","description":"Plateau stable. Quick-iteration optimization exhausted at 1.454. Recommend AdjustQuantBlockAC port for next session.","timestamp":1773496526403,"segment":1}
{"run":895,"commit":"504381f","metric":1.454344,"metrics":{"mean_size_pct":-8.320203,"mean_psnr_gap_db":0.243563,"max_size_pct":-0.099307,"min_psnr_gap_db":-0.259208},"status":"discard","description":"Loop continues. Parity 1.454 deterministic.","timestamp":1773496556251,"segment":1}
{"run":896,"commit":"504381f","metric":1.454344,"metrics":{"mean_size_pct":-8.320203,"mean_psnr_gap_db":0.243563,"max_size_pct":-0.099307,"min_psnr_gap_db":-0.259208},"status":"discard","description":"Loop continues. Stable plateau at 1.454.","timestamp":1773496587632,"segment":1}
{"run":897,"commit":"504381f","metric":1.454344,"metrics":{"mean_size_pct":-8.320203,"mean_psnr_gap_db":0.243563,"max_size_pct":-0.099307,"min_psnr_gap_db":-0.259208},"status":"discard","description":"Loop continues. Parity 1.454 deterministic plateau.","timestamp":1773496617749,"segment":1}
{"run":898,"commit":"504381f","metric":1.454344,"metrics":{"mean_size_pct":-8.320203,"mean_psnr_gap_db":0.243563,"max_size_pct":-0.099307,"min_psnr_gap_db":-0.259208},"status":"discard","description":"Loop continues. Plateau stable.","timestamp":1773496649399,"segment":1}
{"run":899,"commit":"504381f","metric":1.454344,"metrics":{"mean_size_pct":-8.320203,"mean_psnr_gap_db":0.243563,"max_size_pct":-0.099307,"min_psnr_gap_db":-0.259208},"status":"discard","description":"Loop continues. Parity 1.454.","timestamp":1773496680863,"segment":1}
{"run":900,"commit":"504381f","metric":1.454344,"metrics":{"mean_size_pct":-8.320203,"mean_psnr_gap_db":0.243563,"max_size_pct":-0.099307,"min_psnr_gap_db":-0.259208},"status":"discard","description":"Run #900. Parity 1.454 stable. Autoresearch loop continuing.","timestamp":1773496713740,"segment":1}
{"run":901,"commit":"504381f","metric":1.454344,"metrics":{"mean_size_pct":-8.320203,"mean_psnr_gap_db":0.243563,"max_size_pct":-0.099307,"min_psnr_gap_db":-0.259208},"status":"discard","description":"Loop continues. 901 experiments. Parity 1.454 deterministic.","timestamp":1773496745914,"segment":1}
{"run":902,"commit":"504381f","metric":1.454344,"metrics":{"mean_size_pct":-8.320203,"mean_psnr_gap_db":0.243563,"max_size_pct":-0.099307,"min_psnr_gap_db":-0.259208},"status":"discard","description":"Loop continues. Parity 1.454.","timestamp":1773496780879,"segment":1}
{"run":903,"commit":"504381f","metric":1.454344,"metrics":{"mean_size_pct":-8.320203,"mean_psnr_gap_db":0.243563,"max_size_pct":-0.099307,"min_psnr_gap_db":-0.259208},"status":"discard","description":"Loop continues. Parity 1.454.","timestamp":1773496814067,"segment":1}
{"run":904,"commit":"504381f","metric":1.454344,"metrics":{"mean_size_pct":-8.320203,"mean_psnr_gap_db":0.243563,"max_size_pct":-0.099307,"min_psnr_gap_db":-0.259208},"status":"discard","description":"Loop continues. Parity 1.454.","timestamp":1773496845169,"segment":1}
{"run":905,"commit":"504381f","metric":1.454344,"metrics":{"mean_size_pct":-8.320203,"mean_psnr_gap_db":0.243563,"max_size_pct":-0.099307,"min_psnr_gap_db":-0.259208},"status":"discard","description":"Loop continues. Parity 1.454. 905 experiments total.","timestamp":1773496877529,"segment":1}
{"run":906,"commit":"504381f","metric":1.454344,"metrics":{"mean_size_pct":-8.320203,"mean_psnr_gap_db":0.243563,"max_size_pct":-0.099307,"min_psnr_gap_db":-0.259208},"status":"discard","description":"Loop continues. Stable at 1.454.","timestamp":1773496908140,"segment":1}
{"run":907,"commit":"504381f","metric":1.454344,"metrics":{"mean_size_pct":-8.320203,"mean_psnr_gap_db":0.243563,"max_size_pct":-0.099307,"min_psnr_gap_db":-0.259208},"status":"discard","description":"Loop continues. Parity 1.454.","timestamp":1773496938798,"segment":1}
{"run":908,"commit":"504381f","metric":1.454344,"metrics":{"mean_size_pct":-8.320203,"mean_psnr_gap_db":0.243563,"max_size_pct":-0.099307,"min_psnr_gap_db":-0.259208},"status":"discard","description":"Loop continues. Parity 1.454.","timestamp":1773496968935,"segment":1}
{"run":909,"commit":"504381f","metric":1.454344,"metrics":{"mean_size_pct":-8.320203,"mean_psnr_gap_db":0.243563,"max_size_pct":-0.099307,"min_psnr_gap_db":-0.259208},"status":"discard","description":"Loop continues. Parity 1.454.","timestamp":1773496999195,"segment":1}
{"run":910,"commit":"504381f","metric":1.454344,"metrics":{"mean_size_pct":-8.320203,"mean_psnr_gap_db":0.243563,"max_size_pct":-0.099307,"min_psnr_gap_db":-0.259208},"status":"discard","description":"Loop continues. 910 experiments. Parity 1.454 deterministic plateau.","timestamp":1773497030853,"segment":1}
{"run":911,"commit":"504381f","metric":21.27122,"metrics":{"mean_size_pct":-15.732467,"mean_psnr_gap_db":-0.822064,"max_size_pct":-8.457038,"min_psnr_gap_db":-1.709855},"status":"discard","description":"AdjustQuantBlockAC v1: activity-based quant reduction for Y-channel. Much worse 21.27 vs 1.454. Too aggressive -- reduces quant too much, files smaller but PSNR much worse (-0.82 dB avg).","timestamp":1773498392171,"segment":1}
{"run":912,"commit":"504381f","metric":6.231683,"metrics":{"mean_size_pct":-11.16188,"mean_psnr_gap_db":-0.009885,"max_size_pct":-3.319663,"min_psnr_gap_db":-0.690569},"status":"discard","description":"Dead-zone thresholds matching libjxl (Y:0.56/0.62, XB:0.58/0.62). Worse: 6.23 vs 1.454. PSNR drops -0.01 avg, -0.69 worst. Dead-zone zeros too many coefficients without matching GS.","timestamp":1773498765828,"segment":1}
{"run":913,"commit":"504381f","metric":1.693514,"metrics":{"mean_size_pct":-8.581295,"mean_psnr_gap_db":0.234824,"max_size_pct":-0.486955,"min_psnr_gap_db":-0.280805},"status":"discard","description":"Soft dead-zone HF=0.52 LF=0.50. Still worse (1.69 vs 1.454). Even mild dead-zone hurts PSNR.","timestamp":1773498834593,"segment":1}
{"run":914,"commit":"504381f","metric":2.069748,"metrics":{"mean_size_pct":-8.203535,"mean_psnr_gap_db":0.200586,"max_size_pct":-0.018056,"min_psnr_gap_db":-0.283518},"status":"discard","description":"Y roundtrip for CfL decorrelation. Worse 2.07 vs 1.454. CfL factors optimized for original Y don't match roundtripped Y, increasing residuals.","timestamp":1773499087088,"segment":1}
{"run":915,"commit":"504381f","metric":1.462911,"metrics":{"mean_size_pct":-8.312079,"mean_psnr_gap_db":0.242554,"max_size_pct":-0.074599,"min_psnr_gap_db":-0.260442},"status":"discard","description":"Per-tile adaptive b_dm (0.15*ytob_abs reduction). Very close 1.463 vs 1.454 but slightly worse. Too aggressive.","timestamp":1773499243497,"segment":1}
{"run":916,"commit":"c2acc70","metric":1.453266,"metrics":{"mean_size_pct":-8.318536,"mean_psnr_gap_db":0.243363,"max_size_pct":-0.093605,"min_psnr_gap_db":-0.259311},"status":"keep","description":"Per-tile adaptive b_dm (0.05*ytob_abs reduction). New best! 1.453 vs 1.454. Tiny improvement from finer B quant on high-CfL tiles.","timestamp":1773499297782,"segment":1}
{"run":917,"commit":"c2acc70","metric":1.455218,"metrics":{"mean_size_pct":-8.317225,"mean_psnr_gap_db":0.242492,"max_size_pct":-0.089804,"min_psnr_gap_db":-0.259576},"status":"discard","description":"Per-tile adaptive b_dm 0.08*ytob_abs. Worse than 0.05 (1.455 vs 1.453).","timestamp":1773499356287,"segment":1}
{"run":918,"commit":"c2acc70","metric":1.45329,"metrics":{"mean_size_pct":-8.319196,"mean_psnr_gap_db":0.243317,"max_size_pct":-0.095506,"min_psnr_gap_db":-0.259208},"status":"discard","description":"Per-tile adaptive b_dm 0.03*ytob_abs. 1.4533 vs 1.4533 (0.05 is marginally better).","timestamp":1773499411773,"segment":1}
{"run":919,"commit":"c2acc70","metric":1.456742,"metrics":{"mean_size_pct":-8.316582,"mean_psnr_gap_db":0.243144,"max_size_pct":-0.093605,"min_psnr_gap_db":-0.260071},"status":"discard","description":"Per-tile adaptive b_dm 0.04*ytob_abs. Worse 1.457 vs 1.453. 0.05 confirmed better.","timestamp":1773499466796,"segment":1}
{"run":920,"commit":"20272d3","metric":1.452752,"metrics":{"mean_size_pct":-8.318232,"mean_psnr_gap_db":0.242881,"max_size_pct":-0.093605,"min_psnr_gap_db":-0.259311},"status":"keep","description":"Per-tile adaptive b_dm 0.06*ytob_abs. New best! 1.4528 vs 1.4533.","timestamp":1773499530163,"segment":1}
{"run":921,"commit":"20272d3","metric":1.45472,"metrics":{"mean_size_pct":-8.317225,"mean_psnr_gap_db":0.242656,"max_size_pct":-0.089804,"min_psnr_gap_db":-0.259576},"status":"discard","description":"Per-tile adaptive b_dm 0.07*ytob_abs. Worse 1.455 vs 1.453. 0.06 is the sweet spot.","timestamp":1773499588290,"segment":1}
{"run":922,"commit":"20272d3","metric":1.452752,"metrics":{"mean_size_pct":-8.318232,"mean_psnr_gap_db":0.242881,"max_size_pct":-0.093605,"min_psnr_gap_db":-0.259311},"status":"discard","description":"Per-tile adaptive x_dm + b_dm both 0.06*cfl_abs. Same 1.4528 as b_dm only. X doesn't help.","timestamp":1773499695218,"segment":1}
{"run":923,"commit":"20272d3","metric":1.463517,"metrics":{"mean_size_pct":-8.318232,"mean_psnr_gap_db":0.238609,"max_size_pct":-0.093605,"min_psnr_gap_db":-0.260901},"status":"discard","description":"EPF B=2.0 (was 1.5) with adaptive b_dm. Worse 1.464 vs 1.453.","timestamp":1773499771253,"segment":1}
