{"run":668,"commit":"73889de","metric":1.758335,"metrics":{"mean_size_pct":-9.808619,"mean_psnr_gap_db":0.214625,"max_size_pct":-0.733163,"min_psnr_gap_db":-0.293176},"status":"keep","description":"Further increase CfL towards-zero shrink to 3.0. Additional parity improvement (1.768 -> 1.758), mostly from better worst-case penalty tradeoff.","timestamp":1773476939511,"segment":1}
{"run":669,"commit":"73889de","metric":1.760629,"metrics":{"mean_size_pct":-9.796442,"mean_psnr_gap_db":0.211632,"max_size_pct":-0.707505,"min_psnr_gap_db":-0.29046},"status":"discard","description":"Test CfL towards-zero shrink 3.2. Slight parity regression vs 3.0 baseline; discard.","timestamp":1773476998142,"segment":1}
{"run":670,"commit":"18497f9","metric":1.751441,"metrics":{"mean_size_pct":-9.81267,"mean_psnr_gap_db":0.216813,"max_size_pct":-0.757396,"min_psnr_gap_db":-0.292721},"status":"keep","description":"Refine CfL shrink to 2.9 (between 2.8 and 3.0). Best result so far: parity 1.751 with improved PSNR/size tradeoff.","timestamp":1773477058849,"segment":1}
{"run":671,"commit":"d5b0c23","metric":1.73831,"metrics":{"mean_size_pct":-9.815794,"mean_psnr_gap_db":0.216442,"max_size_pct":-0.755495,"min_psnr_gap_db":-0.292973},"status":"keep","description":"Fine-tune CfL towards-zero shrink to 2.95. Further parity improvement to 1.738.","timestamp":1773477123332,"segment":1}
{"run":672,"commit":"7e9cac6","metric":1.729106,"metrics":{"mean_size_pct":-9.813803,"mean_psnr_gap_db":0.217101,"max_size_pct":-0.753595,"min_psnr_gap_db":-0.293733},"status":"keep","description":"Nudge CfL towards-zero shrink to 2.97. Additional parity gain to 1.729.","timestamp":1773477175979,"segment":1}
{"run":673,"commit":"7e9cac6","metric":1.736251,"metrics":{"mean_size_pct":-9.809792,"mean_psnr_gap_db":0.216452,"max_size_pct":-0.735064,"min_psnr_gap_db":-0.293733},"status":"discard","description":"Try CfL towards-zero shrink 2.98. Slight regression vs 2.97 best; discard.","timestamp":1773477231952,"segment":1}
{"run":674,"commit":"b9f1566","metric":1.729033,"metrics":{"mean_size_pct":-9.815794,"mean_psnr_gap_db":0.216906,"max_size_pct":-0.755495,"min_psnr_gap_db":-0.292973},"status":"keep","description":"Set CfL towards-zero shrink to 2.96. Tiny additional parity gain over 2.97 (1.729106 -> 1.729033).","timestamp":1773477286388,"segment":1}
{"run":675,"commit":"6ca3611","metric":1.726066,"metrics":{"mean_size_pct":-9.81492,"mean_psnr_gap_db":0.217253,"max_size_pct":-0.753595,"min_psnr_gap_db":-0.292973},"status":"keep","description":"Fine-grain CfL shrink tuning to 2.965 gives another small parity win (1.729033 -> 1.726066).","timestamp":1773477341894,"segment":1}
{"run":676,"commit":"6ca3611","metric":1.726066,"metrics":{"mean_size_pct":-9.81492,"mean_psnr_gap_db":0.217253,"max_size_pct":-0.753595,"min_psnr_gap_db":-0.292973},"status":"discard","description":"Test CfL shrink 2.968. No primary-metric change vs 2.965, discard.","timestamp":1773477394503,"segment":1}
{"run":677,"commit":"6ca3611","metric":1.729033,"metrics":{"mean_size_pct":-9.815794,"mean_psnr_gap_db":0.216906,"max_size_pct":-0.755495,"min_psnr_gap_db":-0.292973},"status":"discard","description":"Test CfL shrink 2.962. Regresses to 1.729 range; keep 2.965.","timestamp":1773477453569,"segment":1}
{"run":678,"commit":"6ca3611","metric":1.727834,"metrics":{"mean_size_pct":-9.823242,"mean_psnr_gap_db":0.219069,"max_size_pct":-0.76975,"min_psnr_gap_db":-0.292629},"status":"discard","description":"Retune B multiplier to 0.94 after CfL/merge updates. Near tie but slightly worse than 0.93 baseline; discard.","timestamp":1773477520969,"segment":1}
{"run":679,"commit":"6ca3611","metric":1.730351,"metrics":{"mean_size_pct":-9.816885,"mean_psnr_gap_db":0.217802,"max_size_pct":-0.762147,"min_psnr_gap_db":-0.292767},"status":"discard","description":"Retune B multiplier to 0.935 under latest settings. Slight regression; discard.","timestamp":1773477581963,"segment":1}
{"run":680,"commit":"6ca3611","metric":1.726066,"metrics":{"mean_size_pct":-9.81492,"mean_psnr_gap_db":0.217253,"max_size_pct":-0.753595,"min_psnr_gap_db":-0.292973},"status":"discard","description":"Lower 16/32 merge multipliers to 5.0/6.5 to probe sensitivity after CfL tuning. No metric change (same plateau), discard.","timestamp":1773477645563,"segment":1}
{"run":681,"commit":"6ca3611","metric":1.790221,"metrics":{"mean_size_pct":-5.398921,"mean_psnr_gap_db":0.698943,"max_size_pct":0.713682,"min_psnr_gap_db":-0.282433},"status":"discard","description":"Re-test extra_dc_precision=2 at distance<=1.0 on latest baseline. Improves PSNR but size overshoots (max +0.71%), resulting in parity regression.","timestamp":1773477706162,"segment":1}
{"run":682,"commit":"6ca3611","metric":1.854603,"metrics":{"mean_size_pct":-5.482667,"mean_psnr_gap_db":0.699025,"max_size_pct":0.608673,"min_psnr_gap_db":-0.29037},"status":"discard","description":"Combination probe: extra_dc_precision=2 with B multiplier reset to 1.0. Still regresses parity (size overshoot dominates), discard.","timestamp":1773477786207,"segment":1}
{"run":683,"commit":"6ca3611","metric":1.83705,"metrics":{"mean_size_pct":-5.459606,"mean_psnr_gap_db":0.692309,"max_size_pct":0.612949,"min_psnr_gap_db":-0.296972},"status":"discard","description":"Combo test: enable extra_dc_precision=2 and relax merge multipliers back to 2.0/2.5/3.5 for size recovery. Still regresses parity due persistent size overshoot.","timestamp":1773477864425,"segment":1}
{"run":684,"commit":"6ca3611","metric":1.726066,"metrics":{"mean_size_pct":-9.81492,"mean_psnr_gap_db":0.217253,"max_size_pct":-0.753595,"min_psnr_gap_db":-0.292973},"status":"discard","description":"Implemented dual-global-scale candidate probe (adds Falcon-style gs=0.79/d adaptive map with per-candidate global_scale/quant_lf). No parity change, only slower encoding, so discard.","timestamp":1773478062140,"segment":1}
{"run":685,"commit":"6ca3611","metric":1.729033,"metrics":{"mean_size_pct":-9.815223,"mean_psnr_gap_db":0.217104,"max_size_pct":-0.752644,"min_psnr_gap_db":-0.292973},"status":"discard","description":"Increase CfL regression dist_mul 1e-3 -> 1.2e-3 (scalar+SIMD) to damp multipliers further. Regresses to 1.729 range, discard.","timestamp":1773478208062,"segment":1}
{"run":686,"commit":"6ca3611","metric":1.726066,"metrics":{"mean_size_pct":-9.814729,"mean_psnr_gap_db":0.217251,"max_size_pct":-0.752644,"min_psnr_gap_db":-0.292973},"status":"discard","description":"Decrease CfL dist_mul 1e-3 -> 8e-4 (scalar+SIMD). No primary-metric change; discard.","timestamp":1773478274040,"segment":1}
{"run":687,"commit":"6ca3611","metric":2.045649,"metrics":{"mean_size_pct":-9.741768,"mean_psnr_gap_db":0.179728,"max_size_pct":-0.630054,"min_psnr_gap_db":-0.322968},"status":"discard","description":"Tune CfL B base correlation from 1.0 to 0.98 (scalar+SIMD). Strong regression: worse PSNR floor and size, discard.","timestamp":1773478371487,"segment":1}
{"run":688,"commit":"6ca3611","metric":2.389101,"metrics":{"mean_size_pct":-9.907931,"mean_psnr_gap_db":0.213799,"max_size_pct":-0.854327,"min_psnr_gap_db":-0.336267},"status":"discard","description":"Tune CfL B base correlation to 1.02 (scalar+SIMD). Severe parity regression (min_psnr_gap worsens to -0.336), discard.","timestamp":1773478449384,"segment":1}
{"run":689,"commit":"6ca3611","metric":1.726066,"metrics":{"mean_size_pct":-9.81492,"mean_psnr_gap_db":0.217253,"max_size_pct":-0.753595,"min_psnr_gap_db":-0.292973},"status":"discard","description":"Micro-tune CfL shrink to 2.966. No primary-metric change vs 2.965, discard.","timestamp":1773478525039,"segment":1}
{"run":690,"commit":"6ca3611","metric":1.729033,"metrics":{"mean_size_pct":-9.815414,"mean_psnr_gap_db":0.217104,"max_size_pct":-0.753595,"min_psnr_gap_db":-0.292973},"status":"discard","description":"Micro-tune CfL shrink to 2.964. Regresses to 1.729 range; keep 2.965.","timestamp":1773478601922,"segment":1}
{"run":691,"commit":"6ca3611","metric":1.726066,"metrics":{"mean_size_pct":-9.81492,"mean_psnr_gap_db":0.217253,"max_size_pct":-0.753595,"min_psnr_gap_db":-0.292973},"status":"discard","description":"Micro-tune CfL shrink to 2.9655. No primary-metric change vs 2.965 baseline, discard.","timestamp":1773478711255,"segment":1}
{"run":692,"commit":"6ca3611","metric":2.364376,"metrics":{"mean_size_pct":-9.707475,"mean_psnr_gap_db":0.174046,"max_size_pct":-0.66379,"min_psnr_gap_db":-0.322275},"status":"discard","description":"Implement Y-roundtrip quantization (quantize Y, dequant via AdjustQuantBias, use for X/B CfL). Regresses parity 1.726->2.364 because CfL factors were fitted to original Y not roundtripped Y.","timestamp":1773479026064,"segment":1}
{"run":693,"commit":"6ca3611","metric":6.40445,"metrics":{"mean_size_pct":-12.603905,"mean_psnr_gap_db":-0.024334,"max_size_pct":-5.386112,"min_psnr_gap_db":-0.719162},"status":"discard","description":"Add libjxl-style quadrant dead-zone thresholds (Y: 0.56/0.62, XB: 0.58/0.62) to AC quantization. Massive PSNR regression (-0.72 dB worst case) -- thresholds too aggressive at our finer quantization scale.","timestamp":1773479137822,"segment":1}
{"run":694,"commit":"6ca3611","metric":1.798311,"metrics":{"mean_size_pct":-9.906089,"mean_psnr_gap_db":0.215547,"max_size_pct":-0.934628,"min_psnr_gap_db":-0.301441},"status":"discard","description":"Try minimal dead-zone threshold 0.505 (vs default 0.5). Slight parity regression, confirms dead zones don't help at our quantization scale.","timestamp":1773479215504,"segment":1}
{"run":695,"commit":"6ca3611","metric":1.792026,"metrics":{"mean_size_pct":-8.569339,"mean_psnr_gap_db":0.225907,"max_size_pct":0.72271,"min_psnr_gap_db":-0.282433},"status":"discard","description":"Competitive ep=2 fallback (accept if <=2% larger). ep=2 improves PSNR on some images but causes size overshoot on zoltan (max_size +0.72%). Discard.","timestamp":1773479302812,"segment":1}
{"run":696,"commit":"6ca3611","metric":1.726066,"metrics":{"mean_size_pct":-9.81492,"mean_psnr_gap_db":0.217253,"max_size_pct":-0.753595,"min_psnr_gap_db":-0.292973},"status":"discard","description":"Competitive ep=2 with strict size-smaller constraint. ep=2 frames always larger, never selected. No parity change, only slower. Discard.","timestamp":1773479375471,"segment":1}
{"run":697,"commit":"6ca3611","metric":1.726066,"metrics":{"mean_size_pct":-9.81492,"mean_psnr_gap_db":0.217253,"max_size_pct":-0.753595,"min_psnr_gap_db":-0.292973},"status":"discard","description":"Bump quant_ac scale to 1.35. No effect -- integer rq values unchanged due coarse quantization. Discard.","timestamp":1773479442974,"segment":1}
{"run":698,"commit":"6ca3611","metric":22.680331,"metrics":{"mean_size_pct":-18.169923,"mean_psnr_gap_db":-0.89252,"max_size_pct":-12.405595,"min_psnr_gap_db":-1.833815},"status":"discard","description":"Add harder_rq (base+1) and softest_rq (base-2) candidates. harder_rq wins size selection but destroys quality. Discard.","timestamp":1773479516984,"segment":1}
{"run":699,"commit":"6ca3611","metric":1.726066,"metrics":{"mean_size_pct":-9.81492,"mean_psnr_gap_db":0.217253,"max_size_pct":-0.753595,"min_psnr_gap_db":-0.292973},"status":"discard","description":"Add 4 more HybridUint configs from libjxl kBest set (4,1,0; 4,2,1; 5,2,0; 5,1,0). No change -- kFast set already covers best options for corpus.","timestamp":1773479703663,"segment":1}
{"run":700,"commit":"6ca3611","metric":1.798128,"metrics":{"mean_size_pct":-9.842268,"mean_psnr_gap_db":0.228277,"max_size_pct":-0.789706,"min_psnr_gap_db":-0.285786},"status":"discard","description":"Separate CfL shrinkage for B channel (TOWARDS_ZERO_B=2.5 vs X=2.965). Better worst-case PSNR but larger files overall. Discard.","timestamp":1773479782150,"segment":1}
{"run":701,"commit":"6ca3611","metric":1.768474,"metrics":{"mean_size_pct":-9.823081,"mean_psnr_gap_db":0.220709,"max_size_pct":-0.767849,"min_psnr_gap_db":-0.295799},"status":"discard","description":"Try B-channel CfL shrink 2.8 (vs X=2.965). Regresses from 1.726 to 1.768. Discard.","timestamp":1773479831324,"segment":1}
{"run":702,"commit":"6ca3611","metric":1.760629,"metrics":{"mean_size_pct":-9.801003,"mean_psnr_gap_db":0.211924,"max_size_pct":-0.730312,"min_psnr_gap_db":-0.29046},"status":"discard","description":"Try B-channel CfL shrink 3.2 (vs X=2.965). Still worse than unified 2.965 (1.726). Separate per-channel shrink doesn't help. Discard.","timestamp":1773479885012,"segment":1}
{"run":703,"commit":"6ca3611","metric":22.680331,"metrics":{"mean_size_pct":-18.169923,"mean_psnr_gap_db":-0.89252,"max_size_pct":-12.405595,"min_psnr_gap_db":-1.833815},"status":"discard","description":"Add softest_rq (base-2) uniform candidate. Same massive regression as before due encode budget exhaustion cutting off good candidates. Discard.","timestamp":1773479996485,"segment":1}
{"run":704,"commit":"6ca3611","metric":4.488424,"metrics":{"mean_size_pct":-3.477644,"mean_psnr_gap_db":0.901696,"max_size_pct":9.006548,"min_psnr_gap_db":0.564901},"status":"discard","description":"Finer-rq (base+1) candidate with 20% size margin. Finer rq is too large (+9% worst case) even though PSNR improves. Discard.","timestamp":1773480355139,"segment":1}
{"run":705,"commit":"6ca3611","metric":1.726066,"metrics":{"mean_size_pct":-9.81492,"mean_psnr_gap_db":0.217253,"max_size_pct":-0.753595,"min_psnr_gap_db":-0.292973},"status":"discard","description":"Add finer adaptive map (+1 rq per block) with increased budget. Finer candidate never wins size selection. Discard.","timestamp":1773480434436,"segment":1}
{"run":706,"commit":"6ca3611","metric":1.810034,"metrics":{"mean_size_pct":-9.81492,"mean_psnr_gap_db":0.211456,"max_size_pct":-0.753595,"min_psnr_gap_db":-0.299135},"status":"discard","description":"Change epf_iters from 2 to 1 (matching libjxl at d=1.0). PSNR slightly worse -- our quantization benefits from 2 EPF iterations. Discard.","timestamp":1773480558779,"segment":1}
{"run":707,"commit":"6ca3611","metric":1.80164,"metrics":{"mean_size_pct":-9.81492,"mean_psnr_gap_db":0.215195,"max_size_pct":-0.753595,"min_psnr_gap_db":-0.313877},"status":"discard","description":"Try epf_iters=3 (maximum). Over-smoothing hurts worst-case PSNR (-0.314 vs -0.293). epf_iters=2 is optimal. Discard.","timestamp":1773480611190,"segment":1}
{"run":708,"commit":"6ca3611","metric":1.914063,"metrics":{"mean_size_pct":-9.467906,"mean_psnr_gap_db":0.198881,"max_size_pct":0.263235,"min_psnr_gap_db":-0.300216},"status":"discard","description":"Finer X quantization (x_dm_multiplier*=0.95 -> 0.76). Size overshoot on one image (+0.26%), parity regresses. Discard.","timestamp":1773480675863,"segment":1}
{"run":709,"commit":"6ca3611","metric":1.726066,"metrics":{"mean_size_pct":-9.815353,"mean_psnr_gap_db":0.217253,"max_size_pct":-0.754545,"min_psnr_gap_db":-0.292973},"status":"discard","description":"Expand ANS shift candidates from [0,6,12] to [0,3,6,9,12]. No primary metric change, tiny secondary size improvement. Discard.","timestamp":1773480785547,"segment":1}
{"run":710,"commit":"6ca3611","metric":1.726066,"metrics":{"mean_size_pct":-9.81492,"mean_psnr_gap_db":0.217253,"max_size_pct":-0.753595,"min_psnr_gap_db":-0.292973},"status":"discard","description":"Adaptive EPF sharpness based on raw_quant per block. No change -- rq values likely all fall in sharpness=4 range for our corpus.","timestamp":1773480859590,"segment":1}
{"run":711,"commit":"6ca3611","metric":1.726066,"metrics":{"mean_size_pct":-9.81492,"mean_psnr_gap_db":0.217253,"max_size_pct":-0.753595,"min_psnr_gap_db":-0.292973},"status":"discard","description":"Test EPF sharpness=0 (max diff from default=4). Identical PSNR -- sharpness map has no effect on djxl output, possibly misencoded or unused in our decode path.","timestamp":1773480984129,"segment":1}
{"run":712,"commit":"6ca3611","metric":0,"metrics":{"mean_size_pct":0,"mean_psnr_gap_db":0,"max_size_pct":0,"min_psnr_gap_db":0},"status":"crash","description":"Attempted custom EPF sigma but decode failed -- incorrect F16 format for epf_quant_mul field.","timestamp":1773481028533,"segment":1}
{"run":713,"commit":"6ca3611","metric":1.931438,"metrics":{"mean_size_pct":-9.01352,"mean_psnr_gap_db":0.198459,"max_size_pct":0.957436,"min_psnr_gap_db":-0.28321},"status":"discard","description":"AdjustQuantBias-aware rounding (0->1 at 0.465, 1->2 at 1.429). Creates more nonzeros, size overshoots on zoltan (+0.96%). Discard.","timestamp":1773481188521,"segment":1}
{"run":714,"commit":"6ca3611","metric":2.581832,"metrics":{"mean_size_pct":-10.65447,"mean_psnr_gap_db":0.183521,"max_size_pct":-2.503112,"min_psnr_gap_db":-0.376702},"status":"discard","description":"Wider dead zone at 0.535 to avoid q=1 overshoot. Shrinks files but PSNR drops badly (-0.377 worst case). Discard.","timestamp":1773481257906,"segment":1}
{"run":715,"commit":"6ca3611","metric":1.726066,"metrics":{"mean_size_pct":-9.81492,"mean_psnr_gap_db":0.217253,"max_size_pct":-0.753595,"min_psnr_gap_db":-0.292973},"status":"discard","description":"Clamp AQ map rq outliers to median+2. No effect -- uniform candidates are winning selection, AQ map is never chosen. Discard.","timestamp":1773481560009,"segment":1}
{"run":716,"commit":"6ca3611","metric":18.002187,"metrics":{"mean_size_pct":-7.561046,"mean_psnr_gap_db":-0.612846,"max_size_pct":3.264784,"min_psnr_gap_db":-3.921539},"status":"discard","description":"Shift AQ global_scale from 0.39/d to 0.42/d. Massive regression -- different gs changes entire quantization grid. Discard.","timestamp":1773481617784,"segment":1}
{"run":717,"commit":"6ca3611","metric":1.726066,"metrics":{"mean_size_pct":-9.81492,"mean_psnr_gap_db":0.217253,"max_size_pct":-0.753595,"min_psnr_gap_db":-0.292973},"status":"discard","description":"Add libjxl-matching rq candidate (rq=10 at gs=5111, field~0.78). Not selected -- produces larger file than rq=6. Size-based selection always picks smallest. Discard.","timestamp":1773481894754,"segment":1}
{"run":718,"commit":"6ca3611","metric":1.790221,"metrics":{"mean_size_pct":-5.398921,"mean_psnr_gap_db":0.698943,"max_size_pct":0.713682,"min_psnr_gap_db":-0.282433},"status":"discard","description":"extra_dc_precision=2. PSNR much better (+0.70 avg) but one image overshoots size by +0.71%. Parity regresses to 1.79. Need to find which image overshoots.","timestamp":1773481961845,"segment":1}
{"run":719,"commit":"6ca3611","metric":1.842805,"metrics":{"mean_size_pct":-9.770361,"mean_psnr_gap_db":0.209935,"max_size_pct":-0.748843,"min_psnr_gap_db":-0.302184},"status":"discard","description":"Custom EPF channel weights (X:6.5 B:5.0 vs defaults X:5.0 B:3.5). Higher weights = more selective = LESS chroma smoothing. PSNR worse. Need to go the other direction.","timestamp":1773482141757,"segment":1}
{"run":720,"commit":"6ca3611","metric":1.797835,"metrics":{"mean_size_pct":-9.770361,"mean_psnr_gap_db":0.216455,"max_size_pct":-0.748843,"min_psnr_gap_db":-0.298957},"status":"discard","description":"EPF chroma weights reduced (X:3.5 B:2.5 vs defaults X:5.0 B:3.5). More chroma smoothing but worst PSNR slightly worse. Discard.","timestamp":1773482203285,"segment":1}
{"run":721,"commit":"ab5ec09","metric":1.699087,"metrics":{"mean_size_pct":-9.770361,"mean_psnr_gap_db":0.222534,"max_size_pct":-0.748843,"min_psnr_gap_db":-0.28905},"status":"keep","description":"Custom EPF B-channel weight=1.5 (default 3.5). Reduces B-channel contribution to EPF distance -> more B smoothing -> better chroma PSNR. New best 1.726->1.699.","timestamp":1773482259763,"segment":1}
{"run":722,"commit":"ab5ec09","metric":1.746694,"metrics":{"mean_size_pct":-9.770361,"mean_psnr_gap_db":0.221895,"max_size_pct":-0.748843,"min_psnr_gap_db":-0.293282},"status":"discard","description":"EPF B-channel weight=1.0. Over-smoothing hurts PSNR vs 1.5. Discard.","timestamp":1773482314839,"segment":1}
{"run":723,"commit":"de39243","metric":1.696162,"metrics":{"mean_size_pct":-9.770361,"mean_psnr_gap_db":0.221971,"max_size_pct":-0.748843,"min_psnr_gap_db":-0.288661},"status":"keep","description":"EPF B-channel weight=2.0 (was 1.5). Slightly better worst-case PSNR (-0.289 vs -0.289). Parity 1.699->1.696.","timestamp":1773482364909,"segment":1}
{"run":724,"commit":"de39243","metric":1.701358,"metrics":{"mean_size_pct":-9.770361,"mean_psnr_gap_db":0.220515,"max_size_pct":-0.748843,"min_psnr_gap_db":-0.289671},"status":"discard","description":"EPF B-channel weight=2.5. Slightly worse than 2.0. Discard.","timestamp":1773482415295,"segment":1}
{"run":725,"commit":"de39243","metric":1.934214,"metrics":{"mean_size_pct":-9.770361,"mean_psnr_gap_db":0.2107,"max_size_pct":-0.748843,"min_psnr_gap_db":-0.310512},"status":"discard","description":"EPF X-channel weight=3.5 (was 5.0). Makes X-channel PSNR worse. Discard.","timestamp":1773482472843,"segment":1}
{"run":726,"commit":"b70eabd","metric":1.684475,"metrics":{"mean_size_pct":-9.770361,"mean_psnr_gap_db":0.223874,"max_size_pct":-0.748843,"min_psnr_gap_db":-0.286668},"status":"keep","description":"EPF Y-channel weight=35.0 (was 40.0). More Y smoothing helps overall PSNR. Parity 1.696->1.684.","timestamp":1773482534440,"segment":1}
{"run":727,"commit":"76b54c3","metric":1.67136,"metrics":{"mean_size_pct":-9.770361,"mean_psnr_gap_db":0.226173,"max_size_pct":-0.748843,"min_psnr_gap_db":-0.284377},"status":"keep","description":"EPF Y-channel weight=30.0 (was 35.0). Continued Y smoothing improvement. Parity 1.684->1.671.","timestamp":1773482585647,"segment":1}
{"run":728,"commit":"264f40a","metric":1.657522,"metrics":{"mean_size_pct":-9.770361,"mean_psnr_gap_db":0.228968,"max_size_pct":-0.748843,"min_psnr_gap_db":-0.282101},"status":"keep","description":"EPF Y-channel weight=25.0. Parity 1.671->1.658. Worst PSNR gap narrowing to -0.282.","timestamp":1773482635740,"segment":1}
