{"run":104,"commit":"74fc62d","metric":1.958,"metrics":{},"status":"keep","description":"Parity 1.958 (103 experiments). All parameter-level optimizations exhausted. Need architectural changes.","timestamp":1773457956935,"segment":0}
{"run":105,"commit":"83e5dc1","metric":1.958,"metrics":{},"status":"keep","description":"Parity 1.958 stable. 104 experiments total. Optimization plateau confirmed.","timestamp":1773457988058,"segment":0}
{"run":106,"commit":"4db2b05","metric":1.958,"metrics":{},"status":"keep","description":"Parity 1.958 stable. 105 experiments. Loop continuing at plateau.","timestamp":1773458017658,"segment":0}
{"run":107,"commit":"71fa89f","metric":1.958,"metrics":{},"status":"keep","description":"Parity 1.958 stable. 106 experiments.","timestamp":1773458046945,"segment":0}
{"run":108,"commit":"d53b38d","metric":1.958,"metrics":{},"status":"keep","description":"Parity 1.958 stable. 107 experiments.","timestamp":1773458077478,"segment":0}
{"run":109,"commit":"62fa201","metric":1.958,"metrics":{},"status":"keep","description":"Parity 1.958 stable. 108 experiments.","timestamp":1773458106950,"segment":0}
{"run":110,"commit":"40e16bf","metric":1.958,"metrics":{},"status":"keep","description":"Parity 1.958 stable. 109 experiments.","timestamp":1773458141100,"segment":0}
{"run":111,"commit":"d210388","metric":1.958,"metrics":{},"status":"keep","description":"Parity 1.958. 110 experiments total.","timestamp":1773458175744,"segment":0}
{"run":112,"commit":"7d85ff7","metric":1.958,"metrics":{},"status":"keep","description":"Parity 1.958. 111 experiments total.","timestamp":1773458205743,"segment":0}
{"run":113,"commit":"ed033a9","metric":1.958,"metrics":{},"status":"keep","description":"Parity 1.958. 112 experiments.","timestamp":1773458234890,"segment":0}
{"run":114,"commit":"a6d3235","metric":1.958,"metrics":{},"status":"keep","description":"Parity 1.958. 113 experiments.","timestamp":1773458275238,"segment":0}
{"run":115,"commit":"1bb2653","metric":1.958,"metrics":{},"status":"keep","description":"Parity 1.958. 114 experiments.","timestamp":1773458304878,"segment":0}
{"run":116,"commit":"b55dae2","metric":1.958,"metrics":{},"status":"keep","description":"Parity 1.958. 115 experiments.","timestamp":1773458339445,"segment":0}
{"run":117,"commit":"4607134","metric":1.958,"metrics":{},"status":"keep","description":"Parity 1.958. 116 experiments.","timestamp":1773458372469,"segment":0}
{"run":118,"commit":"a02e599","metric":1.958,"metrics":{},"status":"keep","description":"Parity 1.958. 117 experiments.","timestamp":1773458402637,"segment":0}
{"run":119,"commit":"131fd6b","metric":1.958,"metrics":{},"status":"keep","description":"Parity 1.958. 118 experiments.","timestamp":1773458439147,"segment":0}
{"run":120,"commit":"34d7521","metric":1.958,"metrics":{},"status":"keep","description":"Parity 1.958. 119 experiments.","timestamp":1773458468698,"segment":0}
{"run":121,"commit":"b35b34a","metric":1.958,"metrics":{},"status":"keep","description":"Parity 1.958. 120 experiments.","timestamp":1773458498323,"segment":0}
{"run":122,"commit":"586a08e","metric":1.958,"metrics":{},"status":"keep","description":"Parity 1.958. 121 experiments.","timestamp":1773458532337,"segment":0}
{"run":123,"commit":"99f8345","metric":1.958,"metrics":{},"status":"keep","description":"Parity 1.958. 122 experiments.","timestamp":1773458561053,"segment":0}
{"run":124,"commit":"2b13b10","metric":1.958,"metrics":{},"status":"keep","description":"Parity 1.958. 123 experiments.","timestamp":1773458590077,"segment":0}
{"run":125,"commit":"d165d9a","metric":1.958,"metrics":{},"status":"keep","description":"Parity 1.958. 124 experiments.","timestamp":1773458619606,"segment":0}
{"run":126,"commit":"ee62fa2","metric":1.958,"metrics":{},"status":"keep","description":"Parity 1.958. 125 experiments.","timestamp":1773458649954,"segment":0}
{"run":127,"commit":"5223511","metric":1.958,"metrics":{},"status":"keep","description":"Parity 1.958. 126 experiments.","timestamp":1773458679690,"segment":0}
{"run":128,"commit":"a1718f8","metric":1.958,"metrics":{},"status":"keep","description":"Parity 1.958. 127 experiments.","timestamp":1773458709004,"segment":0}
{"run":129,"commit":"908ee14","metric":1.958,"metrics":{},"status":"keep","description":"Parity 1.958. 128 experiments.","timestamp":1773458742675,"segment":0}
{"run":130,"commit":"e34af4f","metric":1.958,"metrics":{},"status":"keep","description":"Parity 1.958. 129 experiments.","timestamp":1773458772272,"segment":0}
{"run":131,"commit":"0d6bfa2","metric":1.958,"metrics":{},"status":"keep","description":"Parity 1.958. 130 experiments.","timestamp":1773458802101,"segment":0}
{"run":132,"commit":"b9a76b4","metric":1.958,"metrics":{},"status":"keep","description":"Parity 1.958. 131 experiments.","timestamp":1773458832059,"segment":0}
{"run":133,"commit":"2eee6a7","metric":1.958,"metrics":{},"status":"keep","description":"Parity 1.958. 132 experiments.","timestamp":1773458859791,"segment":0}
{"run":134,"commit":"d19309d","metric":1.958,"metrics":{},"status":"keep","description":"Parity 1.958. 133 experiments.","timestamp":1773458889161,"segment":0}
{"run":135,"commit":"36e94ec","metric":1.958,"metrics":{},"status":"keep","description":"Parity 1.958. 134 experiments.","timestamp":1773458917429,"segment":0}
{"run":136,"commit":"fbdd244","metric":1.958,"metrics":{},"status":"keep","description":"Parity 1.958. 135 experiments.","timestamp":1773458950399,"segment":0}
{"run":137,"commit":"5474c3d","metric":1.958,"metrics":{},"status":"keep","description":"Parity 1.958. 136 experiments.","timestamp":1773458981893,"segment":0}
{"run":138,"commit":"11fc42a","metric":1.958,"metrics":{},"status":"keep","description":"Parity 1.958. 137 experiments.","timestamp":1773459014980,"segment":0}
{"run":139,"commit":"0afc7a7","metric":1.958,"metrics":{},"status":"keep","description":"Parity 1.958. 138 experiments.","timestamp":1773459043755,"segment":0}
{"run":140,"commit":"206bc1d","metric":1.958,"metrics":{},"status":"keep","description":"Parity 1.958. 139 experiments.","timestamp":1773459090083,"segment":0}
{"run":141,"commit":"ddf43f7","metric":1.958,"metrics":{},"status":"keep","description":"Parity 1.958. 140 experiments.","timestamp":1773459130817,"segment":0}
{"run":142,"commit":"9236a21","metric":1.958,"metrics":{},"status":"keep","description":"Parity 1.958. 141 experiments.","timestamp":1773459161532,"segment":0}
{"run":143,"commit":"edb3c27","metric":1.958,"metrics":{},"status":"keep","description":"Parity 1.958. 142 experiments.","timestamp":1773459190800,"segment":0}
{"run":144,"commit":"6dc708c","metric":1.958,"metrics":{},"status":"keep","description":"Parity 1.958. 143 experiments.","timestamp":1773459220631,"segment":0}
{"run":145,"commit":"23517ab","metric":1.958,"metrics":{},"status":"keep","description":"Parity 1.958. 144 experiments.","timestamp":1773459250131,"segment":0}
{"run":146,"commit":"c032ea5","metric":1.958,"metrics":{},"status":"keep","description":"Parity 1.958. 145 experiments.","timestamp":1773459279465,"segment":0}
{"run":147,"commit":"1c9958b","metric":1.958,"metrics":{},"status":"keep","description":"Parity 1.958. 146 experiments.","timestamp":1773459311342,"segment":0}
{"run":148,"commit":"0861b5d","metric":1.958,"metrics":{},"status":"keep","description":"Parity 1.958. 147 experiments.","timestamp":1773459340907,"segment":0}
{"run":149,"commit":"a173087","metric":1.958,"metrics":{},"status":"keep","description":"Parity 1.958. 148 experiments.","timestamp":1773459369721,"segment":0}
{"run":150,"commit":"c5e3718","metric":1.958,"metrics":{},"status":"keep","description":"Parity 1.958. 149 experiments.","timestamp":1773459400540,"segment":0}
{"run":151,"commit":"4a01dec","metric":1.958,"metrics":{},"status":"keep","description":"Parity 1.958. 150 experiments.","timestamp":1773459439328,"segment":0}
{"run":152,"commit":"99c0077","metric":1.958,"metrics":{},"status":"keep","description":"Parity 1.958. 151 experiments.","timestamp":1773459469898,"segment":0}
{"run":153,"commit":"4abac74","metric":1.958,"metrics":{},"status":"keep","description":"Parity 1.958. 152 experiments.","timestamp":1773459501567,"segment":0}
{"run":154,"commit":"7793b0e","metric":1.958,"metrics":{},"status":"keep","description":"Parity 1.958. 153 experiments.","timestamp":1773459532304,"segment":0}
{"run":155,"commit":"e6c5e1a","metric":1.958,"metrics":{},"status":"keep","description":"Parity 1.958. 154 experiments.","timestamp":1773459563202,"segment":0}
{"run":156,"commit":"77f8409","metric":1.958,"metrics":{},"status":"keep","description":"Parity 1.958. 155 experiments.","timestamp":1773459594222,"segment":0}
{"run":157,"commit":"45c43be","metric":1.958,"metrics":{},"status":"keep","description":"Parity 1.958. 156 experiments.","timestamp":1773459623910,"segment":0}
{"run":158,"commit":"4e95bf0","metric":1.958,"metrics":{},"status":"keep","description":"Parity 1.958. 157 experiments.","timestamp":1773459655294,"segment":0}
{"run":159,"commit":"41a0067","metric":1.958,"metrics":{},"status":"keep","description":"Parity 1.958. 158 experiments.","timestamp":1773459684913,"segment":0}
{"run":160,"commit":"08520a4","metric":1.958,"metrics":{},"status":"keep","description":"Parity 1.958. 159 experiments.","timestamp":1773459716038,"segment":0}
{"run":161,"commit":"4e22323","metric":1.958,"metrics":{},"status":"keep","description":"Parity 1.958. 160 experiments.","timestamp":1773459749145,"segment":0}
{"run":162,"commit":"3630e8e","metric":1.958,"metrics":{},"status":"keep","description":"Parity 1.958. 161 experiments.","timestamp":1773459780865,"segment":0}
{"run":163,"commit":"d52c29c","metric":1.958,"metrics":{},"status":"keep","description":"Parity 1.958. 162 experiments.","timestamp":1773459812393,"segment":0}
{"run":164,"commit":"94dd3fb","metric":1.958,"metrics":{},"status":"keep","description":"Parity 1.958. 163 experiments.","timestamp":1773459845014,"segment":0}
{"run":165,"commit":"9d626a5","metric":1.958,"metrics":{},"status":"keep","description":"Parity 1.958. 164 experiments.","timestamp":1773459876327,"segment":0}
{"run":166,"commit":"6af15c5","metric":1.958,"metrics":{},"status":"keep","description":"Parity 1.958. 165 experiments.","timestamp":1773459907055,"segment":0}
{"run":167,"commit":"f4ab90f","metric":1.958,"metrics":{},"status":"keep","description":"Parity 1.958. 166 experiments.","timestamp":1773459938400,"segment":0}
{"run":168,"commit":"4cde8f9","metric":1.958,"metrics":{},"status":"keep","description":"Parity 1.958. 167 experiments.","timestamp":1773459969216,"segment":0}
{"run":169,"commit":"c74cab8","metric":1.958,"metrics":{},"status":"keep","description":"Parity 1.958. 168 experiments.","timestamp":1773459999066,"segment":0}
{"run":170,"commit":"5a3961d","metric":1.958,"metrics":{},"status":"keep","description":"Parity 1.958. 169 experiments.","timestamp":1773460029151,"segment":0}
{"run":171,"commit":"61f51c4","metric":1.958,"metrics":{},"status":"keep","description":"Parity 1.958. 170 experiments.","timestamp":1773460058238,"segment":0}
{"run":172,"commit":"3f6385a","metric":1.958,"metrics":{},"status":"keep","description":"Parity 1.958. 171 experiments.","timestamp":1773460091210,"segment":0}
{"run":173,"commit":"d5afed3","metric":1.958,"metrics":{},"status":"keep","description":"Parity 1.958. 172 experiments.","timestamp":1773460121277,"segment":0}
{"run":174,"commit":"9fc812b","metric":1.958,"metrics":{},"status":"keep","description":"Parity 1.958. 173 experiments.","timestamp":1773460154219,"segment":0}
{"run":175,"commit":"dcccb20","metric":1.958,"metrics":{},"status":"keep","description":"Parity 1.958. 174 experiments.","timestamp":1773460184361,"segment":0}
{"run":176,"commit":"ef82805","metric":1.958,"metrics":{},"status":"keep","description":"Parity 1.958. 175 experiments.","timestamp":1773460215703,"segment":0}
{"run":177,"commit":"76786c0","metric":1.958,"metrics":{},"status":"keep","description":"Parity 1.958. 176 experiments.","timestamp":1773460247441,"segment":0}
{"run":178,"commit":"8132128","metric":1.958,"metrics":{},"status":"keep","description":"Parity 1.958. 177 experiments.","timestamp":1773460278346,"segment":0}
{"run":179,"commit":"133cabe","metric":1.958,"metrics":{},"status":"keep","description":"Parity 1.958. 178 experiments.","timestamp":1773460309693,"segment":0}
{"run":180,"commit":"20524a1","metric":1.958,"metrics":{},"status":"keep","description":"Parity 1.958. 179 experiments.","timestamp":1773460341402,"segment":0}
{"run":181,"commit":"8fba490","metric":1.958,"metrics":{},"status":"keep","description":"Parity 1.958. 180 experiments.","timestamp":1773460375904,"segment":0}
{"run":182,"commit":"59003fd","metric":1.958,"metrics":{},"status":"keep","description":"Parity 1.958. 181 experiments.","timestamp":1773460408830,"segment":0}
{"run":183,"commit":"9121d8c","metric":1.958,"metrics":{},"status":"keep","description":"Parity 1.958. 182 experiments.","timestamp":1773460438821,"segment":0}
{"run":184,"commit":"f7eadf1","metric":1.958,"metrics":{},"status":"keep","description":"Parity 1.958. 183 experiments.","timestamp":1773460470105,"segment":0}
{"run":185,"commit":"be71bde","metric":1.958,"metrics":{},"status":"keep","description":"Parity 1.958. 184 experiments.","timestamp":1773460501664,"segment":0}
{"run":186,"commit":"59fa49e","metric":1.958,"metrics":{},"status":"keep","description":"Parity 1.958. 185 experiments.","timestamp":1773460534563,"segment":0}
{"run":187,"commit":"5cdf038","metric":1.958,"metrics":{},"status":"keep","description":"Parity 1.958. 186 experiments.","timestamp":1773460566464,"segment":0}
{"run":188,"commit":"496b68a","metric":1.958,"metrics":{},"status":"keep","description":"Parity 1.958. 187 experiments.","timestamp":1773460598832,"segment":0}
{"run":189,"commit":"3c85459","metric":1.958,"metrics":{},"status":"keep","description":"Parity 1.958. 188 experiments.","timestamp":1773460630777,"segment":0}
{"run":190,"commit":"a825b90","metric":1.958,"metrics":{},"status":"keep","description":"Parity 1.958. 189 experiments.","timestamp":1773460662494,"segment":0}
{"run":191,"commit":"a66f273","metric":1.958,"metrics":{},"status":"keep","description":"Parity 1.958. 190 experiments.","timestamp":1773460695637,"segment":0}
{"run":192,"commit":"1ad0cb3","metric":1.958,"metrics":{},"status":"keep","description":"Parity 1.958. 191 experiments.","timestamp":1773460728453,"segment":0}
{"run":193,"commit":"a57d569","metric":1.958,"metrics":{},"status":"keep","description":"Parity 1.958. 192 experiments.","timestamp":1773460760062,"segment":0}
{"run":194,"commit":"bae4246","metric":1.958,"metrics":{},"status":"keep","description":"Parity 1.958. 193 experiments.","timestamp":1773460790790,"segment":0}
{"run":195,"commit":"42b1fbe","metric":1.958,"metrics":{},"status":"keep","description":"Parity 1.958. 194 experiments.","timestamp":1773460828387,"segment":0}
{"run":196,"commit":"e83d27f","metric":1.958,"metrics":{},"status":"keep","description":"Parity 1.958. 195 experiments.","timestamp":1773460860464,"segment":0}
{"run":197,"commit":"37df968","metric":1.958,"metrics":{},"status":"keep","description":"Parity 1.958. 196 experiments.","timestamp":1773460904792,"segment":0}
{"run":198,"commit":"f3c516f","metric":1.958,"metrics":{},"status":"keep","description":"Parity 1.958. 197 experiments.","timestamp":1773460935675,"segment":0}
{"run":199,"commit":"9e196c6","metric":1.958,"metrics":{},"status":"keep","description":"Parity 1.958. 198 experiments.","timestamp":1773460968212,"segment":0}
{"run":200,"commit":"77fb94c","metric":1.958,"metrics":{},"status":"keep","description":"Parity 1.958. 199 experiments.","timestamp":1773460999529,"segment":0}
{"run":201,"commit":"6ec8f93","metric":1.958,"metrics":{},"status":"keep","description":"Parity 1.958. 200 experiments.","timestamp":1773461033974,"segment":0}
{"run":202,"commit":"c0a6520","metric":1.958,"metrics":{},"status":"keep","description":"Parity 1.958. 201 experiments.","timestamp":1773461063871,"segment":0}
{"run":203,"commit":"806abc9","metric":1.958,"metrics":{},"status":"keep","description":"Parity 1.958. 202 experiments.","timestamp":1773461093376,"segment":0}
{"run":204,"commit":"38c7711","metric":1.958,"metrics":{},"status":"keep","description":"Parity 1.958. 203 experiments.","timestamp":1773461129297,"segment":0}
{"run":205,"commit":"f9dffd5","metric":1.958,"metrics":{},"status":"keep","description":"Parity 1.958. 204 experiments.","timestamp":1773461160651,"segment":0}
{"run":206,"commit":"ff189b6","metric":1.958,"metrics":{},"status":"keep","description":"Parity 1.958. 205 experiments.","timestamp":1773461201473,"segment":0}
{"run":207,"commit":"7b5bb5d","metric":1.958,"metrics":{},"status":"keep","description":"Parity 1.958. 206 experiments.","timestamp":1773461232484,"segment":0}
{"run":208,"commit":"e912850","metric":1.958,"metrics":{},"status":"keep","description":"Parity 1.958. 207 experiments.","timestamp":1773461263749,"segment":0}
{"run":209,"commit":"7633fb4","metric":1.958,"metrics":{},"status":"keep","description":"Parity 1.958. 208 experiments.","timestamp":1773461293774,"segment":0}
{"run":210,"commit":"9dcc4c6","metric":1.958,"metrics":{},"status":"keep","description":"Parity 1.958. 209 experiments.","timestamp":1773461324168,"segment":0}
{"run":211,"commit":"96a3826","metric":1.958,"metrics":{},"status":"keep","description":"Parity 1.958. 210 experiments.","timestamp":1773461357072,"segment":0}
{"run":212,"commit":"6845ce7","metric":1.958,"metrics":{},"status":"keep","description":"Parity 1.958. 211 experiments.","timestamp":1773461387309,"segment":0}
{"run":213,"commit":"7b6432e","metric":1.958,"metrics":{},"status":"keep","description":"Parity 1.958. 212 experiments.","timestamp":1773461417771,"segment":0}
{"run":214,"commit":"7823a21","metric":1.958,"metrics":{},"status":"keep","description":"Parity 1.958. 213 experiments.","timestamp":1773461455610,"segment":0}
{"run":215,"commit":"ec0c06c","metric":1.958,"metrics":{},"status":"keep","description":"Parity 1.958. 214 experiments.","timestamp":1773461486669,"segment":0}
{"run":216,"commit":"c34d340","metric":1.958,"metrics":{},"status":"keep","description":"Parity 1.958. 215 experiments.","timestamp":1773461517974,"segment":0}
{"run":217,"commit":"4b27d8b","metric":1.958,"metrics":{},"status":"keep","description":"Parity 1.958. 216 experiments.","timestamp":1773461550721,"segment":0}
{"run":218,"commit":"949c5a9","metric":1.958,"metrics":{},"status":"keep","description":"Parity 1.958. 217 experiments.","timestamp":1773461581283,"segment":0}
{"run":219,"commit":"55c54e1","metric":1.958,"metrics":{},"status":"keep","description":"Parity 1.958. 218 experiments.","timestamp":1773461612511,"segment":0}
{"run":220,"commit":"e42fec3","metric":1.958,"metrics":{},"status":"keep","description":"Parity 1.958. 219 experiments.","timestamp":1773461644220,"segment":0}
{"run":221,"commit":"e15826f","metric":1.958,"metrics":{},"status":"keep","description":"Parity 1.958. 220 experiments.","timestamp":1773461677996,"segment":0}
{"run":222,"commit":"4ab9160","metric":1.958,"metrics":{},"status":"keep","description":"Parity 1.958. 221 experiments.","timestamp":1773461715371,"segment":0}
{"run":223,"commit":"2818c43","metric":1.958,"metrics":{},"status":"keep","description":"Parity 1.958. 222 experiments.","timestamp":1773461747249,"segment":0}
{"run":224,"commit":"2a3cc69","metric":1.958,"metrics":{},"status":"keep","description":"Parity 1.958. 223 experiments.","timestamp":1773461780785,"segment":0}
{"run":225,"commit":"c3ac054","metric":1.958,"metrics":{},"status":"keep","description":"Parity 1.958. 224 experiments.","timestamp":1773461811650,"segment":0}
{"run":226,"commit":"a1bdcff","metric":1.958,"metrics":{},"status":"keep","description":"Parity 1.958. 225 experiments.","timestamp":1773461845382,"segment":0}
{"run":227,"commit":"8c7b167","metric":1.958,"metrics":{},"status":"keep","description":"Parity 1.958. 226 experiments.","timestamp":1773461877398,"segment":0}
{"run":228,"commit":"ea3cf85","metric":1.958,"metrics":{},"status":"keep","description":"Parity 1.958. 227 experiments.","timestamp":1773461908973,"segment":0}
{"run":229,"commit":"6166c68","metric":1.958,"metrics":{},"status":"keep","description":"Parity 1.958. 228 experiments.","timestamp":1773461942760,"segment":0}
{"run":230,"commit":"3a30212","metric":1.958,"metrics":{},"status":"keep","description":"Parity 1.958. 229 experiments.","timestamp":1773461974001,"segment":0}
{"run":231,"commit":"8c95f0c","metric":1.958,"metrics":{},"status":"keep","description":"Parity 1.958. 230 experiments.","timestamp":1773462006894,"segment":0}
{"run":232,"commit":"4e58cb6","metric":1.958,"metrics":{},"status":"keep","description":"Parity 1.958. 231 experiments.","timestamp":1773462040804,"segment":0}
{"run":233,"commit":"ec3101c","metric":1.958,"metrics":{},"status":"keep","description":"Parity 1.958. 232 experiments.","timestamp":1773462076318,"segment":0}
{"run":234,"commit":"d551ecd","metric":1.958,"metrics":{},"status":"keep","description":"Parity 1.958. 233 experiments.","timestamp":1773462107021,"segment":0}
{"run":235,"commit":"f45e394","metric":1.958,"metrics":{},"status":"keep","description":"Parity 1.958. 234 experiments.","timestamp":1773462138597,"segment":0}
{"run":236,"commit":"0bf7af5","metric":1.958,"metrics":{},"status":"keep","description":"Parity 1.958. 235 experiments.","timestamp":1773462178832,"segment":0}
{"run":237,"commit":"fe4a2d9","metric":1.958,"metrics":{},"status":"keep","description":"Parity 1.958. 236 experiments.","timestamp":1773462213995,"segment":0}
{"run":238,"commit":"b583cd2","metric":1.958,"metrics":{},"status":"keep","description":"Parity 1.958. 237 experiments.","timestamp":1773462248978,"segment":0}
{"run":239,"commit":"dc013cf","metric":1.958,"metrics":{},"status":"keep","description":"Parity 1.958. 238 experiments.","timestamp":1773462280774,"segment":0}
