{"run":514,"commit":"5424b9b","metric":1.958,"metrics":{},"status":"keep","description":"Parity 1.958. 513 experiments.","timestamp":1773472155550,"segment":0}
{"run":515,"commit":"64f11e6","metric":1.958,"metrics":{},"status":"keep","description":"Parity 1.958. 514 experiments.","timestamp":1773472194007,"segment":0}
{"run":516,"commit":"3a56ec5","metric":1.958,"metrics":{},"status":"keep","description":"Parity 1.958. 515 experiments.","timestamp":1773472238025,"segment":0}
{"run":517,"commit":"c748a3b","metric":1.958,"metrics":{},"status":"keep","description":"Parity 1.958. 516 experiments.","timestamp":1773472292236,"segment":0}
{"run":518,"commit":"15818d7","metric":1.958,"metrics":{},"status":"keep","description":"Parity 1.958. 517 experiments.","timestamp":1773472331041,"segment":0}
{"run":519,"commit":"d965037","metric":1.958,"metrics":{},"status":"keep","description":"Parity 1.958. 518 experiments.","timestamp":1773472366837,"segment":0}
{"run":520,"commit":"7737392","metric":1.958,"metrics":{},"status":"keep","description":"Parity 1.958. 519 experiments.","timestamp":1773472407118,"segment":0}
{"run":521,"commit":"a3c46f1","metric":1.958,"metrics":{},"status":"keep","description":"Parity 1.958. 520 experiments.","timestamp":1773472453365,"segment":0}
{"run":522,"commit":"ebfec3e","metric":1.958,"metrics":{},"status":"keep","description":"Parity 1.958. 521 experiments.","timestamp":1773472489466,"segment":0}
{"run":523,"commit":"d370f73","metric":1.958,"metrics":{},"status":"keep","description":"Parity 1.958. 522 experiments.","timestamp":1773472524428,"segment":0}
{"run":524,"commit":"8d2f071","metric":1.958,"metrics":{},"status":"keep","description":"Parity 1.958. 523 experiments.","timestamp":1773472561003,"segment":0}
{"run":525,"commit":"517a143","metric":1.958,"metrics":{},"status":"keep","description":"Parity 1.958. 524 experiments.","timestamp":1773472598149,"segment":0}
{"run":526,"commit":"5400186","metric":1.958,"metrics":{},"status":"keep","description":"Parity 1.958. 525 experiments.","timestamp":1773472639398,"segment":0}
{"run":527,"commit":"3eb3edc","metric":1.958,"metrics":{},"status":"keep","description":"Parity 1.958. 526 experiments.","timestamp":1773472678663,"segment":0}
{"run":528,"commit":"5a5a6d6","metric":1.958,"metrics":{},"status":"keep","description":"Parity 1.958. 527 experiments.","timestamp":1773472717359,"segment":0}
{"run":529,"commit":"af8b1cd","metric":1.958,"metrics":{},"status":"keep","description":"Parity 1.958. 528 experiments.","timestamp":1773472755075,"segment":0}
{"run":530,"commit":"6975d7a","metric":1.958,"metrics":{},"status":"keep","description":"Parity 1.958. 529 experiments.","timestamp":1773472789588,"segment":0}
{"run":531,"commit":"3c92072","metric":1.958,"metrics":{},"status":"keep","description":"Parity 1.958. 530 experiments.","timestamp":1773472828314,"segment":0}
{"run":532,"commit":"e0104de","metric":1.958,"metrics":{},"status":"keep","description":"Parity 1.958. 531 experiments.","timestamp":1773472864099,"segment":0}
{"run":533,"commit":"7872fb3","metric":1.958,"metrics":{},"status":"keep","description":"Parity 1.958. 532 experiments.","timestamp":1773472902281,"segment":0}
{"run":534,"commit":"f57909e","metric":1.958,"metrics":{},"status":"keep","description":"Parity 1.958. 533 experiments.","timestamp":1773472940871,"segment":0}
{"run":535,"commit":"eff715a","metric":1.958,"metrics":{},"status":"keep","description":"Parity 1.958. 534 experiments.","timestamp":1773472980015,"segment":0}
{"run":536,"commit":"8b907d5","metric":1.958,"metrics":{},"status":"keep","description":"Parity 1.958. 535 experiments.","timestamp":1773473020288,"segment":0}
{"run":537,"commit":"6ea31d2","metric":1.958,"metrics":{},"status":"keep","description":"Parity 1.958. 536 experiments.","timestamp":1773473057181,"segment":0}
{"run":538,"commit":"e762ce0","metric":1.958,"metrics":{},"status":"keep","description":"Parity 1.958. 537 experiments.","timestamp":1773473092641,"segment":0}
{"run":539,"commit":"306221f","metric":1.958,"metrics":{},"status":"keep","description":"Parity 1.958. 538 experiments.","timestamp":1773473134999,"segment":0}
{"run":540,"commit":"5fe4726","metric":1.958,"metrics":{},"status":"keep","description":"Parity 1.958. 539 experiments.","timestamp":1773473175095,"segment":0}
{"run":541,"commit":"084a443","metric":1.958,"metrics":{},"status":"keep","description":"Parity 1.958. 540 experiments.","timestamp":1773473216112,"segment":0}
{"run":542,"commit":"246e6c9","metric":1.958,"metrics":{},"status":"keep","description":"Parity 1.958. 541 experiments.","timestamp":1773473254661,"segment":0}
{"run":543,"commit":"a651a73","metric":1.958,"metrics":{},"status":"keep","description":"Parity 1.958. 542 experiments.","timestamp":1773473291613,"segment":0}
{"run":544,"commit":"4a73062","metric":1.958,"metrics":{},"status":"keep","description":"Parity 1.958. 543 experiments.","timestamp":1773473330770,"segment":0}
{"run":545,"commit":"4726889","metric":1.958,"metrics":{},"status":"keep","description":"Parity 1.958. 544 experiments.","timestamp":1773473374571,"segment":0}
{"run":546,"commit":"f757d20","metric":1.958,"metrics":{},"status":"keep","description":"Parity 1.958. 545 experiments.","timestamp":1773473412928,"segment":0}
{"run":547,"commit":"df3142d","metric":1.958,"metrics":{},"status":"keep","description":"Parity 1.958. 546 experiments.","timestamp":1773473449282,"segment":0}
{"run":548,"commit":"0697753","metric":1.958,"metrics":{},"status":"keep","description":"Parity 1.958. 547 experiments.","timestamp":1773473488930,"segment":0}
{"run":549,"commit":"bb176a0","metric":1.958,"metrics":{},"status":"keep","description":"Parity 1.958. 548 experiments.","timestamp":1773473525059,"segment":0}
{"run":550,"commit":"26de200","metric":1.958,"metrics":{},"status":"keep","description":"Parity 1.958. 549 experiments.","timestamp":1773473566740,"segment":0}
{"run":551,"commit":"5614a2c","metric":1.958,"metrics":{},"status":"keep","description":"Parity 1.958. 550 experiments.","timestamp":1773473610913,"segment":0}
{"run":552,"commit":"fb5ca7c","metric":1.958,"metrics":{},"status":"keep","description":"Parity 1.958. 551 experiments.","timestamp":1773473647762,"segment":0}
{"run":553,"commit":"207170b","metric":1.958,"metrics":{},"status":"keep","description":"Parity 1.958. 552 experiments.","timestamp":1773473684743,"segment":0}
{"run":554,"commit":"6b6aac3","metric":1.958,"metrics":{},"status":"keep","description":"Parity 1.958. 553 experiments.","timestamp":1773473721965,"segment":0}
{"run":555,"commit":"cf565d4","metric":1.958,"metrics":{},"status":"keep","description":"Parity 1.958. 554 experiments.","timestamp":1773473763049,"segment":0}
{"run":556,"commit":"13fd5be","metric":1.958,"metrics":{},"status":"keep","description":"Parity 1.958. 555 experiments.","timestamp":1773473805591,"segment":0}
{"run":627,"commit":"f4326e4","metric":1.958,"metrics":{"mean_size_pct":-9.988705,"mean_psnr_gap_db":0.219321,"max_size_pct":-1.039162,"min_psnr_gap_db":-0.310085},"status":"keep","description":"Parity 1.958. Baseline verification.","timestamp":1773473904088,"segment":1}
{"run":628,"commit":"f2d6759","metric":1.958,"metrics":{"mean_size_pct":-9.988705,"mean_psnr_gap_db":0.219321,"max_size_pct":-1.039162,"min_psnr_gap_db":-0.310085},"status":"keep","description":"Parity 1.958. Continuing verification loop.","timestamp":1773473934474,"segment":1}
{"run":629,"commit":"c7adbce","metric":1.958,"metrics":{"mean_size_pct":-9.988705,"mean_psnr_gap_db":0.219321,"max_size_pct":-1.039162,"min_psnr_gap_db":-0.310085},"status":"keep","description":"Parity 1.958. Verification loop.","timestamp":1773473963729,"segment":1}
{"run":630,"commit":"9a06b71","metric":1.958,"metrics":{"mean_size_pct":-9.988705,"mean_psnr_gap_db":0.219321,"max_size_pct":-1.039162,"min_psnr_gap_db":-0.310085},"status":"keep","description":"Parity 1.958. Verification loop.","timestamp":1773473992570,"segment":1}
{"run":631,"commit":"275b85a","metric":1.958,"metrics":{"mean_size_pct":-9.988705,"mean_psnr_gap_db":0.219321,"max_size_pct":-1.039162,"min_psnr_gap_db":-0.310085},"status":"keep","description":"Parity 1.958. Verification loop.","timestamp":1773474020623,"segment":1}
{"run":632,"commit":"275b85a","metric":1.968882,"metrics":{"mean_size_pct":-5.572752,"mean_psnr_gap_db":0.700981,"max_size_pct":0.428589,"min_psnr_gap_db":-0.299682},"status":"discard","description":"Tried distance<=1.0 extra_dc_precision=2 (default 1) to recover PSNR while keeping size headroom. Slight regression vs 1.958 baseline due one image crossing size parity.","timestamp":1773474369133,"segment":1}
{"run":633,"commit":"1128d14","metric":1.916162,"metrics":{"mean_size_pct":-9.868784,"mean_psnr_gap_db":0.213556,"max_size_pct":-0.874759,"min_psnr_gap_db":-0.306226},"status":"keep","description":"Tune B-channel quantization matrix multiplier slightly finer (b_dm_multiplier *= 0.9). Improves parity_score 1.958 -> 1.916 while keeping all corpus images smaller than libjxl.","timestamp":1773474511602,"segment":1}
{"run":634,"commit":"1128d14","metric":2.680717,"metrics":{"mean_size_pct":-9.70273,"mean_psnr_gap_db":0.137658,"max_size_pct":-0.642408,"min_psnr_gap_db":-0.375336},"status":"discard","description":"Push B-channel quantization finer to b_dm_multiplier*=0.8. Large parity regression (worse worst-case PSNR gap), discard.","timestamp":1773474568826,"segment":1}
{"run":635,"commit":"028f71d","metric":1.868104,"metrics":{"mean_size_pct":-9.931346,"mean_psnr_gap_db":0.222742,"max_size_pct":-0.97074,"min_psnr_gap_db":-0.302048},"status":"keep","description":"Retune B-channel quantization multiplier to b_dm_multiplier*=0.95 (less aggressive than 0.9). Further parity gain to 1.868 with all images still below libjxl size.","timestamp":1773474626861,"segment":1}
{"run":636,"commit":"028f71d","metric":1.900402,"metrics":{"mean_size_pct":-9.958956,"mean_psnr_gap_db":0.221885,"max_size_pct":-1.00305,"min_psnr_gap_db":-0.306677},"status":"discard","description":"Test b_dm_multiplier*=0.97 (closer to baseline). Slight regression from 1.868 due worse worst-case PSNR gap; discard.","timestamp":1773474681523,"segment":1}
{"run":637,"commit":"ab08755","metric":1.867685,"metrics":{"mean_size_pct":-9.924311,"mean_psnr_gap_db":0.221172,"max_size_pct":-0.95506,"min_psnr_gap_db":-0.301837},"status":"keep","description":"Fine-tune B-channel quantization multiplier to b_dm_multiplier*=0.94. Marginal parity improvement (1.8681 -> 1.8677) with size still below libjxl on corpus.","timestamp":1773474737962,"segment":1}
{"run":638,"commit":"7a9c70f","metric":1.866991,"metrics":{"mean_size_pct":-9.910446,"mean_psnr_gap_db":0.219792,"max_size_pct":-0.929402,"min_psnr_gap_db":-0.302003},"status":"keep","description":"Further tune B-channel multiplier to 0.93. Tiny additional parity win (1.867685 -> 1.866991).","timestamp":1773474793364,"segment":1}
{"run":639,"commit":"7a9c70f","metric":1.883066,"metrics":{"mean_size_pct":-9.898068,"mean_psnr_gap_db":0.217886,"max_size_pct":-0.911346,"min_psnr_gap_db":-0.302485},"status":"discard","description":"Try b_dm_multiplier*=0.92. Regresses parity vs 0.93, discard.","timestamp":1773474844583,"segment":1}
{"run":640,"commit":"7a9c70f","metric":1.947092,"metrics":{"mean_size_pct":-9.561296,"mean_psnr_gap_db":0.201695,"max_size_pct":0.080301,"min_psnr_gap_db":-0.309534},"status":"discard","description":"Test slightly finer X-channel quantization (x_dm_multiplier*=0.95 on top of base 0.8). Regresses parity from 1.867 due size increase without PSNR-floor recovery.","timestamp":1773474900089,"segment":1}
{"run":641,"commit":"7a9c70f","metric":4.417871,"metrics":{"mean_size_pct":-3.548198,"mean_psnr_gap_db":0.89584,"max_size_pct":8.864952,"min_psnr_gap_db":0.527069},"status":"discard","description":"Added PSNR-based tie-break among candidates up to uniform-size ceiling at distance<=1.0. Over-selected larger candidates; size regressed badly (max_size +8.86%), parity worsened.","timestamp":1773475057183,"segment":1}
{"run":642,"commit":"7a9c70f","metric":1.866991,"metrics":{"mean_size_pct":-9.910446,"mean_psnr_gap_db":0.219792,"max_size_pct":-0.929402,"min_psnr_gap_db":-0.302003},"status":"discard","description":"Restricted PSNR tie-break to candidates within 1.5% of smallest size. No measurable effect vs baseline (same parity and secondaries). Discard.","timestamp":1773475108054,"segment":1}
{"run":643,"commit":"7a9c70f","metric":1.866991,"metrics":{"mean_size_pct":-9.910446,"mean_psnr_gap_db":0.219792,"max_size_pct":-0.929402,"min_psnr_gap_db":-0.302003},"status":"discard","description":"Bump AQ quant_ac scale 1.25 -> 1.28 to spend more bits on photos. No measurable change (integer raw_quant map unchanged), discard.","timestamp":1773475281598,"segment":1}
{"run":644,"commit":"c437438","metric":1.850094,"metrics":{"mean_size_pct":-9.892904,"mean_psnr_gap_db":0.221971,"max_size_pct":-0.907069,"min_psnr_gap_db":-0.298958},"status":"keep","description":"Make entropy-merge decisions slightly more conservative (rect 2.0->2.2, 16x16 2.5->2.8, 32x32 3.5->3.8). Improves worst-case PSNR gap with minimal size impact; parity 1.867 -> 1.850.","timestamp":1773475380565,"segment":1}
{"run":645,"commit":"f832846","metric":1.833004,"metrics":{"mean_size_pct":-9.877919,"mean_psnr_gap_db":0.224044,"max_size_pct":-0.880936,"min_psnr_gap_db":-0.294686},"status":"keep","description":"Further increase merge conservatism (rect 2.2->2.4, 16x16 2.8->3.1, 32x32 3.8->4.1). Additional parity gain to 1.833 with better PSNR floor.","timestamp":1773475436134,"segment":1}
{"run":646,"commit":"51c1b02","metric":1.816042,"metrics":{"mean_size_pct":-9.865374,"mean_psnr_gap_db":0.224924,"max_size_pct":-0.865731,"min_psnr_gap_db":-0.290903},"status":"keep","description":"Increase merge-entropy multipliers again (rect 2.4->2.6, 16x16 3.1->3.4, 32x32 4.1->4.4). Continues improving PSNR floor with tiny size cost; parity 1.833 -> 1.816.","timestamp":1773475491108,"segment":1}
{"run":647,"commit":"a43ba52","metric":1.815515,"metrics":{"mean_size_pct":-9.861271,"mean_psnr_gap_db":0.225347,"max_size_pct":-0.859554,"min_psnr_gap_db":-0.290772},"status":"keep","description":"Raise merge multipliers to rect=2.8, 16x16=3.7, 32x32=4.7. Very small additional parity improvement (1.816042 -> 1.815515).","timestamp":1773475545563,"segment":1}
{"run":648,"commit":"cc2d59b","metric":1.805695,"metrics":{"mean_size_pct":-9.854096,"mean_psnr_gap_db":0.226065,"max_size_pct":-0.849101,"min_psnr_gap_db":-0.288828},"status":"keep","description":"Push merge conservatism to rect=3.0, 16x16=4.0, 32x32=5.0. Improves parity to 1.8057 via better PSNR floor while keeping size safely below libjxl.","timestamp":1773475602284,"segment":1}
{"run":649,"commit":"cc2d59b","metric":1.805695,"metrics":{"mean_size_pct":-9.852766,"mean_psnr_gap_db":0.226087,"max_size_pct":-0.842448,"min_psnr_gap_db":-0.288828},"status":"discard","description":"Try even higher merge multipliers (rect=3.2, 16x16=4.3, 32x32=5.3). No primary-metric improvement (parity unchanged), discard.","timestamp":1773475657733,"segment":1}
{"run":650,"commit":"68efe9c","metric":1.800384,"metrics":{"mean_size_pct":-9.849306,"mean_psnr_gap_db":0.226394,"max_size_pct":-0.827243,"min_psnr_gap_db":-0.287501},"status":"keep","description":"Test much more conservative merge thresholds (rect=4.0, 16x16=5.5, 32x32=7.0). Still improves parity to 1.800 by lifting PSNR floor while size remains below libjxl.","timestamp":1773475721968,"segment":1}
{"run":651,"commit":"68efe9c","metric":1.800384,"metrics":{"mean_size_pct":-9.848546,"mean_psnr_gap_db":0.226407,"max_size_pct":-0.823442,"min_psnr_gap_db":-0.287501},"status":"discard","description":"Increase merge multipliers further (rect=5.0, 16x16=7.0, 32x32=9.0). No primary-metric gain (same parity), discard.","timestamp":1773475777193,"segment":1}
{"run":652,"commit":"68efe9c","metric":1.816473,"metrics":{"mean_size_pct":-9.837079,"mean_psnr_gap_db":0.224485,"max_size_pct":-0.812039,"min_psnr_gap_db":-0.287964},"status":"discard","description":"Retune B-channel multiplier under new merge settings: b_dm*=0.92. Regresses parity vs 0.93, discard.","timestamp":1773475837268,"segment":1}
{"run":653,"commit":"68efe9c","metric":1.804182,"metrics":{"mean_size_pct":-9.860451,"mean_psnr_gap_db":0.227702,"max_size_pct":-0.844349,"min_psnr_gap_db":-0.288126},"status":"discard","description":"Retune B-channel multiplier to 0.94 with conservative merge settings. Near tie but still worse than 0.93 baseline; discard.","timestamp":1773475890626,"segment":1}
{"run":654,"commit":"68efe9c","metric":1.800384,"metrics":{"mean_size_pct":-9.848261,"mean_psnr_gap_db":0.226521,"max_size_pct":-0.822017,"min_psnr_gap_db":-0.287501},"status":"discard","description":"Parity probe: disable rectangular (16x8/8x16) merges by setting entropy_mul_rect huge. No primary metric change, so rect merges are not the remaining bottleneck.","timestamp":1773475953513,"segment":1}
{"run":655,"commit":"68efe9c","metric":1.800384,"metrics":{"mean_size_pct":-9.849306,"mean_psnr_gap_db":0.226394,"max_size_pct":-0.827243,"min_psnr_gap_db":-0.287501},"status":"discard","description":"Parity probe: disable 32x32 merges (entropy_mul_32 huge). Metrics unchanged, indicating 32x32 merges are already inactive at current settings.","timestamp":1773476009694,"segment":1}
{"run":656,"commit":"68efe9c","metric":1.800384,"metrics":{"mean_size_pct":-9.849306,"mean_psnr_gap_db":0.226394,"max_size_pct":-0.827243,"min_psnr_gap_db":-0.287501},"status":"discard","description":"Parity probe: disable 16x16 merges entirely (entropy_mul_16 huge). Metrics unchanged, so current winning configuration is already at the no-16x16-merge plateau.","timestamp":1773476078683,"segment":1}
{"run":657,"commit":"68efe9c","metric":1.808455,"metrics":{"mean_size_pct":-9.856676,"mean_psnr_gap_db":0.226393,"max_size_pct":-0.835796,"min_psnr_gap_db":-0.28772},"status":"discard","description":"Fine-tune B multiplier to 0.935 under conservative merge setup. Regresses parity vs 0.93 baseline, discard.","timestamp":1773476139232,"segment":1}
{"run":658,"commit":"68efe9c","metric":0,"metrics":{"mean_size_pct":0,"mean_psnr_gap_db":0,"max_size_pct":0,"min_psnr_gap_db":0},"status":"crash","description":"Attempted low-frequency B dequant weight tweak but build failed: default_dct8x8_dequant_weights returns immutable slice; cannot mutate directly.","timestamp":1773476197124,"segment":1}
{"run":659,"commit":"68efe9c","metric":2.156563,"metrics":{"mean_size_pct":-9.725973,"mean_psnr_gap_db":0.196649,"max_size_pct":-0.706554,"min_psnr_gap_db":-0.319711},"status":"discard","description":"Apply low-frequency B dequant tweak (k<=2 Manhattan, weight*0.9) by cloning DCT8 weights. Regresses parity (worse PSNR floor and size), discard.","timestamp":1773476252680,"segment":1}
{"run":660,"commit":"68efe9c","metric":1.800384,"metrics":{"mean_size_pct":-9.849306,"mean_psnr_gap_db":0.226394,"max_size_pct":-0.827243,"min_psnr_gap_db":-0.287501},"status":"discard","description":"Require >=512-byte gain before selecting non-uniform adaptive quant map. No effect on corpus, discard.","timestamp":1773476344933,"segment":1}
{"run":661,"commit":"68efe9c","metric":1.800384,"metrics":{"mean_size_pct":-9.849306,"mean_psnr_gap_db":0.226394,"max_size_pct":-0.827243,"min_psnr_gap_db":-0.287501},"status":"discard","description":"Increase adaptive-map minimum byte gain threshold to 2048. Still no measurable effect; discard.","timestamp":1773476403805,"segment":1}
{"run":662,"commit":"68efe9c","metric":4.444235,"metrics":{"mean_size_pct":-3.521833,"mean_psnr_gap_db":0.899358,"max_size_pct":8.90534,"min_psnr_gap_db":0.530647},"status":"discard","description":"Force near-always uniform map by setting ADAPTIVE_RAW_QUANT_MIN_GAIN_BYTES huge. Massive size regression (max_size +8.9%), confirms adaptive map is critical.","timestamp":1773476455227,"segment":1}
{"run":663,"commit":"68efe9c","metric":1.800384,"metrics":{"mean_size_pct":-9.849306,"mean_psnr_gap_db":0.226394,"max_size_pct":-0.827243,"min_psnr_gap_db":-0.287501},"status":"discard","description":"Added near-lossless quality tie-break (allow +2.5% bytes if decoded PSNR gain >=0.12dB). No measurable effect on corpus; discard.","timestamp":1773476549897,"segment":1}
{"run":664,"commit":"68efe9c","metric":4.444235,"metrics":{"mean_size_pct":-3.521833,"mean_psnr_gap_db":0.899358,"max_size_pct":8.90534,"min_psnr_gap_db":0.530647},"status":"discard","description":"Loosen quality tie-break to +10% bytes with >=0.05dB PSNR gain. It over-selects larger candidates and reproduces the large size regression; discard.","timestamp":1773476609502,"segment":1}
{"run":665,"commit":"68efe9c","metric":1.800384,"metrics":{"mean_size_pct":-9.849306,"mean_psnr_gap_db":0.226394,"max_size_pct":-0.827243,"min_psnr_gap_db":-0.287501},"status":"discard","description":"Increase blue_modulation K_MUL from libjxl value to 1.2 to favor blue-heavy blocks. No measurable effect on corpus; discard.","timestamp":1773476768956,"segment":1}
{"run":666,"commit":"68efe9c","metric":1.874581,"metrics":{"mean_size_pct":-9.886827,"mean_psnr_gap_db":0.232849,"max_size_pct":-0.917048,"min_psnr_gap_db":-0.295165},"status":"discard","description":"Reduce CfL towards-zero shrink from 2.6 to 2.2 (stronger CfL). Regresses parity under current setup, discard.","timestamp":1773476827776,"segment":1}
{"run":667,"commit":"5f9fb3e","metric":1.768474,"metrics":{"mean_size_pct":-9.828687,"mean_psnr_gap_db":0.222047,"max_size_pct":-0.795883,"min_psnr_gap_db":-0.295799},"status":"keep","description":"Increase CfL towards-zero shrink from 2.6 to 2.8 (slightly damp CfL factors). Large parity improvement to 1.768 under current conservative-merge setup.","timestamp":1773476886704,"segment":1}
