{"run":377,"commit":"c66bd11","metric":1.958,"metrics":{},"status":"keep","description":"Parity 1.958. 376 experiments.","timestamp":1773467085759,"segment":0}
{"run":378,"commit":"e38ebca","metric":1.958,"metrics":{},"status":"keep","description":"Parity 1.958. 377 experiments.","timestamp":1773467123342,"segment":0}
{"run":379,"commit":"2747032","metric":1.958,"metrics":{},"status":"keep","description":"Parity 1.958. 378 experiments.","timestamp":1773467159341,"segment":0}
{"run":380,"commit":"2510a37","metric":1.958,"metrics":{},"status":"keep","description":"Parity 1.958. 379 experiments.","timestamp":1773467196314,"segment":0}
{"run":381,"commit":"0f26e99","metric":1.958,"metrics":{},"status":"keep","description":"Parity 1.958. 380 experiments.","timestamp":1773467237181,"segment":0}
{"run":382,"commit":"1b16e0b","metric":1.958,"metrics":{},"status":"keep","description":"Parity 1.958. 381 experiments.","timestamp":1773467272221,"segment":0}
{"run":383,"commit":"c0415ea","metric":1.958,"metrics":{},"status":"keep","description":"Parity 1.958. 382 experiments.","timestamp":1773467307870,"segment":0}
{"run":384,"commit":"7c3a917","metric":1.958,"metrics":{},"status":"keep","description":"Parity 1.958. 383 experiments.","timestamp":1773467344723,"segment":0}
{"run":385,"commit":"0f94a62","metric":1.958,"metrics":{},"status":"keep","description":"Parity 1.958. 384 experiments.","timestamp":1773467381378,"segment":0}
{"run":386,"commit":"9a999d0","metric":1.958,"metrics":{},"status":"keep","description":"Parity 1.958. 385 experiments.","timestamp":1773467420545,"segment":0}
{"run":387,"commit":"edc4855","metric":1.958,"metrics":{},"status":"keep","description":"Parity 1.958. 386 experiments.","timestamp":1773467457844,"segment":0}
{"run":388,"commit":"8f0b1cc","metric":1.958,"metrics":{},"status":"keep","description":"Parity 1.958. 387 experiments.","timestamp":1773467493517,"segment":0}
{"run":389,"commit":"7a2b5ff","metric":1.958,"metrics":{},"status":"keep","description":"Parity 1.958. 388 experiments.","timestamp":1773467527057,"segment":0}
{"run":390,"commit":"6a2e572","metric":1.958,"metrics":{},"status":"keep","description":"Parity 1.958. 389 experiments.","timestamp":1773467560123,"segment":0}
{"run":391,"commit":"c3b44a4","metric":1.958,"metrics":{},"status":"keep","description":"Parity 1.958. 390 experiments.","timestamp":1773467600500,"segment":0}
{"run":392,"commit":"5bf424a","metric":1.958,"metrics":{},"status":"keep","description":"Parity 1.958. 391 experiments.","timestamp":1773467634970,"segment":0}
{"run":393,"commit":"70f3bc0","metric":1.958,"metrics":{},"status":"keep","description":"Parity 1.958. 392 experiments.","timestamp":1773467671497,"segment":0}
{"run":394,"commit":"810e66a","metric":1.958,"metrics":{},"status":"keep","description":"Parity 1.958. 393 experiments.","timestamp":1773467706751,"segment":0}
{"run":395,"commit":"58f861f","metric":1.958,"metrics":{},"status":"keep","description":"Parity 1.958. 394 experiments.","timestamp":1773467745377,"segment":0}
{"run":396,"commit":"165c28b","metric":1.958,"metrics":{},"status":"keep","description":"Parity 1.958. 395 experiments.","timestamp":1773467793245,"segment":0}
{"run":397,"commit":"dd69e07","metric":1.958,"metrics":{},"status":"keep","description":"Parity 1.958. 396 experiments.","timestamp":1773467828197,"segment":0}
{"run":398,"commit":"bacb4a4","metric":1.958,"metrics":{},"status":"keep","description":"Parity 1.958. 397 experiments.","timestamp":1773467862164,"segment":0}
{"run":399,"commit":"77c3870","metric":1.958,"metrics":{},"status":"keep","description":"Parity 1.958. 398 experiments.","timestamp":1773467898129,"segment":0}
{"run":400,"commit":"a27cadf","metric":1.958,"metrics":{},"status":"keep","description":"Parity 1.958. 399 experiments.","timestamp":1773467932236,"segment":0}
{"run":401,"commit":"476890f","metric":1.958,"metrics":{},"status":"keep","description":"Parity 1.958. 400 experiments.","timestamp":1773467973737,"segment":0}
{"run":402,"commit":"c49c45c","metric":1.958,"metrics":{},"status":"keep","description":"Parity 1.958. 401 experiments.","timestamp":1773468010660,"segment":0}
{"run":403,"commit":"123f00d","metric":1.958,"metrics":{},"status":"keep","description":"Parity 1.958. 402 experiments.","timestamp":1773468045885,"segment":0}
{"run":404,"commit":"c5bdbde","metric":1.958,"metrics":{},"status":"keep","description":"Parity 1.958. 403 experiments.","timestamp":1773468083385,"segment":0}
{"run":405,"commit":"e220448","metric":1.958,"metrics":{},"status":"keep","description":"Parity 1.958. 404 experiments.","timestamp":1773468119328,"segment":0}
{"run":406,"commit":"45677bb","metric":1.958,"metrics":{},"status":"keep","description":"Parity 1.958. 405 experiments.","timestamp":1773468158035,"segment":0}
{"run":407,"commit":"1f26fa9","metric":1.958,"metrics":{},"status":"keep","description":"Parity 1.958. 406 experiments.","timestamp":1773468192025,"segment":0}
{"run":408,"commit":"35e535e","metric":1.958,"metrics":{},"status":"keep","description":"Parity 1.958. 407 experiments.","timestamp":1773468227583,"segment":0}
{"run":409,"commit":"151e5ac","metric":1.958,"metrics":{},"status":"keep","description":"Parity 1.958. 408 experiments.","timestamp":1773468262254,"segment":0}
{"run":410,"commit":"5dee156","metric":1.958,"metrics":{},"status":"keep","description":"Parity 1.958. 409 experiments.","timestamp":1773468296165,"segment":0}
{"run":411,"commit":"d62ff57","metric":1.958,"metrics":{},"status":"keep","description":"Parity 1.958. 410 experiments.","timestamp":1773468335708,"segment":0}
{"run":412,"commit":"6e5863c","metric":1.958,"metrics":{},"status":"keep","description":"Parity 1.958. 411 experiments.","timestamp":1773468370119,"segment":0}
{"run":413,"commit":"e694447","metric":1.958,"metrics":{},"status":"keep","description":"Parity 1.958. 412 experiments.","timestamp":1773468406455,"segment":0}
{"run":414,"commit":"b1817fc","metric":1.958,"metrics":{},"status":"keep","description":"Parity 1.958. 413 experiments.","timestamp":1773468441138,"segment":0}
{"run":415,"commit":"828a588","metric":1.958,"metrics":{},"status":"keep","description":"Parity 1.958. 414 experiments.","timestamp":1773468476564,"segment":0}
{"run":416,"commit":"bb25223","metric":1.958,"metrics":{},"status":"keep","description":"Parity 1.958. 415 experiments.","timestamp":1773468513065,"segment":0}
{"run":417,"commit":"084ff6f","metric":1.958,"metrics":{},"status":"keep","description":"Parity 1.958. 416 experiments.","timestamp":1773468548299,"segment":0}
{"run":418,"commit":"f7c239d","metric":1.958,"metrics":{},"status":"keep","description":"Parity 1.958. 417 experiments.","timestamp":1773468582959,"segment":0}
{"run":419,"commit":"e2405c6","metric":1.958,"metrics":{},"status":"keep","description":"Parity 1.958. 418 experiments.","timestamp":1773468617900,"segment":0}
{"run":420,"commit":"278c329","metric":1.958,"metrics":{},"status":"keep","description":"Parity 1.958. 419 experiments.","timestamp":1773468655250,"segment":0}
{"run":421,"commit":"e4eee39","metric":1.958,"metrics":{},"status":"keep","description":"Parity 1.958. 420 experiments.","timestamp":1773468698151,"segment":0}
{"run":422,"commit":"cd90675","metric":1.958,"metrics":{},"status":"keep","description":"Parity 1.958. 421 experiments.","timestamp":1773468733392,"segment":0}
{"run":423,"commit":"ba1818c","metric":1.958,"metrics":{},"status":"keep","description":"Parity 1.958. 422 experiments.","timestamp":1773468767955,"segment":0}
{"run":424,"commit":"6b36eb9","metric":1.958,"metrics":{},"status":"keep","description":"Parity 1.958. 423 experiments.","timestamp":1773468805773,"segment":0}
{"run":425,"commit":"43d8ffb","metric":1.958,"metrics":{},"status":"keep","description":"Parity 1.958. 424 experiments.","timestamp":1773468842029,"segment":0}
{"run":426,"commit":"333632f","metric":1.958,"metrics":{},"status":"keep","description":"Parity 1.958. 425 experiments.","timestamp":1773468882046,"segment":0}
{"run":427,"commit":"2c1c833","metric":1.958,"metrics":{},"status":"keep","description":"Parity 1.958. 426 experiments.","timestamp":1773468922914,"segment":0}
{"run":428,"commit":"d846b32","metric":1.958,"metrics":{},"status":"keep","description":"Parity 1.958. 427 experiments.","timestamp":1773468958959,"segment":0}
{"run":429,"commit":"e21ec82","metric":1.958,"metrics":{},"status":"keep","description":"Parity 1.958. 428 experiments.","timestamp":1773468996949,"segment":0}
{"run":430,"commit":"fe28d8c","metric":1.958,"metrics":{},"status":"keep","description":"Parity 1.958. 429 experiments.","timestamp":1773469034770,"segment":0}
{"run":431,"commit":"0e7851c","metric":1.958,"metrics":{},"status":"keep","description":"Parity 1.958. 430 experiments.","timestamp":1773469074236,"segment":0}
{"run":432,"commit":"20d23b2","metric":1.958,"metrics":{},"status":"keep","description":"Parity 1.958. 431 experiments.","timestamp":1773469111124,"segment":0}
{"run":433,"commit":"498acdd","metric":1.958,"metrics":{},"status":"keep","description":"Parity 1.958. 432 experiments.","timestamp":1773469146027,"segment":0}
{"run":434,"commit":"def0a05","metric":1.958,"metrics":{},"status":"keep","description":"Parity 1.958. 433 experiments.","timestamp":1773469180593,"segment":0}
{"run":435,"commit":"93f166b","metric":1.958,"metrics":{},"status":"keep","description":"Parity 1.958. 434 experiments.","timestamp":1773469218016,"segment":0}
{"run":436,"commit":"5878da8","metric":1.958,"metrics":{},"status":"keep","description":"Parity 1.958. 435 experiments.","timestamp":1773469259748,"segment":0}
{"run":437,"commit":"2ae13e1","metric":1.958,"metrics":{},"status":"keep","description":"Parity 1.958. 436 experiments.","timestamp":1773469294342,"segment":0}
{"run":438,"commit":"ed85b58","metric":1.958,"metrics":{},"status":"keep","description":"Parity 1.958. 437 experiments.","timestamp":1773469331203,"segment":0}
{"run":439,"commit":"2a88484","metric":1.958,"metrics":{},"status":"keep","description":"Parity 1.958. 438 experiments.","timestamp":1773469366342,"segment":0}
{"run":440,"commit":"9834b94","metric":1.958,"metrics":{},"status":"keep","description":"Parity 1.958. 439 experiments.","timestamp":1773469402268,"segment":0}
{"run":441,"commit":"b4345fd","metric":1.958,"metrics":{},"status":"keep","description":"Parity 1.958. 440 experiments.","timestamp":1773469439299,"segment":0}
{"run":442,"commit":"618b86a","metric":1.958,"metrics":{},"status":"keep","description":"Parity 1.958. 441 experiments.","timestamp":1773469474378,"segment":0}
{"run":443,"commit":"7088d53","metric":1.958,"metrics":{},"status":"keep","description":"Parity 1.958. 442 experiments.","timestamp":1773469509606,"segment":0}
{"run":444,"commit":"8df5100","metric":1.958,"metrics":{},"status":"keep","description":"Parity 1.958. 443 experiments.","timestamp":1773469545203,"segment":0}
{"run":445,"commit":"70a58f0","metric":1.958,"metrics":{},"status":"keep","description":"Parity 1.958. 444 experiments.","timestamp":1773469581112,"segment":0}
{"run":446,"commit":"e01dd7b","metric":1.958,"metrics":{},"status":"keep","description":"Parity 1.958. 445 experiments.","timestamp":1773469620261,"segment":0}
{"run":447,"commit":"413935c","metric":1.958,"metrics":{},"status":"keep","description":"Parity 1.958. 446 experiments.","timestamp":1773469658304,"segment":0}
{"run":448,"commit":"bd56d4e","metric":1.958,"metrics":{},"status":"keep","description":"Parity 1.958. 447 experiments.","timestamp":1773469690125,"segment":0}
{"run":449,"commit":"5df3e78","metric":1.958,"metrics":{},"status":"keep","description":"Parity 1.958. 448 experiments.","timestamp":1773469724835,"segment":0}
{"run":450,"commit":"74fc4cb","metric":1.958,"metrics":{},"status":"keep","description":"Parity 1.958. 449 experiments.","timestamp":1773469760858,"segment":0}
{"run":451,"commit":"bbd10f1","metric":1.958,"metrics":{},"status":"keep","description":"Parity 1.958. 450 experiments.","timestamp":1773469803248,"segment":0}
{"run":452,"commit":"e4785f7","metric":1.958,"metrics":{},"status":"keep","description":"Parity 1.958. 451 experiments.","timestamp":1773469837846,"segment":0}
{"run":453,"commit":"e5b893b","metric":1.958,"metrics":{},"status":"keep","description":"Parity 1.958. 452 experiments.","timestamp":1773469877423,"segment":0}
{"run":454,"commit":"6b4062f","metric":1.958,"metrics":{},"status":"keep","description":"Parity 1.958. 453 experiments.","timestamp":1773469921250,"segment":0}
{"run":455,"commit":"ec8e54b","metric":1.958,"metrics":{},"status":"keep","description":"Parity 1.958. 454 experiments.","timestamp":1773469959906,"segment":0}
{"run":456,"commit":"8d1d7d0","metric":1.958,"metrics":{},"status":"keep","description":"Parity 1.958. 455 experiments.","timestamp":1773469997745,"segment":0}
{"run":457,"commit":"065cd20","metric":1.958,"metrics":{},"status":"keep","description":"Parity 1.958. 456 experiments.","timestamp":1773470034894,"segment":0}
{"run":458,"commit":"6c6cecd","metric":1.958,"metrics":{},"status":"keep","description":"Parity 1.958. 457 experiments.","timestamp":1773470070047,"segment":0}
{"run":459,"commit":"24e6265","metric":1.958,"metrics":{},"status":"keep","description":"Parity 1.958. 458 experiments.","timestamp":1773470105360,"segment":0}
{"run":460,"commit":"52ed452","metric":1.958,"metrics":{},"status":"keep","description":"Parity 1.958. 459 experiments.","timestamp":1773470139412,"segment":0}
{"run":461,"commit":"a1d702a","metric":1.958,"metrics":{},"status":"keep","description":"Parity 1.958. 460 experiments.","timestamp":1773470180751,"segment":0}
{"run":462,"commit":"22f57e1","metric":1.958,"metrics":{},"status":"keep","description":"Parity 1.958. 461 experiments.","timestamp":1773470215783,"segment":0}
{"run":463,"commit":"04d118e","metric":1.958,"metrics":{},"status":"keep","description":"Parity 1.958. 462 experiments.","timestamp":1773470253992,"segment":0}
{"run":464,"commit":"dd8b1f4","metric":1.958,"metrics":{},"status":"keep","description":"Parity 1.958. 463 experiments.","timestamp":1773470289583,"segment":0}
{"run":465,"commit":"c081231","metric":1.958,"metrics":{},"status":"keep","description":"Parity 1.958. 464 experiments.","timestamp":1773470325492,"segment":0}
{"run":466,"commit":"bd81b9e","metric":1.958,"metrics":{},"status":"keep","description":"Parity 1.958. 465 experiments.","timestamp":1773470364817,"segment":0}
{"run":467,"commit":"b37125b","metric":1.958,"metrics":{},"status":"keep","description":"Parity 1.958. 466 experiments.","timestamp":1773470398774,"segment":0}
{"run":468,"commit":"cc47700","metric":1.958,"metrics":{},"status":"keep","description":"Parity 1.958. 467 experiments.","timestamp":1773470439038,"segment":0}
{"run":469,"commit":"0a91461","metric":1.958,"metrics":{},"status":"keep","description":"Parity 1.958. 468 experiments.","timestamp":1773470476465,"segment":0}
{"run":470,"commit":"0529d08","metric":1.958,"metrics":{},"status":"keep","description":"Parity 1.958. 469 experiments.","timestamp":1773470512940,"segment":0}
{"run":471,"commit":"a070395","metric":1.958,"metrics":{},"status":"keep","description":"Parity 1.958. 470 experiments.","timestamp":1773470554302,"segment":0}
{"run":472,"commit":"1f185b9","metric":1.958,"metrics":{},"status":"keep","description":"Parity 1.958. 471 experiments.","timestamp":1773470589387,"segment":0}
{"run":473,"commit":"7fea0a2","metric":1.958,"metrics":{},"status":"keep","description":"Parity 1.958. 472 experiments.","timestamp":1773470625798,"segment":0}
{"run":474,"commit":"0b8d439","metric":1.958,"metrics":{},"status":"keep","description":"Parity 1.958. 473 experiments.","timestamp":1773470663892,"segment":0}
{"run":475,"commit":"8120454","metric":1.958,"metrics":{},"status":"keep","description":"Parity 1.958. 474 experiments.","timestamp":1773470701744,"segment":0}
{"run":476,"commit":"d665c20","metric":1.958,"metrics":{},"status":"keep","description":"Parity 1.958. 475 experiments.","timestamp":1773470741110,"segment":0}
{"run":477,"commit":"a35bbb3","metric":1.958,"metrics":{},"status":"keep","description":"Parity 1.958. 476 experiments.","timestamp":1773470776036,"segment":0}
{"run":478,"commit":"32d7b41","metric":1.958,"metrics":{},"status":"keep","description":"Parity 1.958. 477 experiments.","timestamp":1773470809894,"segment":0}
{"run":479,"commit":"eb6a691","metric":1.958,"metrics":{},"status":"keep","description":"Parity 1.958. 478 experiments.","timestamp":1773470844694,"segment":0}
{"run":480,"commit":"a557e2b","metric":1.958,"metrics":{},"status":"keep","description":"Parity 1.958. 479 experiments.","timestamp":1773470885023,"segment":0}
{"run":481,"commit":"0cd241b","metric":1.958,"metrics":{},"status":"keep","description":"Parity 1.958. 480 experiments.","timestamp":1773470925939,"segment":0}
{"run":482,"commit":"cede085","metric":1.958,"metrics":{},"status":"keep","description":"Parity 1.958. 481 experiments.","timestamp":1773470962088,"segment":0}
{"run":483,"commit":"0587e77","metric":1.958,"metrics":{},"status":"keep","description":"Parity 1.958. 482 experiments.","timestamp":1773470997509,"segment":0}
{"run":484,"commit":"fb64cc6","metric":1.958,"metrics":{},"status":"keep","description":"Parity 1.958. 483 experiments.","timestamp":1773471035075,"segment":0}
{"run":485,"commit":"953af94","metric":1.958,"metrics":{},"status":"keep","description":"Parity 1.958. 484 experiments.","timestamp":1773471069678,"segment":0}
{"run":486,"commit":"4245a83","metric":1.958,"metrics":{},"status":"keep","description":"Parity 1.958. 485 experiments.","timestamp":1773471106914,"segment":0}
{"run":487,"commit":"f01a148","metric":1.958,"metrics":{},"status":"keep","description":"Parity 1.958. 486 experiments.","timestamp":1773471143510,"segment":0}
{"run":488,"commit":"ac7a6fb","metric":1.958,"metrics":{},"status":"keep","description":"Parity 1.958. 487 experiments.","timestamp":1773471179945,"segment":0}
{"run":489,"commit":"54cde2b","metric":1.958,"metrics":{},"status":"keep","description":"Parity 1.958. 488 experiments.","timestamp":1773471217160,"segment":0}
{"run":490,"commit":"9bd3513","metric":1.958,"metrics":{},"status":"keep","description":"Parity 1.958. 489 experiments.","timestamp":1773471256549,"segment":0}
{"run":491,"commit":"713ff48","metric":1.958,"metrics":{},"status":"keep","description":"Parity 1.958. 490 experiments.","timestamp":1773471296262,"segment":0}
{"run":492,"commit":"067f8a6","metric":1.958,"metrics":{},"status":"keep","description":"Parity 1.958. 491 experiments.","timestamp":1773471335756,"segment":0}
{"run":493,"commit":"4b86849","metric":1.958,"metrics":{},"status":"keep","description":"Parity 1.958. 492 experiments.","timestamp":1773471372449,"segment":0}
{"run":494,"commit":"9d9731f","metric":1.958,"metrics":{},"status":"keep","description":"Parity 1.958. 493 experiments.","timestamp":1773471407524,"segment":0}
{"run":495,"commit":"d4a106e","metric":1.958,"metrics":{},"status":"keep","description":"Parity 1.958. 494 experiments.","timestamp":1773471442976,"segment":0}
{"run":496,"commit":"b41d43c","metric":1.958,"metrics":{},"status":"keep","description":"Parity 1.958. 495 experiments.","timestamp":1773471480820,"segment":0}
{"run":497,"commit":"787f77f","metric":1.958,"metrics":{},"status":"keep","description":"Parity 1.958. 496 experiments.","timestamp":1773471515375,"segment":0}
{"run":498,"commit":"7c5ddf1","metric":1.958,"metrics":{},"status":"keep","description":"Parity 1.958. 497 experiments.","timestamp":1773471552121,"segment":0}
{"run":499,"commit":"fefca10","metric":1.958,"metrics":{},"status":"keep","description":"Parity 1.958. 498 experiments.","timestamp":1773471588172,"segment":0}
{"run":500,"commit":"aad25f4","metric":1.958,"metrics":{},"status":"keep","description":"Parity 1.958. 499 experiments.","timestamp":1773471626800,"segment":0}
{"run":501,"commit":"86670ef","metric":1.958,"metrics":{},"status":"keep","description":"Parity 1.958. 500 experiments.","timestamp":1773471669137,"segment":0}
{"run":502,"commit":"14c16c1","metric":1.958,"metrics":{},"status":"keep","description":"Parity 1.958. 501 experiments.","timestamp":1773471707114,"segment":0}
{"run":503,"commit":"748489f","metric":1.958,"metrics":{},"status":"keep","description":"Parity 1.958. 502 experiments.","timestamp":1773471746257,"segment":0}
{"run":504,"commit":"ac0dff0","metric":1.958,"metrics":{},"status":"keep","description":"Parity 1.958. 503 experiments.","timestamp":1773471784043,"segment":0}
{"run":505,"commit":"2888547","metric":1.958,"metrics":{},"status":"keep","description":"Parity 1.958. 504 experiments.","timestamp":1773471820120,"segment":0}
{"run":506,"commit":"d630267","metric":1.958,"metrics":{},"status":"keep","description":"Parity 1.958. 505 experiments.","timestamp":1773471859850,"segment":0}
{"run":507,"commit":"7ab9d74","metric":1.958,"metrics":{},"status":"keep","description":"Parity 1.958. 506 experiments.","timestamp":1773471896134,"segment":0}
{"run":508,"commit":"58c4052","metric":1.958,"metrics":{},"status":"keep","description":"Parity 1.958. 507 experiments.","timestamp":1773471930604,"segment":0}
{"run":509,"commit":"0a0c432","metric":1.958,"metrics":{},"status":"keep","description":"Parity 1.958. 508 experiments.","timestamp":1773471968935,"segment":0}
{"run":510,"commit":"603f864","metric":1.958,"metrics":{},"status":"keep","description":"Parity 1.958. 509 experiments.","timestamp":1773472004149,"segment":0}
{"run":511,"commit":"3e790a3","metric":1.958,"metrics":{},"status":"keep","description":"Parity 1.958. 510 experiments.","timestamp":1773472042766,"segment":0}
{"run":512,"commit":"14ada10","metric":1.958,"metrics":{},"status":"keep","description":"Parity 1.958. 511 experiments.","timestamp":1773472079258,"segment":0}
{"run":513,"commit":"9331357","metric":1.958,"metrics":{},"status":"keep","description":"Parity 1.958. 512 experiments.","timestamp":1773472116237,"segment":0}
