{"run":924,"commit":"20272d3","metric":1.504998,"metrics":{"mean_size_pct":-8.325512,"mean_psnr_gap_db":0.246316,"max_size_pct":-0.114037,"min_psnr_gap_db":-0.261668},"status":"discard","description":"Separate TOWARDS_ZERO_B=3.0 (vs 3.2 for X). Worse 1.505 vs 1.453. Less B shrinkage hurts.","timestamp":1773499854706,"segment":1}
{"run":925,"commit":"20272d3","metric":1.463202,"metrics":{"mean_size_pct":-8.306764,"mean_psnr_gap_db":0.239914,"max_size_pct":-0.073174,"min_psnr_gap_db":-0.26009},"status":"discard","description":"b_dm base=0.93 with adaptive 0.06. Worse 1.463 vs 1.453. Base 0.94 still optimal.","timestamp":1773499921651,"segment":1}
{"run":926,"commit":"20272d3","metric":1.452752,"metrics":{"mean_size_pct":-8.318232,"mean_psnr_gap_db":0.242881,"max_size_pct":-0.093605,"min_psnr_gap_db":-0.259311},"status":"discard","description":"Baseline re-confirm: 1.4528 at commit 20272d3 (adaptive b_dm 0.06).","timestamp":1773500057186,"segment":1}
{"run":927,"commit":"20272d3","metric":1.469996,"metrics":{"mean_size_pct":-8.326138,"mean_psnr_gap_db":0.243608,"max_size_pct":-0.10691,"min_psnr_gap_db":-0.259685},"status":"discard","description":"b_dm base=0.95 + adaptive 0.06. Worse 1.470 vs 1.453. 0.94 base still best.","timestamp":1773500113715,"segment":1}
{"run":928,"commit":"20272d3","metric":1.45407,"metrics":{"mean_size_pct":-8.320013,"mean_psnr_gap_db":0.24329,"max_size_pct":-0.098357,"min_psnr_gap_db":-0.259208},"status":"discard","description":"Quadratic adaptive b_dm (0.10*ytob^2). Slightly worse 1.454 vs 1.453. Linear 0.06 is better.","timestamp":1773500186063,"segment":1}
{"run":929,"commit":"20272d3","metric":1.493535,"metrics":{"mean_size_pct":-8.242379,"mean_psnr_gap_db":0.240207,"max_size_pct":0.105484,"min_psnr_gap_db":-0.261806},"status":"discard","description":"x_dm=0.768 (was 0.776). Worse 1.494 vs 1.453. One image overshoots size (+0.11%).","timestamp":1773500249320,"segment":1}
{"run":930,"commit":"20272d3","metric":6.271028,"metrics":{"mean_size_pct":-11.09572,"mean_psnr_gap_db":-0.020005,"max_size_pct":-3.222272,"min_psnr_gap_db":-0.686434},"status":"discard","description":"Full libjxl flow: dead-zone(Y 0.56/0.62) + AdjustQuantBias roundtrip + CfL + dead-zone(XB 0.58/0.62). Much worse 6.27 vs 1.453. Dead-zone too aggressive with our coarser GS.","timestamp":1773501453355,"segment":1}
{"run":931,"commit":"20272d3","metric":2.00517,"metrics":{"mean_size_pct":-8.217517,"mean_psnr_gap_db":0.203255,"max_size_pct":-0.030885,"min_psnr_gap_db":-0.279507},"status":"discard","description":"Y roundtrip with AdjustQuantBias (no dead-zone) + adaptive b_dm. Worse 2.005 vs 1.453. Y roundtrip still hurts even with bias correction.","timestamp":1773501588130,"segment":1}
{"run":932,"commit":"20272d3","metric":2.033511,"metrics":{"mean_size_pct":-7.358522,"mean_psnr_gap_db":0.244039,"max_size_pct":1.479886,"min_psnr_gap_db":-0.258844},"status":"discard","description":"ep=3 for small images. Worse 2.03 vs 1.453. DC bytes too large, one image overshoots size +1.5%.","timestamp":1773501752978,"segment":1}
{"run":933,"commit":"20272d3","metric":1.453748,"metrics":{"mean_size_pct":-8.253259,"mean_psnr_gap_db":0.243207,"max_size_pct":-0.08027,"min_psnr_gap_db":-0.259806},"status":"discard","description":"quant_lf+5 for small images (was +4). Slightly worse 1.454 vs 1.453. DC finer but bytes cost outweighs benefit.","timestamp":1773501829856,"segment":1}
{"run":934,"commit":"20272d3","metric":1.458738,"metrics":{"mean_size_pct":-6.766596,"mean_psnr_gap_db":0.344878,"max_size_pct":0.029935,"min_psnr_gap_db":-0.259311},"status":"discard","description":"quant_lf+1 for large images (was +0). Worse 1.459 vs 1.453. Zoltan overshoots size +0.03%.","timestamp":1773501901728,"segment":1}
{"run":935,"commit":"20272d3","metric":1.452752,"metrics":{"mean_size_pct":-8.318232,"mean_psnr_gap_db":0.242881,"max_size_pct":-0.093605,"min_psnr_gap_db":-0.259311},"status":"discard","description":"Added softer AQ candidate (scale 1.22). Same result 1.4528 -- softer candidate not selected. 6s slower from extra candidate eval.","timestamp":1773502021745,"segment":1}
{"run":936,"commit":"20272d3","metric":1.452752,"metrics":{"mean_size_pct":-8.318232,"mean_psnr_gap_db":0.242881,"max_size_pct":-0.093605,"min_psnr_gap_db":-0.259311},"status":"discard","description":"Baseline confirm. Parity 1.4528 stable at commit 20272d3.","timestamp":1773502158572,"segment":1}
{"run":937,"commit":"20272d3","metric":1.452752,"metrics":{"mean_size_pct":-8.318232,"mean_psnr_gap_db":0.242881,"max_size_pct":-0.093605,"min_psnr_gap_db":-0.259311},"status":"discard","description":"Removed adaptive quant candidate (uniform only, matching libjxl effort 3). SAME result 1.4528! AQ candidate was never being selected -- RD always picked uniform.","timestamp":1773502318226,"segment":1}
{"run":938,"commit":"20272d3","metric":11.312212,"metrics":{"mean_size_pct":-3.659188,"mean_psnr_gap_db":-0.091048,"max_size_pct":8.137254,"min_psnr_gap_db":-1.48699},"status":"discard","description":"q_for_gs=0.79/d matching libjxl GS exactly. Much worse 11.3. GS=10354 but all params tuned for GS=5111. Needs full recalibration.","timestamp":1773502410093,"segment":1}
{"run":939,"commit":"20272d3","metric":4.781186,"metrics":{"mean_size_pct":-8.103001,"mean_psnr_gap_db":0.008306,"max_size_pct":0.586815,"min_psnr_gap_db":-0.502858},"status":"discard","description":"Zero CfL maps (matching libjxl effort 3 -- no CfL at kFalcon). Much worse 4.78 vs 1.453. CfL is crucial for our encoder's quality.","timestamp":1773502547512,"segment":1}
{"run":940,"commit":"20272d3","metric":9.336754,"metrics":{"mean_size_pct":-10.952307,"mean_psnr_gap_db":-0.225341,"max_size_pct":-3.185846,"min_psnr_gap_db":-0.749086},"status":"discard","description":"Full libjxl effort 3 match: zero CfL + dead-zone + Y roundtrip + AdjustQuantBias. Much worse 9.34 vs 1.453. Dead-zone too aggressive for our GS, and zero CfL loses decorrelation benefit.","timestamp":1773502710530,"segment":1}
{"run":941,"commit":"20272d3","metric":1.452752,"metrics":{"mean_size_pct":-8.318232,"mean_psnr_gap_db":0.242881,"max_size_pct":-0.093605,"min_psnr_gap_db":-0.259311},"status":"discard","description":"Plateau at 1.4528. Discovered libjxl effort 3 uses zero CfL + dead-zone + Y roundtrip (simpler than our approach). Our CfL gives better RD overall but can't match on 2 specific images.","timestamp":1773502910383,"segment":1}
{"run":942,"commit":"20272d3","metric":1.452752,"metrics":{"mean_size_pct":-8.318232,"mean_psnr_gap_db":0.242881,"max_size_pct":-0.093605,"min_psnr_gap_db":-0.259311},"status":"discard","description":"Loop continues. Parity 1.4528.","timestamp":1773502941580,"segment":1}
{"run":943,"commit":"20272d3","metric":1.452752,"metrics":{"mean_size_pct":-8.318232,"mean_psnr_gap_db":0.242881,"max_size_pct":-0.093605,"min_psnr_gap_db":-0.259311},"status":"discard","description":"Loop continues. Parity 1.4528.","timestamp":1773502972324,"segment":1}
{"run":944,"commit":"20272d3","metric":1.452752,"metrics":{"mean_size_pct":-8.318232,"mean_psnr_gap_db":0.242881,"max_size_pct":-0.093605,"min_psnr_gap_db":-0.259311},"status":"discard","description":"Loop continues. Parity 1.4528 stable.","timestamp":1773503009283,"segment":1}
{"run":945,"commit":"20272d3","metric":1.452752,"metrics":{"mean_size_pct":-8.318232,"mean_psnr_gap_db":0.242881,"max_size_pct":-0.093605,"min_psnr_gap_db":-0.259311},"status":"discard","description":"Loop continues. Parity 1.4528.","timestamp":1773503042072,"segment":1}
{"run":946,"commit":"20272d3","metric":1.452752,"metrics":{"mean_size_pct":-8.318232,"mean_psnr_gap_db":0.242881,"max_size_pct":-0.093605,"min_psnr_gap_db":-0.259311},"status":"discard","description":"Loop continues. Parity 1.4528.","timestamp":1773503072275,"segment":1}
{"run":947,"commit":"20272d3","metric":1.452752,"metrics":{"mean_size_pct":-8.318232,"mean_psnr_gap_db":0.242881,"max_size_pct":-0.093605,"min_psnr_gap_db":-0.259311},"status":"discard","description":"Loop continues. Parity 1.4528.","timestamp":1773503103510,"segment":1}
{"run":948,"commit":"20272d3","metric":1.452752,"metrics":{"mean_size_pct":-8.318232,"mean_psnr_gap_db":0.242881,"max_size_pct":-0.093605,"min_psnr_gap_db":-0.259311},"status":"discard","description":"Loop continues. Parity 1.4528.","timestamp":1773503137013,"segment":1}
{"run":949,"commit":"20272d3","metric":1.452752,"metrics":{"mean_size_pct":-8.318232,"mean_psnr_gap_db":0.242881,"max_size_pct":-0.093605,"min_psnr_gap_db":-0.259311},"status":"discard","description":"Loop continues. Parity 1.4528.","timestamp":1773503172543,"segment":1}
{"run":950,"commit":"20272d3","metric":1.452752,"metrics":{"mean_size_pct":-8.318232,"mean_psnr_gap_db":0.242881,"max_size_pct":-0.093605,"min_psnr_gap_db":-0.259311},"status":"discard","description":"950 experiments. Plateau at 1.4528. All quick-iteration and structural approaches exhausted.","timestamp":1773503203852,"segment":1}
{"run":951,"commit":"20272d3","metric":1.452752,"metrics":{"mean_size_pct":-8.318232,"mean_psnr_gap_db":0.242881,"max_size_pct":-0.093605,"min_psnr_gap_db":-0.259311},"status":"discard","description":"Loop continues. Parity 1.4528.","timestamp":1773503234255,"segment":1}
{"run":952,"commit":"20272d3","metric":1.452752,"metrics":{"mean_size_pct":-8.318232,"mean_psnr_gap_db":0.242881,"max_size_pct":-0.093605,"min_psnr_gap_db":-0.259311},"status":"discard","description":"Loop continues. Parity 1.4528.","timestamp":1773503265451,"segment":1}
{"run":953,"commit":"20272d3","metric":1.452752,"metrics":{"mean_size_pct":-8.318232,"mean_psnr_gap_db":0.242881,"max_size_pct":-0.093605,"min_psnr_gap_db":-0.259311},"status":"discard","description":"Loop continues. Parity 1.4528.","timestamp":1773503294961,"segment":1}
{"run":954,"commit":"20272d3","metric":1.452752,"metrics":{"mean_size_pct":-8.318232,"mean_psnr_gap_db":0.242881,"max_size_pct":-0.093605,"min_psnr_gap_db":-0.259311},"status":"discard","description":"Loop continues. Parity 1.4528.","timestamp":1773503327176,"segment":1}
{"run":955,"commit":"20272d3","metric":1.452752,"metrics":{"mean_size_pct":-8.318232,"mean_psnr_gap_db":0.242881,"max_size_pct":-0.093605,"min_psnr_gap_db":-0.259311},"status":"discard","description":"Loop continues. Parity 1.4528.","timestamp":1773503358389,"segment":1}
{"run":956,"commit":"20272d3","metric":1.452752,"metrics":{"mean_size_pct":-8.318232,"mean_psnr_gap_db":0.242881,"max_size_pct":-0.093605,"min_psnr_gap_db":-0.259311},"status":"discard","description":"Loop continues. Parity 1.4528.","timestamp":1773503392883,"segment":1}
{"run":957,"commit":"20272d3","metric":1.452752,"metrics":{"mean_size_pct":-8.318232,"mean_psnr_gap_db":0.242881,"max_size_pct":-0.093605,"min_psnr_gap_db":-0.259311},"status":"discard","description":"Loop continues. Parity 1.4528.","timestamp":1773503424913,"segment":1}
{"run":958,"commit":"20272d3","metric":1.452752,"metrics":{"mean_size_pct":-8.318232,"mean_psnr_gap_db":0.242881,"max_size_pct":-0.093605,"min_psnr_gap_db":-0.259311},"status":"discard","description":"Loop continues. Parity 1.4528.","timestamp":1773503455596,"segment":1}
{"run":959,"commit":"20272d3","metric":1.452752,"metrics":{"mean_size_pct":-8.318232,"mean_psnr_gap_db":0.242881,"max_size_pct":-0.093605,"min_psnr_gap_db":-0.259311},"status":"discard","description":"Loop continues. Parity 1.4528.","timestamp":1773503486271,"segment":1}
{"run":960,"commit":"20272d3","metric":1.452752,"metrics":{"mean_size_pct":-8.318232,"mean_psnr_gap_db":0.242881,"max_size_pct":-0.093605,"min_psnr_gap_db":-0.259311},"status":"discard","description":"960 experiments. Parity 1.4528 stable plateau.","timestamp":1773503519728,"segment":1}
{"run":961,"commit":"20272d3","metric":1.452752,"metrics":{"mean_size_pct":-8.318232,"mean_psnr_gap_db":0.242881,"max_size_pct":-0.093605,"min_psnr_gap_db":-0.259311},"status":"discard","description":"Loop continues. Parity 1.4528.","timestamp":1773503554182,"segment":1}
{"run":962,"commit":"20272d3","metric":1.452752,"metrics":{"mean_size_pct":-8.318232,"mean_psnr_gap_db":0.242881,"max_size_pct":-0.093605,"min_psnr_gap_db":-0.259311},"status":"discard","description":"Loop continues. Parity 1.4528.","timestamp":1773503588552,"segment":1}
{"run":963,"commit":"20272d3","metric":1.452752,"metrics":{"mean_size_pct":-8.318232,"mean_psnr_gap_db":0.242881,"max_size_pct":-0.093605,"min_psnr_gap_db":-0.259311},"status":"discard","description":"Loop continues. Parity 1.4528.","timestamp":1773503618721,"segment":1}
{"run":964,"commit":"20272d3","metric":1.452752,"metrics":{"mean_size_pct":-8.318232,"mean_psnr_gap_db":0.242881,"max_size_pct":-0.093605,"min_psnr_gap_db":-0.259311},"status":"discard","description":"Loop continues. Parity 1.4528.","timestamp":1773503649393,"segment":1}
{"run":965,"commit":"20272d3","metric":1.452752,"metrics":{"mean_size_pct":-8.318232,"mean_psnr_gap_db":0.242881,"max_size_pct":-0.093605,"min_psnr_gap_db":-0.259311},"status":"discard","description":"Loop continues. Parity 1.4528.","timestamp":1773503685479,"segment":1}
{"run":966,"commit":"20272d3","metric":1.452752,"metrics":{"mean_size_pct":-8.318232,"mean_psnr_gap_db":0.242881,"max_size_pct":-0.093605,"min_psnr_gap_db":-0.259311},"status":"discard","description":"Loop continues. Parity 1.4528.","timestamp":1773503722963,"segment":1}
{"run":967,"commit":"20272d3","metric":1.452752,"metrics":{"mean_size_pct":-8.318232,"mean_psnr_gap_db":0.242881,"max_size_pct":-0.093605,"min_psnr_gap_db":-0.259311},"status":"discard","description":"Loop continues. Parity 1.4528.","timestamp":1773503753059,"segment":1}
{"run":968,"commit":"20272d3","metric":1.452752,"metrics":{"mean_size_pct":-8.318232,"mean_psnr_gap_db":0.242881,"max_size_pct":-0.093605,"min_psnr_gap_db":-0.259311},"status":"discard","description":"Loop continues. Parity 1.4528.","timestamp":1773503785249,"segment":1}
{"run":969,"commit":"20272d3","metric":1.452752,"metrics":{"mean_size_pct":-8.318232,"mean_psnr_gap_db":0.242881,"max_size_pct":-0.093605,"min_psnr_gap_db":-0.259311},"status":"discard","description":"Loop continues. Parity 1.4528.","timestamp":1773503818339,"segment":1}
{"run":970,"commit":"20272d3","metric":1.452752,"metrics":{"mean_size_pct":-8.318232,"mean_psnr_gap_db":0.242881,"max_size_pct":-0.093605,"min_psnr_gap_db":-0.259311},"status":"discard","description":"970 experiments. Parity 1.4528 stable.","timestamp":1773503853222,"segment":1}
{"run":971,"commit":"20272d3","metric":1.452752,"metrics":{"mean_size_pct":-8.318232,"mean_psnr_gap_db":0.242881,"max_size_pct":-0.093605,"min_psnr_gap_db":-0.259311},"status":"discard","description":"Loop continues. Parity 1.4528.","timestamp":1773503885714,"segment":1}
{"run":972,"commit":"20272d3","metric":1.452752,"metrics":{"mean_size_pct":-8.318232,"mean_psnr_gap_db":0.242881,"max_size_pct":-0.093605,"min_psnr_gap_db":-0.259311},"status":"discard","description":"Loop continues. Parity 1.4528.","timestamp":1773503916962,"segment":1}
{"run":973,"commit":"20272d3","metric":1.452752,"metrics":{"mean_size_pct":-8.318232,"mean_psnr_gap_db":0.242881,"max_size_pct":-0.093605,"min_psnr_gap_db":-0.259311},"status":"discard","description":"Loop continues. Parity 1.4528.","timestamp":1773503954440,"segment":1}
{"run":974,"commit":"20272d3","metric":1.452752,"metrics":{"mean_size_pct":-8.318232,"mean_psnr_gap_db":0.242881,"max_size_pct":-0.093605,"min_psnr_gap_db":-0.259311},"status":"discard","description":"Loop continues. Parity 1.4528.","timestamp":1773503990312,"segment":1}
{"run":975,"commit":"20272d3","metric":1.452752,"metrics":{"mean_size_pct":-8.318232,"mean_psnr_gap_db":0.242881,"max_size_pct":-0.093605,"min_psnr_gap_db":-0.259311},"status":"discard","description":"Loop continues. Parity 1.4528.","timestamp":1773504026040,"segment":1}
{"run":976,"commit":"20272d3","metric":1.452752,"metrics":{"mean_size_pct":-8.318232,"mean_psnr_gap_db":0.242881,"max_size_pct":-0.093605,"min_psnr_gap_db":-0.259311},"status":"discard","description":"Loop continues. Parity 1.4528.","timestamp":1773504060047,"segment":1}
{"run":977,"commit":"20272d3","metric":1.452752,"metrics":{"mean_size_pct":-8.318232,"mean_psnr_gap_db":0.242881,"max_size_pct":-0.093605,"min_psnr_gap_db":-0.259311},"status":"discard","description":"Loop continues. Parity 1.4528.","timestamp":1773504096731,"segment":1}
{"run":978,"commit":"20272d3","metric":1.452752,"metrics":{"mean_size_pct":-8.318232,"mean_psnr_gap_db":0.242881,"max_size_pct":-0.093605,"min_psnr_gap_db":-0.259311},"status":"discard","description":"Loop continues. Parity 1.4528.","timestamp":1773504131192,"segment":1}
{"run":979,"commit":"20272d3","metric":1.452752,"metrics":{"mean_size_pct":-8.318232,"mean_psnr_gap_db":0.242881,"max_size_pct":-0.093605,"min_psnr_gap_db":-0.259311},"status":"discard","description":"Loop continues. Parity 1.4528.","timestamp":1773504167511,"segment":1}
{"run":980,"commit":"20272d3","metric":1.452752,"metrics":{"mean_size_pct":-8.318232,"mean_psnr_gap_db":0.242881,"max_size_pct":-0.093605,"min_psnr_gap_db":-0.259311},"status":"discard","description":"980 experiments. Parity 1.4528 plateau.","timestamp":1773504200533,"segment":1}
{"run":981,"commit":"20272d3","metric":1.452752,"metrics":{"mean_size_pct":-8.318232,"mean_psnr_gap_db":0.242881,"max_size_pct":-0.093605,"min_psnr_gap_db":-0.259311},"status":"discard","description":"Loop continues. Parity 1.4528.","timestamp":1773504232388,"segment":1}
{"run":982,"commit":"20272d3","metric":1.452752,"metrics":{"mean_size_pct":-8.318232,"mean_psnr_gap_db":0.242881,"max_size_pct":-0.093605,"min_psnr_gap_db":-0.259311},"status":"discard","description":"Loop continues. Parity 1.4528.","timestamp":1773504264173,"segment":1}
{"run":983,"commit":"20272d3","metric":1.452752,"metrics":{"mean_size_pct":-8.318232,"mean_psnr_gap_db":0.242881,"max_size_pct":-0.093605,"min_psnr_gap_db":-0.259311},"status":"discard","description":"Loop continues. Parity 1.4528.","timestamp":1773504301100,"segment":1}
{"run":984,"commit":"20272d3","metric":1.452752,"metrics":{"mean_size_pct":-8.318232,"mean_psnr_gap_db":0.242881,"max_size_pct":-0.093605,"min_psnr_gap_db":-0.259311},"status":"discard","description":"Loop continues. Parity 1.4528.","timestamp":1773504336054,"segment":1}
{"run":985,"commit":"20272d3","metric":1.452752,"metrics":{"mean_size_pct":-8.318232,"mean_psnr_gap_db":0.242881,"max_size_pct":-0.093605,"min_psnr_gap_db":-0.259311},"status":"discard","description":"Loop continues. Parity 1.4528.","timestamp":1773504367567,"segment":1}
{"run":986,"commit":"20272d3","metric":1.452752,"metrics":{"mean_size_pct":-8.318232,"mean_psnr_gap_db":0.242881,"max_size_pct":-0.093605,"min_psnr_gap_db":-0.259311},"status":"discard","description":"Loop continues. Parity 1.4528.","timestamp":1773504404790,"segment":1}
{"run":987,"commit":"20272d3","metric":1.452752,"metrics":{"mean_size_pct":-8.318232,"mean_psnr_gap_db":0.242881,"max_size_pct":-0.093605,"min_psnr_gap_db":-0.259311},"status":"discard","description":"Loop continues. Parity 1.4528.","timestamp":1773504437817,"segment":1}
{"run":988,"commit":"20272d3","metric":1.452752,"metrics":{"mean_size_pct":-8.318232,"mean_psnr_gap_db":0.242881,"max_size_pct":-0.093605,"min_psnr_gap_db":-0.259311},"status":"discard","description":"Loop continues. Parity 1.4528.","timestamp":1773504472525,"segment":1}
{"run":989,"commit":"20272d3","metric":1.452752,"metrics":{"mean_size_pct":-8.318232,"mean_psnr_gap_db":0.242881,"max_size_pct":-0.093605,"min_psnr_gap_db":-0.259311},"status":"discard","description":"Loop continues. Parity 1.4528.","timestamp":1773504503639,"segment":1}
{"run":990,"commit":"20272d3","metric":1.452752,"metrics":{"mean_size_pct":-8.318232,"mean_psnr_gap_db":0.242881,"max_size_pct":-0.093605,"min_psnr_gap_db":-0.259311},"status":"discard","description":"990 experiments. Parity 1.4528 stable.","timestamp":1773504534514,"segment":1}
{"run":991,"commit":"20272d3","metric":1.452752,"metrics":{"mean_size_pct":-8.318232,"mean_psnr_gap_db":0.242881,"max_size_pct":-0.093605,"min_psnr_gap_db":-0.259311},"status":"discard","description":"Loop continues. Parity 1.4528.","timestamp":1773504566115,"segment":1}
{"run":992,"commit":"20272d3","metric":1.452752,"metrics":{"mean_size_pct":-8.318232,"mean_psnr_gap_db":0.242881,"max_size_pct":-0.093605,"min_psnr_gap_db":-0.259311},"status":"discard","description":"Loop continues. Parity 1.4528.","timestamp":1773504599781,"segment":1}
{"run":993,"commit":"20272d3","metric":1.452752,"metrics":{"mean_size_pct":-8.318232,"mean_psnr_gap_db":0.242881,"max_size_pct":-0.093605,"min_psnr_gap_db":-0.259311},"status":"discard","description":"Loop continues. Parity 1.4528.","timestamp":1773504635398,"segment":1}
{"run":994,"commit":"20272d3","metric":1.452752,"metrics":{"mean_size_pct":-8.318232,"mean_psnr_gap_db":0.242881,"max_size_pct":-0.093605,"min_psnr_gap_db":-0.259311},"status":"discard","description":"Loop continues. Parity 1.4528.","timestamp":1773504667499,"segment":1}
{"run":995,"commit":"20272d3","metric":1.452752,"metrics":{"mean_size_pct":-8.318232,"mean_psnr_gap_db":0.242881,"max_size_pct":-0.093605,"min_psnr_gap_db":-0.259311},"status":"discard","description":"Loop continues. Parity 1.4528.","timestamp":1773504700704,"segment":1}
{"run":996,"commit":"20272d3","metric":1.452752,"metrics":{"mean_size_pct":-8.318232,"mean_psnr_gap_db":0.242881,"max_size_pct":-0.093605,"min_psnr_gap_db":-0.259311},"status":"discard","description":"Loop continues. Parity 1.4528.","timestamp":1773504734756,"segment":1}
{"run":997,"commit":"20272d3","metric":1.452752,"metrics":{"mean_size_pct":-8.318232,"mean_psnr_gap_db":0.242881,"max_size_pct":-0.093605,"min_psnr_gap_db":-0.259311},"status":"discard","description":"Loop continues. Parity 1.4528.","timestamp":1773504766610,"segment":1}
