{"type":"config","name":"Encoder parity vs libjxl (size+PSNR)","metricName":"parity_score","metricUnit":"","bestDirection":"lower"}
{"run":1,"commit":"1e14f45","metric":999999,"metrics":{},"status":"crash","description":"Baseline run exposed harness bug: autoresearch.sh fed JPEG inputs directly to jxle (expects PPM/PNG), returning fallback parity_score=999999.","timestamp":1773385322358,"segment":0}
{"run":2,"commit":"d45f3bc","metric":243.536916,"metrics":{},"status":"keep","description":"Fix autoresearch harness to convert JPEG corpus inputs to PPM for jxle and compute real parity metrics; baseline parity_score now 243.54 (mean size -36.84%, mean PSNR gap -12.18 dB).","timestamp":1773385386454,"segment":0}
{"run":3,"commit":"d45f3bc","metric":24.106948,"metrics":{},"status":"keep","description":"Make libjxl comparison fair for JPEG inputs by forcing lossy mode (--lossless_jpeg=0) in autoresearch harness; parity_score drops to 24.11 with realistic size/PSNR gaps (mean size +8.97%, mean PSNR gap -0.67 dB).","timestamp":1773385434349,"segment":0}
{"run":4,"commit":"793bcf4","metric":24.106948,"metrics":{},"status":"keep","description":"Fix benchmark fairness: force lossy libjxl comparison on JPEG inputs (--lossless_jpeg=0) in autoresearch harness, reducing parity_score to 24.11.","timestamp":1773385509402,"segment":0}
{"run":5,"commit":"793bcf4","metric":24.106948,"metrics":{},"status":"discard","description":"Tried adding a light AC quantization dead-zone (|v|<0.22->0) in quantize_ac to reduce token noise. No measurable parity_score change on corpus.","timestamp":1773385569526,"segment":0}
{"run":6,"commit":"793bcf4","metric":24.106948,"metrics":{},"status":"discard","description":"Tried widening effort-7 candidate budget (max_total_encodes 36->64) to improve parity choices. No measurable change on parity corpus.","timestamp":1773385623888,"segment":0}
{"run":7,"commit":"793bcf4","metric":24.106948,"metrics":{},"status":"crash","description":"Detected harness flaw: autoresearch.sh reused stale release binaries and did not rebuild after source edits, invalidating experiments with unchanged metrics.","timestamp":1773385674923,"segment":0}
{"run":8,"commit":"a471b5d","metric":21.118251,"metrics":{},"status":"keep","description":"Fix harness invalidation by rebuilding jxle/jxl_cli on every autoresearch run; new measured baseline parity_score is 21.12 (mean size +11.79%, mean PSNR gap -0.25 dB).","timestamp":1773385768222,"segment":0}
{"run":9,"commit":"a471b5d","metric":24.106948,"metrics":{},"status":"discard","description":"Tried lowering AQ quant_ac scaling from 1.25 to 1.15 (closer to libjxl constants). Result regressed parity_score to 24.11 with larger PSNR deficit.","timestamp":1773386005372,"segment":0}
{"run":10,"commit":"a471b5d","metric":0,"metrics":{},"status":"crash","description":"Tried forcing flat-graphic path to uniform quant candidate only; run crashed (parity_score fallback 999999), indicating encoder/decode failure in harness.","timestamp":1773386115410,"segment":0}
{"run":11,"commit":"a471b5d","metric":21.118251,"metrics":{},"status":"discard","description":"Tried fairness tweak feeding cjxl from converted PPM instead of JPEG path. Metrics unchanged vs current best, so no parity gain.","timestamp":1773386197738,"segment":0}
{"run":12,"commit":"a471b5d","metric":21.18464,"metrics":{},"status":"discard","description":"Tried always enabling gaborish signaling (remove flat-graphic gab disable). Slight parity regression: parity_score 21.18 (worse size, minimal PSNR change).","timestamp":1773386320961,"segment":0}
{"run":13,"commit":"a471b5d","metric":21.18464,"metrics":{},"status":"discard","description":"Tried libjxl-style non-gaborish IQF distance scaling, but experiment remained on regressed gaborish branch state and parity stayed worse (21.18). Discarding.","timestamp":1773386402194,"segment":0}
{"run":14,"commit":"a471b5d","metric":21.118251,"metrics":{},"status":"discard","description":"Tried neutralizing X/B dequant multipliers for detected flat graphics (x_dm=1.0,b_dm=1.0). No parity_score change; large encode-time secondary regression.","timestamp":1773386528863,"segment":0}
{"run":15,"commit":"a471b5d","metric":21.30573,"metrics":{},"status":"discard","description":"Tried stronger AQ scaling (quant_ac factor 1.35). It over-spent bits: mean size gap rose to +13.68% despite PSNR improvement, worsening parity_score to 21.31.","timestamp":1773386730653,"segment":0}
{"run":16,"commit":"a471b5d","metric":21.118251,"metrics":{},"status":"discard","description":"Baseline verification run confirming parity_score=21.12 at current HEAD. No changes.","timestamp":1773387556302,"segment":0}
{"run":17,"commit":"df2e38b","metric":21.006011,"metrics":{},"status":"keep","description":"Switch single-pass HybridUint from (4,1,2) to (4,2,0) matching libjxl default. Small but consistent size reduction across corpus; parity_score 21.12->21.01.","timestamp":1773387864622,"segment":0}
{"run":18,"commit":"df2e38b","metric":21.937161,"metrics":{},"status":"discard","description":"Tried recalculating uniform candidate base_raw_quant relative to actual global_scale (0.39/d path). Regressed parity_score to 21.94 - the old inconsistent rq was accidentally beneficial.","timestamp":1773388067310,"segment":0}
{"run":19,"commit":"df2e38b","metric":32.615555,"metrics":{},"status":"discard","description":"Tried using 0.79/d for AQ global_scale (matching libjxl Falcon fast path). Severe parity regression (32.62) due to coarser raw_quant resolution destroying AQ map precision.","timestamp":1773388135183,"segment":0}
{"run":20,"commit":"df2e38b","metric":33.59019,"metrics":{},"status":"discard","description":"Tried removing AQ scaling (quant_ac=0.765/d, no 1.25x factor). Files smaller (-3.9% mean) but PSNR gap much worse (-1.32 dB), parity_score regressed to 33.59.","timestamp":1773388226493,"segment":0}
{"run":21,"commit":"df2e38b","metric":21.006011,"metrics":{},"status":"discard","description":"Removed dead-zone (|v|<0.22) from quantize_ac, relying on standard 0.5 rounding. No measurable change - dead-zone was already subsumed by round().","timestamp":1773388371793,"segment":0}
{"run":22,"commit":"df2e38b","metric":32.419558,"metrics":{},"status":"discard","description":"Tried overriding global_scale for flat graphics to match libjxl Falcon, but adaptive_map raw_quant values became inconsistent, causing severe PSNR regression (-4.65 dB worst case).","timestamp":1773388593126,"segment":0}
{"run":23,"commit":"44ae89f","metric":20.983546,"metrics":{},"status":"keep","description":"Switch modular DC HybridUint from (4,1,2) to (4,2,0) matching libjxl default. Small but consistent size win; parity_score 21.01->20.98, Webkit max_size_pct 35.47->35.39.","timestamp":1773388943854,"segment":0}
{"run":24,"commit":"44ae89f","metric":20.991731,"metrics":{},"status":"discard","description":"Tried matching libjxl's distance-dependent EPF iters (1 for gab, 0 for flat). Marginal parity regression: 20.98->20.99. Current quantization tuning benefits from epf_iters=2.","timestamp":1773389283097,"segment":0}
{"run":25,"commit":"44ae89f","metric":20.983546,"metrics":{},"status":"discard","description":"Added DCT8x8-only as explicit transform candidate (matching libjxl Falcon). No measurable parity change -- already included via build_default_transform_map in candidates.","timestamp":1773389371836,"segment":0}
{"run":26,"commit":"44ae89f","metric":21.264709,"metrics":{},"status":"discard","description":"Tried AQ scaling factor 1.20 (from 1.25). Better size (-10.2%) but worse PSNR (-0.45 dB), parity_score 21.26 (worse). The 20x PSNR weight dominates.","timestamp":1773389455214,"segment":0}
{"run":27,"commit":"44ae89f","metric":21.207562,"metrics":{},"status":"discard","description":"Tried AQ scaling factor 1.30 (from 1.25). PSNR now slightly positive (+0.03 dB mean) but size overhead increased to 12.80%. Net parity_score 21.21 (worse than 20.98).","timestamp":1773389522398,"segment":0}
{"run":28,"commit":"4c1f441","metric":20.805312,"metrics":{},"status":"keep","description":"Use --bare codestream output (skip JXL container) for fair size comparison with libjxl. Saves ~40 bytes per file; parity_score 20.98->20.81, Webkit gap 35.39->34.60.","timestamp":1773389669081,"segment":0}
{"run":29,"commit":"4c1f441","metric":20.853727,"metrics":{},"status":"discard","description":"Tried changing HF metadata HybridUint from (4,1,2) to (4,2,0). Slight regression (20.81->20.85) - the original config is better for HF metadata content.","timestamp":1773389739277,"segment":0}
{"run":30,"commit":"4c1f441","metric":0,"metrics":{},"status":"crash","description":"Tried using encode_modular_signed_stream for HF metadata (flat 1D). Crashed - decoder expects proper channel layout, not 1D stream.","timestamp":1773389845041,"segment":0}
{"run":31,"commit":"4c1f441","metric":0,"metrics":{},"status":"crash","description":"Tried reducing num_contexts from 15 to 1 for flat images. Crash: context indices must match decoder's block context map expectations.","timestamp":1773390137251,"segment":0}
{"run":32,"commit":"4c1f441","metric":20.805312,"metrics":{},"status":"discard","description":"Added per-channel predictor selection via multi-leaf tree for modular DC encoding. No improvement -- single histogram context doesn't capture per-channel statistics.","timestamp":1773390412893,"segment":0}
{"run":33,"commit":"4c1f441","metric":125.322435,"metrics":{},"status":"crash","description":"Tried adding Average predictor (6) for modular DC. Severe PSNR regression (-26 dB) - predictor 6 semantics don't match between encoder/decoder implementations.","timestamp":1773390510055,"segment":0}
{"run":34,"commit":"4c1f441","metric":20.805312,"metrics":{},"status":"discard","description":"Baseline re-check after context compaction. Current best: parity_score=20.81, mean_size_pct=+11.47%, mean_psnr_gap=-0.25dB, max_size_pct=34.60% (Webkit).","timestamp":1773390664043,"segment":0}
{"run":35,"commit":"f3b1f2d","metric":13.865822,"metrics":{},"status":"keep","description":"Add ANS entropy coding for modular DC streams, competing against Huffman per-predictor. Massive improvement: parity_score 20.81->13.87, mean_size_pct 11.47%->3.04%, max_size_pct 34.60%->8.29%.","timestamp":1773390903881,"segment":0}
{"run":36,"commit":"89827cc","metric":13.819813,"metrics":{},"status":"keep","description":"Add ANS entropy coding for HF metadata modular sections, competing vs Huffman. parity_score 13.87->13.82, mean_size_pct 3.04%->0.89%. Most images now within 1% of libjxl size.","timestamp":1773391049297,"segment":0}
{"run":37,"commit":"7e27946","metric":10.170764,"metrics":{},"status":"keep","description":"Add softer uniform quant candidate (base_raw_quant-1). parity_score 13.82->10.17, mean_size -3.80%, max_size +0.64%. Photos now at parity or smaller. Webkit PSNR (-1.87dB) still dominates.","timestamp":1773391469385,"segment":0}
{"run":38,"commit":"7e27946","metric":31.24719,"metrics":{},"status":"discard","description":"Added base_raw_quant-2 uniform candidate. Severe regression -- too aggressive quant wins size-only competition, destroying PSNR across all images.","timestamp":1773391552213,"segment":0}
{"run":39,"commit":"89827cc","metric":10.239462,"metrics":{},"status":"discard","description":"Match libjxl EPF iters (2->1 at d=1.0). Slight regression: PSNR gap worsened -0.433->-0.439 because our quant was tuned assuming epf_iters=2 smoothing.","timestamp":1773391947179,"segment":0}
{"run":40,"commit":"89827cc","metric":10.170764,"metrics":{},"status":"discard","description":"Force rq=1 for flat graphics. Same parity_score (10.17). The PSNR gap persists even at minimum quant, meaning the gap is NOT from quantization but from XYB/transform/EPF chain.","timestamp":1773392111603,"segment":0}
{"run":41,"commit":"89827cc","metric":10.170764,"metrics":{},"status":"discard","description":"Remove AC dead-zone (v.abs() < 0.22). No change -- dead-zone was already subsumed by rounding.","timestamp":1773392422334,"segment":0}
{"run":42,"commit":"89827cc","metric":25.029485,"metrics":{},"status":"discard","description":"Changed AQ global_scale from 0.39/d to 0.79/d. Severe regression -- unbalanced DC quant and AQ map conversion across all images.","timestamp":1773392754813,"segment":0}
{"run":43,"commit":"89827cc","metric":12.744734,"metrics":{},"status":"discard","description":"Reduced AQ scale 1.25->1.15. Regression: photo PSNR worsened (-0.43->-0.56 mean) without helping Webkit.","timestamp":1773392871767,"segment":0}
{"run":44,"commit":"89827cc","metric":10.170764,"metrics":{},"status":"discard","description":"Increased AQ scale 1.25->1.35. No change -- softer_rq candidate already dominates for all images.","timestamp":1773392969759,"segment":0}
{"run":45,"commit":"89827cc","metric":53.258608,"metrics":{},"status":"discard","description":"Force Falcon-style separate encode for flat graphics. Massive regression -- 163% size overhead and PSNR worse. The separate path's quant calibration is completely wrong.","timestamp":1773393664144,"segment":0}
{"run":46,"commit":"89827cc","metric":21.251345,"metrics":{},"status":"discard","description":"Use Falcon global_scale for flat graphics. Regression - PSNR degraded to -4.64 dB, worse than before. Quant calibration fundamentally mismatched.","timestamp":1773393818644,"segment":0}
{"run":47,"commit":"89827cc","metric":11.937574,"metrics":{},"status":"discard","description":"Reduced AQ scale from 1.25 to 1.20. Regression: PSNR gap widened -0.43->-0.52 outweighing size gains.","timestamp":1773393892567,"segment":0}
{"run":48,"commit":"89827cc","metric":10.170764,"metrics":{},"status":"discard","description":"AQ scale 1.30. No change -- uniform rq=5 candidate always wins regardless of AQ scaling.","timestamp":1773393988030,"segment":0}
{"run":49,"commit":"89827cc","metric":13.819813,"metrics":{},"status":"discard","description":"Removed softer_rq candidate. PSNR improved -0.43->-0.25 but size regressed -3.80%->+0.89%. Net regression.","timestamp":1773394068456,"segment":0}
{"run":50,"commit":"89827cc","metric":30.139477,"metrics":{},"status":"discard","description":"Changed global_scale computation from 0.39/d to 0.55/d. Severe PSNR regression (-5.8 dB worst). The intermediate value still breaks AQ calibration.","timestamp":1773394197381,"segment":0}
{"run":51,"commit":"89827cc","metric":10.170764,"metrics":{},"status":"discard","description":"Competitive HybridUint config selection for modular ANS (tried 4 configs). No improvement -- (4,2,0) already optimal. Added 2s encode overhead.","timestamp":1773394329736,"segment":0}
{"run":52,"commit":"89827cc","metric":11.55968,"metrics":{},"status":"discard","description":"Changed x_qm_scale from 3 to 2 (neutral X channel weighting). Regression -- photo PSNR worsened (-0.43->-0.53) as quality balance shifted unfavorably.","timestamp":1773394545136,"segment":0}
{"run":53,"commit":"89827cc","metric":21.251345,"metrics":{},"status":"discard","description":"Falcon global_scale for flat graphics (v2). Regression confirmed after rebuild: -4.64 dB worst PSNR.","timestamp":1773395020669,"segment":0}
{"run":54,"commit":"89827cc","metric":21.251345,"metrics":{},"status":"discard","description":"Falcon path for flat graphics (v3, clean rebuild). Still regression to 21.25. The Falcon global_scale produces systematically worse PSNR despite finer AC steps.","timestamp":1773395164377,"segment":0}
{"run":55,"commit":"89827cc","metric":54.707844,"metrics":{},"status":"crash","description":"Added Select(4) and Average(3) predictors for modular DC. Severe PSNR regression (-11 dB) -- predictor implementations don't match decoder.","timestamp":1773395327385,"segment":0}
{"run":56,"commit":"500ea86","metric":10.039555,"metrics":{"mean_size_pct":-5.026199,"mean_psnr_gap_db":-0.433463,"max_size_pct":-0.28989,"min_psnr_gap_db":-1.874186},"status":"keep","description":"Add per-channel ANS histograms for modular DC (multi-leaf tree splitting by channel). parity_score 10.17->10.04, all images now smaller than libjxl (max_size -0.29%).","timestamp":1773396112962,"segment":0}
{"run":57,"commit":"500ea86","metric":13.36014,"metrics":{"mean_size_pct":-0.336898,"mean_psnr_gap_db":-0.250635,"max_size_pct":7.476251,"min_psnr_gap_db":-1.874186},"status":"discard","description":"Removed aggressive rq=5 candidate. PSNR improved (-0.43 -> -0.25 dB) but size regressed (+7.48% max), net worse.","timestamp":1773396272297,"segment":0}
{"run":58,"commit":"500ea86","metric":10.039555,"metrics":{"mean_size_pct":-5.026199,"mean_psnr_gap_db":-0.433463,"max_size_pct":-0.28989,"min_psnr_gap_db":-1.874186},"status":"discard","description":"Added rq=7 (finer quant) as additional candidate alongside rq=5,6. Never wins (rq=5 always smallest), only adds encode time.","timestamp":1773396373935,"segment":0}
{"run":59,"commit":"500ea86","metric":10.039555,"metrics":{"mean_size_pct":-5.026608,"mean_psnr_gap_db":-0.433463,"max_size_pct":-0.28989,"min_psnr_gap_db":-1.874186},"status":"discard","description":"Competitive HybridUint config (4,1,2 vs 4,2,0) for HF metadata. Negligible improvement (0.0004%).","timestamp":1773396501965,"segment":0}
{"run":60,"commit":"500ea86","metric":10.039555,"metrics":{"mean_size_pct":-5.026199,"mean_psnr_gap_db":-0.433463,"max_size_pct":-0.28989,"min_psnr_gap_db":-1.874186},"status":"discard","description":"Added rq=50 candidate for flat graphics. Competition still picks rq=5 (smallest file) -- per-size competition can't optimize PSNR.","timestamp":1773396588136,"segment":0}
{"run":61,"commit":"500ea86","metric":10.039555,"metrics":{"mean_size_pct":-5.026199,"mean_psnr_gap_db":-0.433463,"max_size_pct":-0.28989,"min_psnr_gap_db":-1.874186},"status":"discard","description":"Forced rq=10 for flat graphics. No change -- AC still all zero because gs=5111 is too low. Even rq=255 can't preserve AC at this global_scale.","timestamp":1773396675486,"segment":0}
{"run":62,"commit":"500ea86","metric":10.108253,"metrics":{"mean_size_pct":-5.026199,"mean_psnr_gap_db":-0.438544,"max_size_pct":-0.28989,"min_psnr_gap_db":-1.874186},"status":"discard","description":"Changed EPF iters from 2 to 1 (matching libjxl Falcon thresholds). Slight regression -- quant was tuned for 2 EPF iters, photos slightly worse with 1.","timestamp":1773397399332,"segment":0}
{"run":63,"commit":"3475edd","metric":10.039555,"metrics":{"mean_size_pct":-5.207695,"mean_psnr_gap_db":-0.433463,"max_size_pct":-0.28989,"min_psnr_gap_db":-1.874186},"status":"keep","description":"Add Select predictor (4) for modular DC encoding, matching decoder exactly. Small size improvement (mean_size -5.03% -> -5.21%), same parity score.","timestamp":1773398514068,"segment":0}
{"run":64,"commit":"41bd58f","metric":10.039555,"metrics":{"mean_size_pct":-5.243141,"mean_psnr_gap_db":-0.433463,"max_size_pct":-0.28989,"min_psnr_gap_db":-1.874186},"status":"keep","description":"Add AverageWestAndNorth predictor (3) for modular DC. Tiny size improvement (mean_size -5.21% -> -5.24%), same parity score.","timestamp":1773398592650,"segment":0}
{"run":65,"commit":"da94d3f","metric":3.491286,"metrics":{"mean_size_pct":1.294485,"mean_psnr_gap_db":0.697267,"max_size_pct":3.076946,"min_psnr_gap_db":-0.305459},"status":"keep","description":"Implement extra_dc_precision=2 for all images. DC quantization 4x finer. MASSIVE improvement: parity 10.04->3.49. Webkit penalty eliminated (48.35 vs 44.77 dB). Photos slightly larger (+3% max). Fixed multi-group bug where extra_precision header was not written.","timestamp":1773400261230,"segment":0}
{"run":81,"commit":"354169f","metric":2.463205,"metrics":{"mean_size_pct":-3.135391,"mean_psnr_gap_db":0.215659,"max_size_pct":1.345213,"min_psnr_gap_db":-0.315748},"status":"keep","description":"Baseline on jxl-encoder branch after cherry-picks. Fix quant_ac 1.15->1.25. parity=2.46.","timestamp":1773402550899,"segment":0}
{"run":82,"commit":"354169f","metric":27.582165,"metrics":{"mean_size_pct":25.057012,"mean_psnr_gap_db":2.674796,"max_size_pct":37.328588,"min_psnr_gap_db":1.207485},"status":"discard","description":"RD-aware competition with exponent=2 + finer_rq=10 candidate. Massive regression: files 37% larger. Quality discount too aggressive, finer_rq always wins despite bloat. Revert.","timestamp":1773402846738,"segment":0}
{"run":83,"commit":"354169f","metric":3.201231,"metrics":{"mean_size_pct":-2.332337,"mean_psnr_gap_db":0.206139,"max_size_pct":2.240352,"min_psnr_gap_db":-0.392184},"status":"discard","description":"Bias-aware AC quantization accounting for decoder AdjustQuantBias. Regression: parity 2.46->3.20. Bias correction shifts quantization decisions for small coefficients, making files larger (+2.24% max) without PSNR improvement. Revert.","timestamp":1773403092172,"segment":0}
{"run":84,"commit":"731327a","metric":2.372932,"metrics":{"mean_size_pct":-3.134393,"mean_psnr_gap_db":0.215659,"max_size_pct":0.939671,"min_psnr_gap_db":-0.315748},"status":"keep","description":"Disable custom coefficient orders at effort 7. Reduces header overhead: parity 2.46->2.37, max_size 1.35%->0.94%. PSNR unchanged.","timestamp":1773403514322,"segment":0}
{"run":85,"commit":"731327a","metric":2.393129,"metrics":{"mean_size_pct":-3.018066,"mean_psnr_gap_db":0.22611,"max_size_pct":1.047714,"min_psnr_gap_db":-0.295696},"status":"discard","description":"Disable entropy merge. Slight regression: parity 2.37->2.39. Merge helps both size and PSNR. Re-enable.","timestamp":1773403565104,"segment":0}
{"type":"config","name":"Close parity gaps - focus on PSNR (kodim08/kodim13)","metricName":"parity_score","metricUnit":"","bestDirection":"lower"}
{"run":1,"commit":"55cbf61","metric":2.382,"metrics":{},"status":"keep","description":"Baseline: rayon parallel merge + LUT XYB + byte-identical scalar/SIMD","timestamp":1773440377417,"segment":0}
