{"run":794,"commit":"a3e4010","metric":1.693772,"metrics":{"mean_size_pct":-7.790251,"mean_psnr_gap_db":0.328066,"max_size_pct":0.088854,"min_psnr_gap_db":-0.279138},"status":"discard","description":"b_dm=0.88 (was 0.94). Worse: size overshoots zoltan +0.089%, parity 1.595->1.694.","timestamp":1773488894871,"segment":1}
{"run":795,"commit":"a3e4010","metric":1.595164,"metrics":{"mean_size_pct":-7.874467,"mean_psnr_gap_db":0.340219,"max_size_pct":-0.028034,"min_psnr_gap_db":-0.273496},"status":"discard","description":"EPF Y=7.0 (was 6.0). Essentially same parity 1.5952 vs 1.5950. Marginal.","timestamp":1773488965696,"segment":1}
{"run":796,"commit":"fda5506","metric":1.594249,"metrics":{"mean_size_pct":-7.874467,"mean_psnr_gap_db":0.34311,"max_size_pct":-0.028034,"min_psnr_gap_db":-0.273812},"status":"keep","description":"EPF Y=4.0 (was 6.0). Very tiny improvement: parity 1.5950->1.5942. Mean PSNR +0.343 (was +0.341).","timestamp":1773489016387,"segment":1}
{"run":797,"commit":"fda5506","metric":1.595283,"metrics":{"mean_size_pct":-7.874467,"mean_psnr_gap_db":0.34395,"max_size_pct":-0.028034,"min_psnr_gap_db":-0.274247},"status":"discard","description":"EPF Y=3.0 (was 4.0). Slightly worse parity 1.5953 vs 1.5942. Y=4.0 is optimal.","timestamp":1773489070067,"segment":1}
{"run":798,"commit":"fda5506","metric":1.594339,"metrics":{"mean_size_pct":-7.874467,"mean_psnr_gap_db":0.342666,"max_size_pct":-0.028034,"min_psnr_gap_db":-0.273658},"status":"discard","description":"EPF Y=4.5. Very slightly worse than Y=4.0 (1.5943 vs 1.5942). Y=4.0 confirmed optimal.","timestamp":1773489118181,"segment":1}
{"run":799,"commit":"fda5506","metric":1.613616,"metrics":{"mean_size_pct":-7.874467,"mean_psnr_gap_db":0.345486,"max_size_pct":-0.028034,"min_psnr_gap_db":-0.274983},"status":"discard","description":"EPF X=4.5 (was 5.5). Worse parity 1.614 vs 1.594. Too little X smoothing hurts.","timestamp":1773489183115,"segment":1}
{"run":800,"commit":"fda5506","metric":1.601416,"metrics":{"mean_size_pct":-7.874467,"mean_psnr_gap_db":0.34089,"max_size_pct":-0.028034,"min_psnr_gap_db":-0.274957},"status":"discard","description":"EPF X=6.0 (was 5.5). Slightly worse parity 1.601 vs 1.594. X=5.5 confirmed optimal with Y=4.0.","timestamp":1773489233540,"segment":1}
{"run":801,"commit":"480be7d","metric":1.587333,"metrics":{"mean_size_pct":-7.874467,"mean_psnr_gap_db":0.347287,"max_size_pct":-0.028034,"min_psnr_gap_db":-0.272386},"status":"keep","description":"EPF B=1.5 (was 2.0) with Y=4.0. New best parity 1.594->1.587. More B smoothing helps with lower Y.","timestamp":1773489296806,"segment":1}
{"run":802,"commit":"480be7d","metric":1.595492,"metrics":{"mean_size_pct":-7.874467,"mean_psnr_gap_db":0.350982,"max_size_pct":-0.028034,"min_psnr_gap_db":-0.272385},"status":"discard","description":"EPF B=1.0 (was 1.5). Worse parity 1.595 vs 1.587. Over-smoothing B channel with Y=4.0.","timestamp":1773489347203,"segment":1}
{"run":803,"commit":"480be7d","metric":1.589688,"metrics":{"mean_size_pct":-7.874467,"mean_psnr_gap_db":0.345103,"max_size_pct":-0.028034,"min_psnr_gap_db":-0.272944},"status":"discard","description":"EPF B=1.75. Slightly worse than B=1.5 (1.590 vs 1.587). B=1.5 optimal with Y=4.0.","timestamp":1773489401892,"segment":1}
{"run":804,"commit":"480be7d","metric":1.588706,"metrics":{"mean_size_pct":-7.861355,"mean_psnr_gap_db":0.345792,"max_size_pct":-0.009503,"min_psnr_gap_db":-0.272768},"status":"discard","description":"b_dm=0.93 with new EPF (Y=4,B=1.5). Slightly worse parity 1.589 vs 1.587. Size headroom tighter (-0.01%).","timestamp":1773489466160,"segment":1}
{"run":805,"commit":"480be7d","metric":1.597182,"metrics":{"mean_size_pct":-7.88146,"mean_psnr_gap_db":0.347805,"max_size_pct":-0.040388,"min_psnr_gap_db":-0.273628},"status":"discard","description":"b_dm=0.95 with new EPF. Worse parity 1.597 vs 1.587. Less B quantization but more size headroom unused.","timestamp":1773489520623,"segment":1}
{"run":806,"commit":"480be7d","metric":1.636388,"metrics":{"mean_size_pct":-7.801458,"mean_psnr_gap_db":0.344693,"max_size_pct":0.172481,"min_psnr_gap_db":-0.274265},"status":"discard","description":"x_dm*0.96 with new EPF. Worse: overshoots zoltan size +0.17%. x_dm*0.97 stays optimal.","timestamp":1773489577229,"segment":1}
{"run":807,"commit":"480be7d","metric":1.59522,"metrics":{"mean_size_pct":-7.935171,"mean_psnr_gap_db":0.349627,"max_size_pct":-0.198614,"min_psnr_gap_db":-0.273623},"status":"discard","description":"x_dm*0.98 with new EPF. Worse parity 1.595 vs 1.587. More size headroom wasted.","timestamp":1773489632194,"segment":1}
{"run":808,"commit":"4f82c04","metric":1.579883,"metrics":{"mean_size_pct":-7.867185,"mean_psnr_gap_db":0.344303,"max_size_pct":-0.00095,"min_psnr_gap_db":-0.272443},"status":"keep","description":"CfL TOWARDS_ZERO=3.0 (was 2.965) with EPF Y=4/B=1.5. New best parity 1.587->1.580. Size margin very tight -0.001%.","timestamp":1773489692444,"segment":1}
{"run":809,"commit":"870de5d","metric":1.567853,"metrics":{"mean_size_pct":-7.862361,"mean_psnr_gap_db":0.342676,"max_size_pct":0.006652,"min_psnr_gap_db":-0.272623},"status":"keep","description":"CfL TOWARDS_ZERO=3.05. Parity 1.580->1.568. One image barely overshoots size (+0.007%) but overall gain.","timestamp":1773489760729,"segment":1}
{"run":810,"commit":"870de5d","metric":1.572982,"metrics":{"mean_size_pct":-7.860446,"mean_psnr_gap_db":0.342148,"max_size_pct":0.009503,"min_psnr_gap_db":-0.271974},"status":"discard","description":"CfL TOWARDS_ZERO=3.1. Slightly worse parity 1.573 vs 1.568. More CfL zeroing but size overshoot slightly larger +0.01%.","timestamp":1773489812012,"segment":1}
{"run":811,"commit":"870de5d","metric":1.569279,"metrics":{"mean_size_pct":-7.866526,"mean_psnr_gap_db":0.344303,"max_size_pct":0,"min_psnr_gap_db":-0.272168},"status":"discard","description":"CfL TOWARDS_ZERO=3.02. Parity 1.569 vs 1.568. Worse by 0.001. Interesting: max_size=0.000% (exact match on zoltan).","timestamp":1773489862687,"segment":1}
{"run":812,"commit":"870de5d","metric":1.568569,"metrics":{"mean_size_pct":-7.861752,"mean_psnr_gap_db":0.342617,"max_size_pct":0.006652,"min_psnr_gap_db":-0.272623},"status":"discard","description":"CfL TOWARDS_ZERO=3.07. Parity 1.5686 vs 1.5679 (3.05). Marginally worse. 3.05 confirmed optimal.","timestamp":1773489917620,"segment":1}
{"run":813,"commit":"870de5d","metric":1.58447,"metrics":{"mean_size_pct":-7.933375,"mean_psnr_gap_db":0.341825,"max_size_pct":0.006652,"min_psnr_gap_db":-0.272547},"status":"discard","description":"quant_lf threshold 4000 (only Webkit gets +2, kodim gets +1). Worse parity 1.584 vs 1.568 - kodim PSNR drops without +2.","timestamp":1773489979566,"segment":1}
{"run":814,"commit":"870de5d","metric":1.589805,"metrics":{"mean_size_pct":-7.56422,"mean_psnr_gap_db":0.591031,"max_size_pct":0.116413,"min_psnr_gap_db":-0.272623},"status":"discard","description":"quant_lf+2 for ALL images. Zoltan overshoots +0.12%. Parity 1.590 vs 1.568. Mean PSNR much better but size kills it.","timestamp":1773490030763,"segment":1}
{"run":815,"commit":"870de5d","metric":1.567853,"metrics":{"mean_size_pct":-7.862361,"mean_psnr_gap_db":0.342676,"max_size_pct":0.006652,"min_psnr_gap_db":-0.272623},"status":"discard","description":"Verify current best config: Y=4.0, X=5.5, B=1.5, TOWARDS_ZERO=3.05, quant_lf thresh=7000. Parity 1.568 confirmed.","timestamp":1773490083427,"segment":1}
{"run":816,"commit":"870de5d","metric":1.570373,"metrics":{"mean_size_pct":-7.888109,"mean_psnr_gap_db":0.344175,"max_size_pct":-0.054168,"min_psnr_gap_db":-0.272508},"status":"discard","description":"x_dm*0.975 with new config. Worse parity 1.570 vs 1.568. But no size overshoot! Tradeoff not worth it.","timestamp":1773490135365,"segment":1}
{"run":817,"commit":"870de5d","metric":1.601017,"metrics":{"mean_size_pct":-7.862361,"mean_psnr_gap_db":0.343234,"max_size_pct":0.006652,"min_psnr_gap_db":-0.273764},"status":"discard","description":"EPF X=5.0 (was 5.5) with Y=4, B=1.5. Worse parity 1.601 vs 1.568. X=5.5 confirmed optimal.","timestamp":1773490197399,"segment":1}
{"run":818,"commit":"870de5d","metric":1.567853,"metrics":{"mean_size_pct":-7.862361,"mean_psnr_gap_db":0.342676,"max_size_pct":0.006652,"min_psnr_gap_db":-0.272623},"status":"discard","description":"EPF zeroflush 0.35/0.5 (was 0.45/0.6). No change - zeroflush still has zero effect on output.","timestamp":1773490261430,"segment":1}
{"run":819,"commit":"870de5d","metric":1.574385,"metrics":{"mean_size_pct":-7.862361,"mean_psnr_gap_db":0.344657,"max_size_pct":0.006652,"min_psnr_gap_db":-0.272324},"status":"discard","description":"EPF B=1.25. Worse parity 1.574 vs 1.568. B=1.5 confirmed optimal with Y=4.0.","timestamp":1773490318956,"segment":1}
{"run":820,"commit":"870de5d","metric":1.567853,"metrics":{"mean_size_pct":-7.862361,"mean_psnr_gap_db":0.342676,"max_size_pct":0.006652,"min_psnr_gap_db":-0.272623},"status":"discard","description":"Add harder rq+1 candidate. No change - harder candidate never selected (softer always wins by size-optimal RD).","timestamp":1773490403155,"segment":1}
{"run":821,"commit":"870de5d","metric":0,"metrics":{"mean_size_pct":0,"mean_psnr_gap_db":0,"max_size_pct":0,"min_psnr_gap_db":0},"status":"crash","description":"Custom EPF sigma (quant_mul=0.55). Decode failure - sigma_custom encoding incompatible with decoder.","timestamp":1773490587835,"segment":1}
{"run":822,"commit":"870de5d","metric":1.575725,"metrics":{"mean_size_pct":-7.865404,"mean_psnr_gap_db":0.343846,"max_size_pct":0.001425,"min_psnr_gap_db":-0.272955},"status":"discard","description":"CfL dist_mul 5e-3 (was 1e-3). Worse parity 1.576 vs 1.568. More regularization hurts CfL factor accuracy.","timestamp":1773490680467,"segment":1}
{"run":823,"commit":"870de5d","metric":1.671114,"metrics":{"mean_size_pct":-7.902534,"mean_psnr_gap_db":0.356347,"max_size_pct":-0.044189,"min_psnr_gap_db":-0.265883},"status":"discard","description":"B CfL shrink=2.5 (X keeps 3.05). Worse parity 1.671 vs 1.568. Less B shrinkage keeps too many nonzero CfL factors -> more entropy.","timestamp":1773490759973,"segment":1}
{"run":824,"commit":"870de5d","metric":1.630686,"metrics":{"mean_size_pct":-7.845416,"mean_psnr_gap_db":0.335412,"max_size_pct":0.035637,"min_psnr_gap_db":-0.274263},"status":"discard","description":"B CfL shrink=3.5 (X keeps 3.05). Worse parity 1.631 vs 1.568. Too much B shrinkage -> worse B prediction.","timestamp":1773490809191,"segment":1}
{"run":825,"commit":"870de5d","metric":1.567853,"metrics":{"mean_size_pct":-7.862361,"mean_psnr_gap_db":0.342676,"max_size_pct":0.006652,"min_psnr_gap_db":-0.272623},"status":"discard","description":"Verify restored best config. Parity 1.568 confirmed. Config: Y=4.0, X=5.5, B=1.5, TZ=3.05, quant_lf adaptive.","timestamp":1773490860692,"segment":1}
{"run":826,"commit":"9168f33","metric":1.504407,"metrics":{"mean_size_pct":-6.910171,"mean_psnr_gap_db":0.348789,"max_size_pct":0.006652,"min_psnr_gap_db":-0.264102},"status":"keep","description":"Adaptive ep: ep=2 for <=7000 blocks, ep=1 for larger. Kodim images get 4x finer DC, huge PSNR improvement. Parity 1.568->1.504!","timestamp":1773490923040,"segment":1}
{"run":827,"commit":"9168f33","metric":1.797197,"metrics":{"mean_size_pct":-6.617381,"mean_psnr_gap_db":0.34917,"max_size_pct":1.470602,"min_psnr_gap_db":-0.264102},"status":"discard","description":"ep threshold 8500 (includes zoltan 8300 blocks). Zoltan overshoots +1.47%! Way worse.","timestamp":1773490982997,"segment":1}
{"run":828,"commit":"9168f33","metric":1.505356,"metrics":{"mean_size_pct":-6.986697,"mean_psnr_gap_db":0.348891,"max_size_pct":0.006652,"min_psnr_gap_db":-0.264382},"status":"discard","description":"Uniform quant_lf+1 (was adaptive +2/+1). Slightly worse parity 1.505 vs 1.504. Keep adaptive quant_lf.","timestamp":1773491047981,"segment":1}
{"run":829,"commit":"fcaac67","metric":1.50082,"metrics":{"mean_size_pct":-6.840248,"mean_psnr_gap_db":0.348937,"max_size_pct":0.006652,"min_psnr_gap_db":-0.262894},"status":"keep","description":"quant_lf+3 for <=7000 blocks with ep=2. Finer DC helps: parity 1.504->1.501. Worst PSNR -0.263 (was -0.264).","timestamp":1773491111185,"segment":1}
{"run":830,"commit":"d0e27f7","metric":1.495586,"metrics":{"mean_size_pct":-6.772162,"mean_psnr_gap_db":0.349322,"max_size_pct":0.006652,"min_psnr_gap_db":-0.262082},"status":"keep","description":"quant_lf+4 for <=7000 blocks. Parity 1.501->1.496. Worst PSNR -0.262. Still improving with higher quant_lf!","timestamp":1773491164246,"segment":1}
{"run":831,"commit":"d0e27f7","metric":1.500209,"metrics":{"mean_size_pct":-6.64605,"mean_psnr_gap_db":0.349701,"max_size_pct":0.035598,"min_psnr_gap_db":-0.26245},"status":"discard","description":"quant_lf+6 for <=7000. Parity 1.500 vs 1.496. Slightly worse - size overshoot +0.036% outweighs PSNR gain. +4 is optimal.","timestamp":1773491217637,"segment":1}
{"run":832,"commit":"d0e27f7","metric":1.499615,"metrics":{"mean_size_pct":-6.707189,"mean_psnr_gap_db":0.349478,"max_size_pct":0.006652,"min_psnr_gap_db":-0.263546},"status":"discard","description":"quant_lf+5 for <=7000. Parity 1.500 vs 1.496. Slightly worse than +4 (worse worst PSNR).","timestamp":1773491270495,"segment":1}
{"run":833,"commit":"d0e27f7","metric":1.517538,"metrics":{"mean_size_pct":-6.474021,"mean_psnr_gap_db":0.597676,"max_size_pct":0.116413,"min_psnr_gap_db":-0.262082},"status":"discard","description":"quant_lf+2 for zoltan (was +1). Zoltan overshoots +0.12%. Mean PSNR much better but size kills parity.","timestamp":1773491324179,"segment":1}
{"run":834,"commit":"d0e27f7","metric":1.5017,"metrics":{"mean_size_pct":-6.772162,"mean_psnr_gap_db":0.351144,"max_size_pct":0.006652,"min_psnr_gap_db":-0.263245},"status":"discard","description":"EPF B=1.25 with ep=2. Slightly worse parity 1.502 vs 1.496. B=1.5 still optimal.","timestamp":1773491387123,"segment":1}
{"run":835,"commit":"d0e27f7","metric":1.503089,"metrics":{"mean_size_pct":-6.764092,"mean_psnr_gap_db":0.347619,"max_size_pct":0.019006,"min_psnr_gap_db":-0.263387},"status":"discard","description":"b_dm=0.93 with ep=2. Worse parity 1.503 vs 1.496. b_dm=0.94 stays optimal.","timestamp":1773491449638,"segment":1}
{"run":836,"commit":"2450ee3","metric":1.479833,"metrics":{"mean_size_pct":-6.7704,"mean_psnr_gap_db":0.348814,"max_size_pct":0.009503,"min_psnr_gap_db":-0.261399},"status":"keep","description":"CfL TOWARDS_ZERO=3.1 (was 3.05) with ep=2. New best parity 1.496->1.480! Worst PSNR -0.261 (was -0.262).","timestamp":1773491508638,"segment":1}
{"run":837,"commit":"7e828e2","metric":1.4616,"metrics":{"mean_size_pct":-6.767983,"mean_psnr_gap_db":0.347846,"max_size_pct":0.024233,"min_psnr_gap_db":-0.259996},"status":"keep","description":"CfL TOWARDS_ZERO=3.2. Parity 1.480->1.462! Worst PSNR -0.260. Still trending down!","timestamp":1773491563018,"segment":1}
{"run":838,"commit":"7e828e2","metric":1.477352,"metrics":{"mean_size_pct":-6.758561,"mean_psnr_gap_db":0.344519,"max_size_pct":0.034686,"min_psnr_gap_db":-0.26152},"status":"discard","description":"CfL TOWARDS_ZERO=3.4. Worse parity 1.477 vs 1.462. Size overshoot growing. 3.2 is optimal with ep=2.","timestamp":1773491613573,"segment":1}
{"run":839,"commit":"7e828e2","metric":1.469413,"metrics":{"mean_size_pct":-6.767832,"mean_psnr_gap_db":0.348483,"max_size_pct":0.013304,"min_psnr_gap_db":-0.259238},"status":"discard","description":"CfL TOWARDS_ZERO=3.15. Parity 1.469 vs 1.462. Between 3.1 and 3.2. 3.2 still best.","timestamp":1773491668749,"segment":1}
{"run":840,"commit":"7e828e2","metric":1.470527,"metrics":{"mean_size_pct":-6.766456,"mean_psnr_gap_db":0.347097,"max_size_pct":0.026609,"min_psnr_gap_db":-0.261062},"status":"discard","description":"CfL TOWARDS_ZERO=3.25. Parity 1.471 vs 1.462. 3.2 confirmed optimal.","timestamp":1773491720851,"segment":1}
{"run":841,"commit":"7e828e2","metric":1.484212,"metrics":{"mean_size_pct":-6.729267,"mean_psnr_gap_db":0.347277,"max_size_pct":0.117363,"min_psnr_gap_db":-0.259908},"status":"discard","description":"x_dm*0.965 with ep=2. Worse: zoltan overshoots +0.12%. x_dm*0.97 stays optimal.","timestamp":1773491779039,"segment":1}
{"run":842,"commit":"7e828e2","metric":1.4616,"metrics":{"mean_size_pct":-6.767983,"mean_psnr_gap_db":0.347846,"max_size_pct":0.024233,"min_psnr_gap_db":-0.259996},"status":"discard","description":"Verified best config. Parity 1.462 confirmed.","timestamp":1773491858933,"segment":1}
{"run":843,"commit":"7e828e2","metric":1.81222,"metrics":{"mean_size_pct":-4.807711,"mean_psnr_gap_db":0.921199,"max_size_pct":1.515267,"min_psnr_gap_db":-0.265011},"status":"discard","description":"ep=2 for ALL + TZ=3.6. Zoltan +1.52% overshoot. Even with higher CfL shrink, can't compensate ep=2 size on zoltan.","timestamp":1773491927645,"segment":1}
{"run":844,"commit":"7e828e2","metric":2.041318,"metrics":{"mean_size_pct":-5.808273,"mean_psnr_gap_db":0.349042,"max_size_pct":1.479886,"min_psnr_gap_db":-0.259392},"status":"discard","description":"ep=3 for small images. Overshoots on kodim images (+1.48%). ep=2 is the limit.","timestamp":1773492001300,"segment":1}
{"run":845,"commit":"7e828e2","metric":1.46176,"metrics":{"mean_size_pct":-6.767983,"mean_psnr_gap_db":0.34832,"max_size_pct":0.024233,"min_psnr_gap_db":-0.260037},"status":"discard","description":"EPF Y=3.5 with ep=2. Same parity 1.462 within noise. Y=4.0 stays.","timestamp":1773492059799,"segment":1}
{"run":846,"commit":"7e828e2","metric":1.4616,"metrics":{"mean_size_pct":-6.767983,"mean_psnr_gap_db":0.347846,"max_size_pct":0.024233,"min_psnr_gap_db":-0.259996},"status":"discard","description":"Best config stable at 1.462. Session progress: 1.595 -> 1.462 (-8.3%). Key wins: adaptive ep=2, TZ=3.2.","timestamp":1773492119266,"segment":1}
{"run":847,"commit":"a8f05ea","metric":1.456753,"metrics":{"mean_size_pct":-8.319619,"mean_psnr_gap_db":0.245697,"max_size_pct":-0.099307,"min_psnr_gap_db":-0.259996},"status":"keep","description":"quant_lf+0 for >7000 blocks (was +1). Zoltan saves bytes (-0.10% headroom). Parity 1.462->1.457.","timestamp":1773492181088,"segment":1}
{"run":848,"commit":"a8f05ea","metric":1.730347,"metrics":{"mean_size_pct":-4.853941,"mean_psnr_gap_db":0.720127,"max_size_pct":1.367969,"min_psnr_gap_db":-0.259996},"status":"discard","description":"ep=2 for ALL (with quant_lf+0 for large). Zoltan still overshoots +1.37%. Need ~3KB savings to make ep=2 viable for zoltan.","timestamp":1773492238049,"segment":1}
{"run":849,"commit":"a8f05ea","metric":1.462797,"metrics":{"mean_size_pct":-8.310071,"mean_psnr_gap_db":0.244074,"max_size_pct":-0.086003,"min_psnr_gap_db":-0.260561},"status":"discard","description":"b_dm=0.93 with zoltan headroom. Parity 1.463 vs 1.457. Slightly worse. b_dm=0.94 stays optimal.","timestamp":1773492297539,"segment":1}
{"run":850,"commit":"a8f05ea","metric":1.460739,"metrics":{"mean_size_pct":-8.280904,"mean_psnr_gap_db":0.245095,"max_size_pct":-0.006177,"min_psnr_gap_db":-0.259908},"status":"discard","description":"x_dm*0.965 with zoltan headroom. Parity 1.461 vs 1.457. Slightly worse. x_dm*0.97 stays optimal.","timestamp":1773492358040,"segment":1}
{"run":851,"commit":"8cc300a","metric":1.456288,"metrics":{"mean_size_pct":-8.319619,"mean_psnr_gap_db":0.244697,"max_size_pct":-0.099307,"min_psnr_gap_db":-0.259781},"status":"keep","description":"EPF Y=5.0 (was 4.0) with ep=2/qlf+4/+0. Tiny parity improvement 1.457->1.456. Better worst PSNR -0.260.","timestamp":1773492426795,"segment":1}
{"run":852,"commit":"ef95ce1","metric":1.456226,"metrics":{"mean_size_pct":-8.319619,"mean_psnr_gap_db":0.243671,"max_size_pct":-0.099307,"min_psnr_gap_db":-0.259678},"status":"keep","description":"EPF Y=6.0 (was 5.0). Another tiny improvement 1.4563->1.4562. More Y smoothing helps with ep=2/qlf+4.","timestamp":1773492478824,"segment":1}
{"run":853,"commit":"ef95ce1","metric":1.457511,"metrics":{"mean_size_pct":-8.319619,"mean_psnr_gap_db":0.24136,"max_size_pct":-0.099307,"min_psnr_gap_db":-0.25974},"status":"discard","description":"EPF Y=8.0. Slightly worse parity 1.458 vs 1.456. Y=6.0 optimal with current config.","timestamp":1773492542073,"segment":1}
{"run":854,"commit":"ef95ce1","metric":1.466727,"metrics":{"mean_size_pct":-8.319619,"mean_psnr_gap_db":0.239509,"max_size_pct":-0.099307,"min_psnr_gap_db":-0.261291},"status":"discard","description":"EPF B=2.0 retest with ep=2/qlf+4. Worse parity 1.467 vs 1.456. B=1.5 confirmed optimal across all configs.","timestamp":1773492607189,"segment":1}
{"run":855,"commit":"ef95ce1","metric":1.456226,"metrics":{"mean_size_pct":-8.319619,"mean_psnr_gap_db":0.243671,"max_size_pct":-0.099307,"min_psnr_gap_db":-0.259678},"status":"discard","description":"Final config verification. Parity 1.456 stable. All parameter-level optimizations exhausted. Need structural changes for further gains.","timestamp":1773492667548,"segment":1}
{"run":856,"commit":"ef95ce1","metric":1.457154,"metrics":{"mean_size_pct":-8.319619,"mean_psnr_gap_db":0.241644,"max_size_pct":-0.099307,"min_psnr_gap_db":-0.260447},"status":"discard","description":"EPF X=6.0 (was 5.5) with Y=6. Slightly worse 1.457 vs 1.456. X=5.5 confirmed optimal.","timestamp":1773492721177,"segment":1}
{"run":857,"commit":"ef95ce1","metric":1.456226,"metrics":{"mean_size_pct":-8.319619,"mean_psnr_gap_db":0.243671,"max_size_pct":-0.099307,"min_psnr_gap_db":-0.259678},"status":"discard","description":"Continuing loop. Parity 1.456 plateau confirmed. All quick-iteration parameters exhausted.","timestamp":1773492779844,"segment":1}
{"run":858,"commit":"ef95ce1","metric":1.648949,"metrics":{"mean_size_pct":-8.364178,"mean_psnr_gap_db":0.212759,"max_size_pct":-0.104059,"min_psnr_gap_db":-0.278487},"status":"discard","description":"Default EPF weights (no custom). Much worse: parity 1.649 vs 1.456. 10-byte savings not worth losing custom B=1.5. Custom weights essential.","timestamp":1773492843469,"segment":1}
