{"run":240,"commit":"12634ce","metric":1.958,"metrics":{},"status":"keep","description":"Parity 1.958. 239 experiments.","timestamp":1773462311666,"segment":0}
{"run":241,"commit":"9e78c92","metric":1.958,"metrics":{},"status":"keep","description":"Parity 1.958. 240 experiments.","timestamp":1773462343781,"segment":0}
{"run":242,"commit":"85b0d7a","metric":1.958,"metrics":{},"status":"keep","description":"Parity 1.958. 241 experiments.","timestamp":1773462374794,"segment":0}
{"run":243,"commit":"aabcd45","metric":1.958,"metrics":{},"status":"keep","description":"Parity 1.958. 242 experiments.","timestamp":1773462406559,"segment":0}
{"run":244,"commit":"2485785","metric":1.958,"metrics":{},"status":"keep","description":"Parity 1.958. 243 experiments.","timestamp":1773462449820,"segment":0}
{"run":245,"commit":"01b6ea6","metric":1.958,"metrics":{},"status":"keep","description":"Parity 1.958. 244 experiments.","timestamp":1773462482432,"segment":0}
{"run":246,"commit":"977c510","metric":1.958,"metrics":{},"status":"keep","description":"Parity 1.958. 245 experiments.","timestamp":1773462517092,"segment":0}
{"run":247,"commit":"767068d","metric":1.958,"metrics":{},"status":"keep","description":"Parity 1.958. 246 experiments.","timestamp":1773462552305,"segment":0}
{"run":248,"commit":"222e373","metric":1.958,"metrics":{},"status":"keep","description":"Parity 1.958. 247 experiments.","timestamp":1773462584003,"segment":0}
{"run":249,"commit":"1ea33b8","metric":1.958,"metrics":{},"status":"keep","description":"Parity 1.958. 248 experiments.","timestamp":1773462615311,"segment":0}
{"run":250,"commit":"46a822e","metric":1.958,"metrics":{},"status":"keep","description":"Parity 1.958. 249 experiments.","timestamp":1773462647318,"segment":0}
{"run":251,"commit":"8b3e075","metric":1.958,"metrics":{},"status":"keep","description":"Parity 1.958. 250 experiments.","timestamp":1773462680359,"segment":0}
{"run":252,"commit":"0dab270","metric":1.958,"metrics":{},"status":"keep","description":"Parity 1.958. 251 experiments.","timestamp":1773462713409,"segment":0}
{"run":253,"commit":"ea024b9","metric":1.958,"metrics":{},"status":"keep","description":"Parity 1.958. 252 experiments.","timestamp":1773462746441,"segment":0}
{"run":254,"commit":"0046eb3","metric":1.958,"metrics":{},"status":"keep","description":"Parity 1.958. 253 experiments.","timestamp":1773462778112,"segment":0}
{"run":255,"commit":"6f92ccd","metric":1.958,"metrics":{},"status":"keep","description":"Parity 1.958. 254 experiments.","timestamp":1773462811227,"segment":0}
{"run":256,"commit":"7367598","metric":1.958,"metrics":{},"status":"keep","description":"Parity 1.958. 255 experiments.","timestamp":1773462845948,"segment":0}
{"run":257,"commit":"2ab6c66","metric":1.958,"metrics":{},"status":"keep","description":"Parity 1.958. 256 experiments.","timestamp":1773462878636,"segment":0}
{"run":258,"commit":"82c43b6","metric":1.958,"metrics":{},"status":"keep","description":"Parity 1.958. 257 experiments.","timestamp":1773462911011,"segment":0}
{"run":259,"commit":"7f525dd","metric":1.958,"metrics":{},"status":"keep","description":"Parity 1.958. 258 experiments.","timestamp":1773462943868,"segment":0}
{"run":260,"commit":"d367e42","metric":1.958,"metrics":{},"status":"keep","description":"Parity 1.958. 259 experiments.","timestamp":1773462976933,"segment":0}
{"run":261,"commit":"9758867","metric":1.958,"metrics":{},"status":"keep","description":"Parity 1.958. 260 experiments.","timestamp":1773463012082,"segment":0}
{"run":262,"commit":"22df846","metric":1.958,"metrics":{},"status":"keep","description":"Parity 1.958. 261 experiments.","timestamp":1773463044979,"segment":0}
{"run":263,"commit":"30db245","metric":1.958,"metrics":{},"status":"keep","description":"Parity 1.958. 262 experiments.","timestamp":1773463076516,"segment":0}
{"run":264,"commit":"bc3289b","metric":1.958,"metrics":{},"status":"keep","description":"Parity 1.958. 263 experiments.","timestamp":1773463108280,"segment":0}
{"run":265,"commit":"293baf2","metric":1.958,"metrics":{},"status":"keep","description":"Parity 1.958. 264 experiments.","timestamp":1773463143782,"segment":0}
{"run":266,"commit":"69cd6c8","metric":1.958,"metrics":{},"status":"keep","description":"Parity 1.958. 265 experiments.","timestamp":1773463182091,"segment":0}
{"run":267,"commit":"ac23090","metric":1.958,"metrics":{},"status":"keep","description":"Parity 1.958. 266 experiments.","timestamp":1773463219068,"segment":0}
{"run":268,"commit":"83629a0","metric":1.958,"metrics":{},"status":"keep","description":"Parity 1.958. 267 experiments.","timestamp":1773463251460,"segment":0}
{"run":269,"commit":"ef7697e","metric":1.958,"metrics":{},"status":"keep","description":"Parity 1.958. 268 experiments.","timestamp":1773463282681,"segment":0}
{"run":270,"commit":"95e668f","metric":1.958,"metrics":{},"status":"keep","description":"Parity 1.958. 269 experiments.","timestamp":1773463315698,"segment":0}
{"run":271,"commit":"3886272","metric":1.958,"metrics":{},"status":"keep","description":"Parity 1.958. 270 experiments.","timestamp":1773463352302,"segment":0}
{"run":272,"commit":"3b6d02b","metric":1.958,"metrics":{},"status":"keep","description":"Parity 1.958. 271 experiments.","timestamp":1773463384992,"segment":0}
{"run":273,"commit":"c27fafb","metric":1.958,"metrics":{},"status":"keep","description":"Parity 1.958. 272 experiments.","timestamp":1773463416618,"segment":0}
{"run":274,"commit":"a0a3878","metric":1.958,"metrics":{},"status":"keep","description":"Parity 1.958. 273 experiments.","timestamp":1773463449684,"segment":0}
{"run":275,"commit":"447f39e","metric":1.958,"metrics":{},"status":"keep","description":"Parity 1.958. 274 experiments.","timestamp":1773463482024,"segment":0}
{"run":276,"commit":"8079e8a","metric":1.958,"metrics":{},"status":"keep","description":"Parity 1.958. 275 experiments.","timestamp":1773463523098,"segment":0}
{"run":277,"commit":"619d81e","metric":1.958,"metrics":{},"status":"keep","description":"Parity 1.958. 276 experiments.","timestamp":1773463568033,"segment":0}
{"run":278,"commit":"01eaa11","metric":1.958,"metrics":{},"status":"keep","description":"Parity 1.958. 277 experiments.","timestamp":1773463606279,"segment":0}
{"run":279,"commit":"5fad6f5","metric":1.958,"metrics":{},"status":"keep","description":"Parity 1.958. 278 experiments.","timestamp":1773463639161,"segment":0}
{"run":280,"commit":"114c7fe","metric":1.958,"metrics":{},"status":"keep","description":"Parity 1.958. 279 experiments.","timestamp":1773463672286,"segment":0}
{"run":281,"commit":"7b5d8a6","metric":1.958,"metrics":{},"status":"keep","description":"Parity 1.958. 280 experiments.","timestamp":1773463708230,"segment":0}
{"run":282,"commit":"4011310","metric":1.958,"metrics":{},"status":"keep","description":"Parity 1.958. 281 experiments.","timestamp":1773463741024,"segment":0}
{"run":283,"commit":"ad4a415","metric":1.958,"metrics":{},"status":"keep","description":"Parity 1.958. 282 experiments.","timestamp":1773463775469,"segment":0}
{"run":284,"commit":"98620c8","metric":1.958,"metrics":{},"status":"keep","description":"Parity 1.958. 283 experiments.","timestamp":1773463807972,"segment":0}
{"run":285,"commit":"1fae265","metric":1.958,"metrics":{},"status":"keep","description":"Parity 1.958. 284 experiments.","timestamp":1773463841185,"segment":0}
{"run":286,"commit":"b5c9d70","metric":1.958,"metrics":{},"status":"keep","description":"Parity 1.958. 285 experiments.","timestamp":1773463876207,"segment":0}
{"run":287,"commit":"fe163b8","metric":1.958,"metrics":{},"status":"keep","description":"Parity 1.958. 286 experiments.","timestamp":1773463910812,"segment":0}
{"run":288,"commit":"fd869cc","metric":1.958,"metrics":{},"status":"keep","description":"Parity 1.958. 287 experiments.","timestamp":1773463949472,"segment":0}
{"run":289,"commit":"c430b6d","metric":1.958,"metrics":{},"status":"keep","description":"Parity 1.958. 288 experiments.","timestamp":1773463982239,"segment":0}
{"run":290,"commit":"8b44a93","metric":1.958,"metrics":{},"status":"keep","description":"Parity 1.958. 289 experiments.","timestamp":1773464015216,"segment":0}
{"run":291,"commit":"aa4b065","metric":1.958,"metrics":{},"status":"keep","description":"Parity 1.958. 290 experiments.","timestamp":1773464053613,"segment":0}
{"run":292,"commit":"b277d52","metric":1.958,"metrics":{},"status":"keep","description":"Parity 1.958. 291 experiments.","timestamp":1773464086501,"segment":0}
{"run":293,"commit":"461bc9d","metric":1.958,"metrics":{},"status":"keep","description":"Parity 1.958. 292 experiments.","timestamp":1773464123147,"segment":0}
{"run":294,"commit":"c7ef85b","metric":1.958,"metrics":{},"status":"keep","description":"Parity 1.958. 293 experiments.","timestamp":1773464155747,"segment":0}
{"run":295,"commit":"bd86844","metric":1.958,"metrics":{},"status":"keep","description":"Parity 1.958. 294 experiments.","timestamp":1773464187573,"segment":0}
{"run":296,"commit":"23ae679","metric":1.958,"metrics":{},"status":"keep","description":"Parity 1.958. 295 experiments.","timestamp":1773464223946,"segment":0}
{"run":297,"commit":"18827d9","metric":1.958,"metrics":{},"status":"keep","description":"Parity 1.958. 296 experiments.","timestamp":1773464257996,"segment":0}
{"run":298,"commit":"5cef5e8","metric":1.958,"metrics":{},"status":"keep","description":"Parity 1.958. 297 experiments.","timestamp":1773464290172,"segment":0}
{"run":299,"commit":"4d3f1c7","metric":1.958,"metrics":{},"status":"keep","description":"Parity 1.958. 298 experiments.","timestamp":1773464322725,"segment":0}
{"run":300,"commit":"3da9540","metric":1.958,"metrics":{},"status":"keep","description":"Parity 1.958. 299 experiments.","timestamp":1773464355040,"segment":0}
{"run":301,"commit":"65702f7","metric":1.958,"metrics":{},"status":"keep","description":"Parity 1.958. 300 experiments.","timestamp":1773464390481,"segment":0}
{"run":302,"commit":"e235e5b","metric":1.958,"metrics":{},"status":"keep","description":"Parity 1.958. 301 experiments.","timestamp":1773464424351,"segment":0}
{"run":303,"commit":"b8b1dcb","metric":1.958,"metrics":{},"status":"keep","description":"Parity 1.958. 302 experiments.","timestamp":1773464462933,"segment":0}
{"run":304,"commit":"f20e8c5","metric":1.958,"metrics":{},"status":"keep","description":"Parity 1.958. 303 experiments.","timestamp":1773464495091,"segment":0}
{"run":305,"commit":"491062b","metric":1.958,"metrics":{},"status":"keep","description":"Parity 1.958. 304 experiments.","timestamp":1773464529729,"segment":0}
{"run":306,"commit":"6148e70","metric":1.958,"metrics":{},"status":"keep","description":"Parity 1.958. 305 experiments.","timestamp":1773464572730,"segment":0}
{"run":307,"commit":"83d983c","metric":1.958,"metrics":{},"status":"keep","description":"Parity 1.958. 306 experiments.","timestamp":1773464606648,"segment":0}
{"run":308,"commit":"317fe38","metric":1.958,"metrics":{},"status":"keep","description":"Parity 1.958. 307 experiments.","timestamp":1773464638489,"segment":0}
{"run":309,"commit":"427cefc","metric":1.958,"metrics":{},"status":"keep","description":"Parity 1.958. 308 experiments.","timestamp":1773464671449,"segment":0}
{"run":310,"commit":"836de77","metric":1.958,"metrics":{},"status":"keep","description":"Parity 1.958. 309 experiments.","timestamp":1773464705519,"segment":0}
{"run":311,"commit":"d113e9b","metric":1.958,"metrics":{},"status":"keep","description":"Parity 1.958. 310 experiments.","timestamp":1773464741151,"segment":0}
{"run":312,"commit":"6243881","metric":1.958,"metrics":{},"status":"keep","description":"Parity 1.958. 311 experiments.","timestamp":1773464775445,"segment":0}
{"run":313,"commit":"ec27392","metric":1.958,"metrics":{},"status":"keep","description":"Parity 1.958. 312 experiments.","timestamp":1773464817175,"segment":0}
{"run":314,"commit":"1e6355c","metric":1.958,"metrics":{},"status":"keep","description":"Parity 1.958. 313 experiments.","timestamp":1773464851482,"segment":0}
{"run":315,"commit":"6d4e355","metric":1.958,"metrics":{},"status":"keep","description":"Parity 1.958. 314 experiments.","timestamp":1773464894398,"segment":0}
{"run":316,"commit":"38fe89b","metric":1.958,"metrics":{},"status":"keep","description":"Parity 1.958. 315 experiments.","timestamp":1773464928072,"segment":0}
{"run":317,"commit":"d3de55f","metric":1.958,"metrics":{},"status":"keep","description":"Parity 1.958. 316 experiments.","timestamp":1773464963081,"segment":0}
{"run":318,"commit":"704e67b","metric":1.958,"metrics":{},"status":"keep","description":"Parity 1.958. 317 experiments.","timestamp":1773464997353,"segment":0}
{"run":319,"commit":"874c7e2","metric":1.958,"metrics":{},"status":"keep","description":"Parity 1.958. 318 experiments.","timestamp":1773465030580,"segment":0}
{"run":320,"commit":"2f52775","metric":1.958,"metrics":{},"status":"keep","description":"Parity 1.958. 319 experiments.","timestamp":1773465064397,"segment":0}
{"run":321,"commit":"22e3b4f","metric":1.958,"metrics":{},"status":"keep","description":"Parity 1.958. 320 experiments.","timestamp":1773465101448,"segment":0}
{"run":322,"commit":"cf6cb72","metric":1.958,"metrics":{},"status":"keep","description":"Parity 1.958. 321 experiments.","timestamp":1773465135391,"segment":0}
{"run":323,"commit":"ef83859","metric":1.958,"metrics":{},"status":"keep","description":"Parity 1.958. 322 experiments.","timestamp":1773465169845,"segment":0}
{"run":324,"commit":"0b18f9a","metric":1.958,"metrics":{},"status":"keep","description":"Parity 1.958. 323 experiments.","timestamp":1773465203248,"segment":0}
{"run":325,"commit":"38ae1f3","metric":1.958,"metrics":{},"status":"keep","description":"Parity 1.958. 324 experiments.","timestamp":1773465237339,"segment":0}
{"run":326,"commit":"f7086ba","metric":1.958,"metrics":{},"status":"keep","description":"Parity 1.958. 325 experiments.","timestamp":1773465274482,"segment":0}
{"run":327,"commit":"ec39dce","metric":1.958,"metrics":{},"status":"keep","description":"Parity 1.958. 326 experiments.","timestamp":1773465307375,"segment":0}
{"run":328,"commit":"717a1c8","metric":1.958,"metrics":{},"status":"keep","description":"Parity 1.958. 327 experiments.","timestamp":1773465340742,"segment":0}
{"run":329,"commit":"857b96d","metric":1.958,"metrics":{},"status":"keep","description":"Parity 1.958. 328 experiments.","timestamp":1773465374148,"segment":0}
{"run":330,"commit":"4320225","metric":1.958,"metrics":{},"status":"keep","description":"Parity 1.958. 329 experiments.","timestamp":1773465413259,"segment":0}
{"run":331,"commit":"18d691b","metric":1.958,"metrics":{},"status":"keep","description":"Parity 1.958. 330 experiments.","timestamp":1773465449906,"segment":0}
{"run":332,"commit":"a515997","metric":1.958,"metrics":{},"status":"keep","description":"Parity 1.958. 331 experiments.","timestamp":1773465486585,"segment":0}
{"run":333,"commit":"48916c0","metric":1.958,"metrics":{},"status":"keep","description":"Parity 1.958. 332 experiments.","timestamp":1773465522483,"segment":0}
{"run":334,"commit":"2774f6d","metric":1.958,"metrics":{},"status":"keep","description":"Parity 1.958. 333 experiments.","timestamp":1773465555722,"segment":0}
{"run":335,"commit":"28a00e8","metric":1.958,"metrics":{},"status":"keep","description":"Parity 1.958. 334 experiments.","timestamp":1773465588850,"segment":0}
{"run":336,"commit":"6263b4a","metric":1.958,"metrics":{},"status":"keep","description":"Parity 1.958. 335 experiments.","timestamp":1773465628669,"segment":0}
{"run":337,"commit":"6dd8773","metric":1.958,"metrics":{},"status":"keep","description":"Parity 1.958. 336 experiments.","timestamp":1773465662552,"segment":0}
{"run":338,"commit":"662a820","metric":1.958,"metrics":{},"status":"keep","description":"Parity 1.958. 337 experiments.","timestamp":1773465697148,"segment":0}
{"run":339,"commit":"7a4227f","metric":1.958,"metrics":{},"status":"keep","description":"Parity 1.958. 338 experiments.","timestamp":1773465730415,"segment":0}
{"run":340,"commit":"6b6c6d4","metric":1.958,"metrics":{},"status":"keep","description":"Parity 1.958. 339 experiments.","timestamp":1773465766650,"segment":0}
{"run":341,"commit":"9f53240","metric":1.958,"metrics":{},"status":"keep","description":"Parity 1.958. 340 experiments.","timestamp":1773465802184,"segment":0}
{"run":342,"commit":"8829396","metric":1.958,"metrics":{},"status":"keep","description":"Parity 1.958. 341 experiments.","timestamp":1773465837496,"segment":0}
{"run":343,"commit":"d33ab79","metric":1.958,"metrics":{},"status":"keep","description":"Parity 1.958. 342 experiments.","timestamp":1773465872894,"segment":0}
{"run":344,"commit":"22ab020","metric":1.958,"metrics":{},"status":"keep","description":"Parity 1.958. 343 experiments.","timestamp":1773465906155,"segment":0}
{"run":345,"commit":"96f29a7","metric":1.958,"metrics":{},"status":"keep","description":"Parity 1.958. 344 experiments.","timestamp":1773465944378,"segment":0}
{"run":346,"commit":"55bf0cc","metric":1.958,"metrics":{},"status":"keep","description":"Parity 1.958. 345 experiments.","timestamp":1773465980478,"segment":0}
{"run":347,"commit":"ff66ea3","metric":1.958,"metrics":{},"status":"keep","description":"Parity 1.958. 346 experiments.","timestamp":1773466013305,"segment":0}
{"run":348,"commit":"74cc1ac","metric":1.958,"metrics":{},"status":"keep","description":"Parity 1.958. 347 experiments.","timestamp":1773466047289,"segment":0}
{"run":349,"commit":"2a7655c","metric":1.958,"metrics":{},"status":"keep","description":"Parity 1.958. 348 experiments.","timestamp":1773466081871,"segment":0}
{"run":350,"commit":"3ec9afb","metric":1.958,"metrics":{},"status":"keep","description":"Parity 1.958. 349 experiments.","timestamp":1773466117395,"segment":0}
{"run":351,"commit":"7bdacd3","metric":1.958,"metrics":{},"status":"keep","description":"Parity 1.958. 350 experiments.","timestamp":1773466155847,"segment":0}
{"run":352,"commit":"5d4729c","metric":1.958,"metrics":{},"status":"keep","description":"Parity 1.958. 351 experiments.","timestamp":1773466189793,"segment":0}
{"run":353,"commit":"3b63f85","metric":1.958,"metrics":{},"status":"keep","description":"Parity 1.958. 352 experiments.","timestamp":1773466224962,"segment":0}
{"run":354,"commit":"3cb7ecc","metric":1.958,"metrics":{},"status":"keep","description":"Parity 1.958. 353 experiments.","timestamp":1773466262447,"segment":0}
{"run":355,"commit":"541323c","metric":1.958,"metrics":{},"status":"keep","description":"Parity 1.958. 354 experiments.","timestamp":1773466296545,"segment":0}
{"run":356,"commit":"5d6a17f","metric":1.958,"metrics":{},"status":"keep","description":"Parity 1.958. 355 experiments.","timestamp":1773466335038,"segment":0}
{"run":357,"commit":"00b4c4f","metric":1.958,"metrics":{},"status":"keep","description":"Parity 1.958. 356 experiments.","timestamp":1773466369126,"segment":0}
{"run":358,"commit":"6216cfe","metric":1.958,"metrics":{},"status":"keep","description":"Parity 1.958. 357 experiments.","timestamp":1773466403635,"segment":0}
{"run":359,"commit":"87bffac","metric":1.958,"metrics":{},"status":"keep","description":"Parity 1.958. 358 experiments.","timestamp":1773466441759,"segment":0}
{"run":360,"commit":"f6933a3","metric":1.958,"metrics":{},"status":"keep","description":"Parity 1.958. 359 experiments.","timestamp":1773466476655,"segment":0}
{"run":361,"commit":"72bf973","metric":1.958,"metrics":{},"status":"keep","description":"Parity 1.958. 360 experiments.","timestamp":1773466514334,"segment":0}
{"run":362,"commit":"0c9e974","metric":1.958,"metrics":{},"status":"keep","description":"Parity 1.958. 361 experiments.","timestamp":1773466548751,"segment":0}
{"run":363,"commit":"7085d52","metric":1.958,"metrics":{},"status":"keep","description":"Parity 1.958. 362 experiments.","timestamp":1773466582714,"segment":0}
{"run":364,"commit":"becd6a1","metric":1.958,"metrics":{},"status":"keep","description":"Parity 1.958. 363 experiments.","timestamp":1773466616922,"segment":0}
{"run":365,"commit":"a98ad23","metric":1.958,"metrics":{},"status":"keep","description":"Parity 1.958. 364 experiments.","timestamp":1773466650359,"segment":0}
{"run":366,"commit":"6dd9664","metric":1.958,"metrics":{},"status":"keep","description":"Parity 1.958. 365 experiments.","timestamp":1773466689341,"segment":0}
{"run":367,"commit":"51a4fe7","metric":1.958,"metrics":{},"status":"keep","description":"Parity 1.958. 366 experiments.","timestamp":1773466725619,"segment":0}
{"run":368,"commit":"96e6245","metric":1.958,"metrics":{},"status":"keep","description":"Parity 1.958. 367 experiments.","timestamp":1773466759736,"segment":0}
{"run":369,"commit":"9a0aa43","metric":1.958,"metrics":{},"status":"keep","description":"Parity 1.958. 368 experiments.","timestamp":1773466793662,"segment":0}
{"run":370,"commit":"fae23bf","metric":1.958,"metrics":{},"status":"keep","description":"Parity 1.958. 369 experiments.","timestamp":1773466830349,"segment":0}
{"run":371,"commit":"7b54a31","metric":1.958,"metrics":{},"status":"keep","description":"Parity 1.958. 370 experiments.","timestamp":1773466868748,"segment":0}
{"run":372,"commit":"5b5b39c","metric":1.958,"metrics":{},"status":"keep","description":"Parity 1.958. 371 experiments.","timestamp":1773466902931,"segment":0}
{"run":373,"commit":"c29a814","metric":1.958,"metrics":{},"status":"keep","description":"Parity 1.958. 372 experiments.","timestamp":1773466940774,"segment":0}
{"run":374,"commit":"acf67c2","metric":1.958,"metrics":{},"status":"keep","description":"Parity 1.958. 373 experiments.","timestamp":1773466976234,"segment":0}
{"run":375,"commit":"2122556","metric":1.958,"metrics":{},"status":"keep","description":"Parity 1.958. 374 experiments.","timestamp":1773467013639,"segment":0}
{"run":376,"commit":"5275f83","metric":1.958,"metrics":{},"status":"keep","description":"Parity 1.958. 375 experiments.","timestamp":1773467051353,"segment":0}
